Rank,Term name,P-value,Z-score,Combined score,Overlapping genes,Adjusted p-value,Old p-value,Old adjusted p-value,gene count
2148,Regulation Of B Cell Receptor Signaling Pathway (GO:0050855),0.5377231662060303,1.3979859894921192,0.8673264619872537,['FOXP1'],0.7227139346823029,0,0,1
2149,Regulation Of NMDA Receptor Activity (GO:2000310),0.5377231662060303,1.3979859894921192,0.8673264619872537,['OPRM1'],0.7227139346823029,0,0,1
2150,Regulation Of Adenylate Cyclase Activity (GO:0045761),0.5377231662060303,1.3979859894921192,0.8673264619872537,['CACNA1C'],0.7227139346823029,0,0,1
2151,Regulation Of Amyloid-Beta Clearance (GO:1900221),0.5377231662060303,1.3979859894921192,0.8673264619872537,['CYP51A1'],0.7227139346823029,0,0,1
2152,Cellular Response To Insulin Stimulus (GO:0032869),0.5390121332957131,1.0353386896596772,0.6398571155231922,"['XBP1', 'TBC1D4', 'ENPP1', 'GRB2', 'PTPN2']",0.7241097013744918,0,0,5
2153,Positive Regulation Of Developmental Process (GO:0051094),0.5441532591758653,1.006145648312611,0.6122641219937605,"['SLC6A6', 'GJA1', 'XBP1', 'CEBPB', 'PINK1', 'ZBTB16', 'LCP1', 'SAP30', 'PACSIN1']",0.7306767637145503,0,0,9
2154,Positive Regulation Of Kinase Activity (GO:0033674),0.5465859025431452,1.0401244677366526,0.6283015353303454,"['CDKN1A', 'RASSF2', 'LRRK2', 'IQGAP1']",0.7336025275080004,0,0,4
2155,Regulation Of Protein Catabolic Process (GO:0042176),0.5472331104322897,1.0163829103758433,0.612757341326943,"['CTSA', 'PINK1', 'CYP51A1', 'AZIN2', 'BANP', 'TNFSF13B']",0.7341303583571924,0,0,6
2156,Regulation Of Nitric Oxide Biosynthetic Process (GO:0045428),0.5497050737744811,1.1182456140350878,0.6691284011192407,"['CX3CR1', 'ATP2B4']",0.7343795602042629,0,0,2
2157,Regulation Of Sodium Ion Transmembrane Transporter Activity (GO:2000649),0.5497050737744811,1.1182456140350878,0.6691284011192407,"['FGF13', 'YWHAH']",0.7343795602042629,0,0,2
2158,Cellular Response To Mechanical Stimulus (GO:0071260),0.5497050737744811,1.1182456140350878,0.6691284011192407,"['CASP1', 'TLR5']",0.7343795602042629,0,0,2
2159,Regulation Of Transport (GO:0051049),0.5497050737744811,1.1182456140350878,0.6691284011192407,"['PINK1', 'LRRK2']",0.7343795602042629,0,0,2
2160,Epidermal Growth Factor Receptor Signaling Pathway (GO:0007173),0.5497050737744811,1.1182456140350878,0.6691284011192407,"['GRB2', 'IQGAP1']",0.7343795602042629,0,0,2
2161,Modulation By Host Of Symbiont Process (GO:0051851),0.5497050737744811,1.1182456140350878,0.6691284011192407,"['CX3CR1', 'SAP30']",0.7343795602042629,0,0,2
2162,Multivesicular Body Organization (GO:0036257),0.5497050737744811,1.1182456140350878,0.6691284011192407,"['RAB27A', 'CHMP5']",0.7343795602042629,0,0,2
2163,Positive Regulation Of miRNA Metabolic Process (GO:2000630),0.5497050737744811,1.1182456140350878,0.6691284011192407,"['STAT3', 'HIF1A']",0.7343795602042629,0,0,2
2164,Positive Regulation Of Microtubule Polymerization (GO:0031116),0.5497050737744811,1.1182456140350878,0.6691284011192407,"['HSPA1B', 'HSPA1A']",0.7343795602042629,0,0,2
2165,Endocytosis (GO:0006897),0.5508511719847514,0.9980299949161159,0.5951159160687246,"['CD93', 'SLC11A1', 'LRRK2', 'STAB1', 'TMEM108', 'AP1S1', 'PLD4', 'TBC1D2B', 'CLEC9A', 'IGF2R']",0.7355707797727096,0,0,10
2166,Glycerophospholipid Biosynthetic Process (GO:0046474),0.5543405996891494,1.0163540163540163,0.599624457094273,"['DGKG', 'PGS1', 'INPP4B', 'PLSCR1', 'LIPC']",0.7398885843496449,0,0,5
2167,Regulation Of Protein Phosphorylation (GO:0001932),0.5570067769346768,0.99146110056926,0.5801810972797611,"['NIBAN1', 'CDKN1A', 'PINK1', 'PID1', 'LRRK2', 'LIMK2', 'IGF1', 'FAM20A', 'ATG14', 'PLPP3', 'C1ORF112']",0.7410680388723329,0,0,11
2168,Golgi To Plasma Membrane Transport (GO:0006893),0.5572255038632407,1.0482205623901582,0.6129839410892064,"['GOLGA4', 'GOLPH3', 'GOLGA7']",0.7410680388723329,0,0,3
2169,Response To Ionizing Radiation (GO:0010212),0.5572255038632407,1.0482205623901582,0.6129839410892064,"['CDKN1A', 'GRB2', 'RHOB']",0.7410680388723329,0,0,3
2170,Negative Regulation Of Protein Ubiquitination (GO:0031397),0.5572255038632407,1.0482205623901582,0.6129839410892064,"['NXN', 'HSPA1B', 'HSPA1A']",0.7410680388723329,0,0,3
2171,Positive Regulation Of Cell Growth (GO:0030307),0.5636392452388405,1.016325224071703,0.5827007863833508,"['RIMS2', 'PRR5', 'GOLGA4', 'IGF1']",0.7410680388723329,0,0,4
2172,Regulation Of MAP Kinase Activity (GO:0043405),0.5636392452388405,1.016325224071703,0.5827007863833508,"['PTPN1', 'LRRK2', 'DIRAS2', 'NEK10']",0.7410680388723329,0,0,4
2173,Regulation Of Myoblast Differentiation (GO:0045661),0.5742844593911245,1.0648287385129491,0.5905864227859594,"['BTG1', 'NOTCH1']",0.7410680388723329,0,0,2
2174,Regulation Of Neuronal Synaptic Plasticity (GO:0048168),0.5742844593911245,1.0648287385129491,0.5905864227859594,"['RAB3A', 'GRIN2B']",0.7410680388723329,0,0,2
2175,Homotypic Cell-Cell Adhesion (GO:0034109),0.5742844593911245,1.0648287385129491,0.5905864227859594,"['P2RY12', 'PLPP3']",0.7410680388723329,0,0,2
2176,Melanosome Organization (GO:0032438),0.5742844593911245,1.0648287385129491,0.5905864227859594,"['DTNBP1', 'AP1S1']",0.7410680388723329,0,0,2
2177,Microtubule Polymerization (GO:0046785),0.5742844593911245,1.0648287385129491,0.5905864227859594,"['TPPP', 'FGF13']",0.7410680388723329,0,0,2
2178,Mitotic G2/M Transition Checkpoint (GO:0044818),0.5742844593911245,1.0648287385129491,0.5905864227859594,"['CDKN1A', 'TNFSF13B']",0.7410680388723329,0,0,2
2179,Mitotic Metaphase Plate Congression (GO:0007080),0.5742844593911245,1.0648287385129491,0.5905864227859594,"['MAD1L1', 'CHMP5']",0.7410680388723329,0,0,2
2180,Negative Regulation Of mRNA Catabolic Process (GO:1902373),0.5742844593911245,1.0648287385129491,0.5905864227859594,"['SLC11A1', 'YBX1']",0.7410680388723329,0,0,2
2181,Positive Regulation Of RNA Splicing (GO:0033120),0.5742844593911245,1.0648287385129491,0.5905864227859594,"['SLC38A2', 'HSPA1A']",0.7410680388723329,0,0,2
2182,Positive Regulation Of Catalytic Activity (GO:0043085),0.5742844593911245,1.0648287385129491,0.5905864227859594,"['AZIN2', 'SLC5A3']",0.7410680388723329,0,0,2
2183,Regulation Of Cholesterol Biosynthetic Process (GO:0045540),0.5757311709814111,1.2424596224946487,0.6859799040123651,['ABCG1'],0.7410680388723329,0,0,1
2184,Regulation Of Endothelial Cell Apoptotic Process (GO:2000351),0.5757311709814111,1.2424596224946487,0.6859799040123651,['RGCC'],0.7410680388723329,0,0,1
2185,Regulation Of Immunoglobulin Production (GO:0002637),0.5757311709814111,1.2424596224946487,0.6859799040123651,['XBP1'],0.7410680388723329,0,0,1
2186,Regulation Of Keratinocyte Differentiation (GO:0045616),0.5757311709814111,1.2424596224946487,0.6859799040123651,['ZFP36'],0.7410680388723329,0,0,1
2187,Actin Filament-Based Transport (GO:0099515),0.5757311709814111,1.2424596224946487,0.6859799040123651,['MYO7A'],0.7410680388723329,0,0,1
2188,Adenine Nucleotide Transport (GO:0051503),0.5757311709814111,1.2424596224946487,0.6859799040123651,['SLC25A23'],0.7410680388723329,0,0,1
2189,Apoptotic Cell Clearance (GO:0043277),0.5757311709814111,1.2424596224946487,0.6859799040123651,['XKR4'],0.7410680388723329,0,0,1
2190,Artery Morphogenesis (GO:0048844),0.5757311709814111,1.2424596224946487,0.6859799040123651,['NOTCH1'],0.7410680388723329,0,0,1
2191,Regulation Of Natural Killer Cell Mediated Cytotoxicity (GO:0042269),0.5757311709814111,1.2424596224946487,0.6859799040123651,['NECTIN2'],0.7410680388723329,0,0,1
2192,Carbohydrate Biosynthetic Process (GO:0016051),0.5757311709814111,1.2424596224946487,0.6859799040123651,['ST6GALNAC5'],0.7410680388723329,0,0,1
2193,Regulation Of Protein Sumoylation (GO:0033233),0.5757311709814111,1.2424596224946487,0.6859799040123651,['HDAC4'],0.7410680388723329,0,0,1
2194,Regulation Of Spindle Organization (GO:0090224),0.5757311709814111,1.2424596224946487,0.6859799040123651,['MAP9'],0.7410680388723329,0,0,1
2195,Regulation Of Tubulin Deacetylation (GO:0090043),0.5757311709814111,1.2424596224946487,0.6859799040123651,['TPPP'],0.7410680388723329,0,0,1
2196,Cellular Response To Vascular Endothelial Growth Factor Stimulus (GO:0035924),0.5757311709814111,1.2424596224946487,0.6859799040123651,['NOTCH1'],0.7410680388723329,0,0,1
2197,Cellular Response To Xenobiotic Stimulus (GO:0071466),0.5757311709814111,1.2424596224946487,0.6859799040123651,['PDE4B'],0.7410680388723329,0,0,1
2198,Chondrocyte Differentiation (GO:0002062),0.5757311709814111,1.2424596224946487,0.6859799040123651,['NFIB'],0.7410680388723329,0,0,1
2199,Respiratory System Development (GO:0060541),0.5757311709814111,1.2424596224946487,0.6859799040123651,['CEBPA'],0.7410680388723329,0,0,1
2200,Endosome To Lysosome Transport Via Multivesicular Body Sorting Pathway (GO:0032510),0.5757311709814111,1.2424596224946487,0.6859799040123651,['CHMP5'],0.7410680388723329,0,0,1
2201,Endothelial Cell Development (GO:0001885),0.5757311709814111,1.2424596224946487,0.6859799040123651,['PDE4D'],0.7410680388723329,0,0,1
2202,Extracellular Structure Organization (GO:0043062),0.5757311709814111,1.2424596224946487,0.6859799040123651,['ADAMTS17'],0.7410680388723329,0,0,1
2203,Synaptic Vesicle Localization (GO:0097479),0.5757311709814111,1.2424596224946487,0.6859799040123651,['RAB27A'],0.7410680388723329,0,0,1
2204,Gamma-Aminobutyric Acid Signaling Pathway (GO:0007214),0.5757311709814111,1.2424596224946487,0.6859799040123651,['GABRG2'],0.7410680388723329,0,0,1
2205,Glycerophospholipid Catabolic Process (GO:0046475),0.5757311709814111,1.2424596224946487,0.6859799040123651,['LIPC'],0.7410680388723329,0,0,1
2206,Glycosphingolipid Biosynthetic Process (GO:0006688),0.5757311709814111,1.2424596224946487,0.6859799040123651,['ST6GALNAC5'],0.7410680388723329,0,0,1
2207,Insulin Secretion (GO:0030073),0.5757311709814111,1.2424596224946487,0.6859799040123651,['RIMS2'],0.7410680388723329,0,0,1
2208,Interleukin-6-Mediated Signaling Pathway (GO:0070102),0.5757311709814111,1.2424596224946487,0.6859799040123651,['STAT3'],0.7410680388723329,0,0,1
2209,Keratan Sulfate Metabolic Process (GO:0042339),0.5757311709814111,1.2424596224946487,0.6859799040123651,['B4GAT1'],0.7410680388723329,0,0,1
2210,Lipopolysaccharide-Mediated Signaling Pathway (GO:0031663),0.5757311709814111,1.2424596224946487,0.6859799040123651,['IL18'],0.7410680388723329,0,0,1
2211,Long-Chain fatty-acyl-CoA Biosynthetic Process (GO:0035338),0.5757311709814111,1.2424596224946487,0.6859799040123651,['ACSL1'],0.7410680388723329,0,0,1
2212,Maintenance Of Blood-Brain Barrier (GO:0035633),0.5757311709814111,1.2424596224946487,0.6859799040123651,['GJA1'],0.7410680388723329,0,0,1
2213,Midbody Abscission (GO:0061952),0.5757311709814111,1.2424596224946487,0.6859799040123651,['CHMP5'],0.7410680388723329,0,0,1
2214,Muscle Cell Development (GO:0055001),0.5757311709814111,1.2424596224946487,0.6859799040123651,['IGF1'],0.7410680388723329,0,0,1
2215,Natural Killer Cell Activation (GO:0030101),0.5757311709814111,1.2424596224946487,0.6859799040123651,['FCGR3A'],0.7410680388723329,0,0,1
2216,Natural Killer Cell Mediated Cytotoxicity (GO:0042267),0.5757311709814111,1.2424596224946487,0.6859799040123651,['FCGR3A'],0.7410680388723329,0,0,1
2217,Negative Regulation Of Lipid Biosynthetic Process (GO:0051055),0.5757311709814111,1.2424596224946487,0.6859799040123651,['APOC1'],0.7410680388723329,0,0,1
2218,Negative Regulation Of Lipid Metabolic Process (GO:0045833),0.5757311709814111,1.2424596224946487,0.6859799040123651,['APOC1'],0.7410680388723329,0,0,1
2219,Negative Regulation Of Smoothened Signaling Pathway (GO:0045879),0.5757311709814111,1.2424596224946487,0.6859799040123651,['ENPP1'],0.7410680388723329,0,0,1
2220,Negative Regulation Of Tumor Necrosis Factor-Mediated Signaling Pathway (GO:0010804),0.5757311709814111,1.2424596224946487,0.6859799040123651,['PTPN2'],0.7410680388723329,0,0,1
2221,Negative Regulation Of Vascular Associated Smooth Muscle Cell Proliferation (GO:1904706),0.5757311709814111,1.2424596224946487,0.6859799040123651,['CDKN1A'],0.7410680388723329,0,0,1
2222,Neuron Projection Organization (GO:0106027),0.5757311709814111,1.2424596224946487,0.6859799040123651,['LGMN'],0.7410680388723329,0,0,1
2223,Porphyrin-Containing Compound Biosynthetic Process (GO:0006779),0.5757311709814111,1.2424596224946487,0.6859799040123651,['TSPO'],0.7410680388723329,0,0,1
2224,Positive Regulation Of T Cell Mediated Cytotoxicity (GO:0001916),0.5757311709814111,1.2424596224946487,0.6859799040123651,['NECTIN2'],0.7410680388723329,0,0,1
2225,Positive Regulation Of Amyloid-Beta Formation (GO:1902004),0.5757311709814111,1.2424596224946487,0.6859799040123651,['ABCG1'],0.7410680388723329,0,0,1
2226,Positive Regulation Of calcineurin-NFAT Signaling Cascade (GO:0070886),0.5757311709814111,1.2424596224946487,0.6859799040123651,['IGF1'],0.7410680388723329,0,0,1
2227,Positive Regulation Of Calcineurin-Mediated Signaling (GO:0106058),0.5757311709814111,1.2424596224946487,0.6859799040123651,['IGF1'],0.7410680388723329,0,0,1
2228,Positive Regulation Of Cardiac Muscle Hypertrophy (GO:0010613),0.5757311709814111,1.2424596224946487,0.6859799040123651,['IGF1'],0.7410680388723329,0,0,1
2229,Positive Regulation Of Cell Cycle G2/M Phase Transition (GO:1902751),0.5757311709814111,1.2424596224946487,0.6859799040123651,['TNFSF13B'],0.7410680388723329,0,0,1
2230,Positive Regulation Of Cyclin-Dependent Protein Serine/Threonine Kinase Activity (GO:0045737),0.5757311709814111,1.2424596224946487,0.6859799040123651,['RGCC'],0.7410680388723329,0,0,1
2231,Positive Regulation Of Monooxygenase Activity (GO:0032770),0.5757311709814111,1.2424596224946487,0.6859799040123651,['HIF1A'],0.7410680388723329,0,0,1
2232,"Positive Regulation Of Nuclear-Transcribed mRNA Catabolic Process, Deadenylation-Dependent Decay (GO:1900153)",0.5757311709814111,1.2424596224946487,0.6859799040123651,['ZFP36'],0.7410680388723329,0,0,1
2233,Positive Regulation Of Nuclear-Transcribed mRNA poly(A) Tail Shortening (GO:0060213),0.5757311709814111,1.2424596224946487,0.6859799040123651,['ZFP36'],0.7410680388723329,0,0,1
2234,Positive Regulation Of Peptidyl-Threonine Phosphorylation (GO:0010800),0.5757311709814111,1.2424596224946487,0.6859799040123651,['CALM3'],0.7410680388723329,0,0,1
2235,Positive Regulation Of Phosphoprotein Phosphatase Activity (GO:0032516),0.5757311709814111,1.2424596224946487,0.6859799040123651,['CALM3'],0.7410680388723329,0,0,1
2236,Positive Regulation Of Signaling Receptor Activity (GO:2000273),0.5757311709814111,1.2424596224946487,0.6859799040123651,['HIF1A'],0.7410680388723329,0,0,1
2237,Post-Translational Protein Targeting To Endoplasmic Reticulum Membrane (GO:0006620),0.5757311709814111,1.2424596224946487,0.6859799040123651,['HSPA5'],0.7410680388723329,0,0,1
2238,Protein Deacylation (GO:0035601),0.5757311709814111,1.2424596224946487,0.6859799040123651,['HDAC4'],0.7410680388723329,0,0,1
2239,Protein Heterotetramerization (GO:0051290),0.5757311709814111,1.2424596224946487,0.6859799040123651,['GRIN2B'],0.7410680388723329,0,0,1
2240,Protein Insertion Into Mitochondrial Membrane (GO:0051204),0.5757311709814111,1.2424596224946487,0.6859799040123651,['MOAP1'],0.7410680388723329,0,0,1
2241,Proteoglycan Metabolic Process (GO:0006029),0.5757311709814111,1.2424596224946487,0.6859799040123651,['IGF1'],0.7410680388723329,0,0,1
2242,Receptor Catabolic Process (GO:0032801),0.5757311709814111,1.2424596224946487,0.6859799040123651,['LGMN'],0.7410680388723329,0,0,1
2243,Receptor Recycling (GO:0001881),0.5757311709814111,1.2424596224946487,0.6859799040123651,['NSG1'],0.7410680388723329,0,0,1
2244,Regulation Of Adipose Tissue Development (GO:1904177),0.5757311709814111,1.2424596224946487,0.6859799040123651,['LCP1'],0.7410680388723329,0,0,1
2245,Regulation Of Aerobic Respiration (GO:1903715),0.5757311709814111,1.2424596224946487,0.6859799040123651,['PINK1'],0.7410680388723329,0,0,1
2246,Regulation Of Anoikis (GO:2000209),0.5757311709814111,1.2424596224946487,0.6859799040123651,['NOTCH1'],0.7410680388723329,0,0,1
2247,Sphingolipid Biosynthetic Process (GO:0030148),0.5767659976803351,1.016296532992491,0.5592869306284797,"['ACER3', 'PLPP3', 'ST6GALNAC5']",0.7410802219083773,0,0,3
2248,Negative Regulation Of Kinase Activity (GO:0033673),0.5767659976803351,1.016296532992491,0.5592869306284797,"['PRDX3', 'DTNBP1', 'YWHAG']",0.7410802219083773,0,0,3
2249,Negative Regulation Of Protein Binding (GO:0032091),0.5767659976803351,1.016296532992491,0.5592869306284797,"['CDKN1A', 'LRRK2', 'BAX']",0.7410802219083773,0,0,3
2250,Negative Regulation Of Protein Modification By Small Protein Conjugation Or Removal (GO:1903321),0.5767659976803351,1.016296532992491,0.5592869306284797,"['NXN', 'HSPA1B', 'HSPA1A']",0.7410802219083773,0,0,3
2251,Negative Regulation Of Developmental Process (GO:0051093),0.5803359740998691,0.9935837245696401,0.5406566735219533,"['PINK1', 'NOTCH1', 'NFIB', 'SAP30']",0.7450050182605336,0,0,4
2252,Positive Regulation Of Protein Modification By Small Protein Conjugation Or Removal (GO:1903322),0.5803359740998691,0.9935837245696401,0.5406566735219533,"['HDAC4', 'PINK1', 'LRRK2', 'STUB1']",0.7450050182605336,0,0,4
2253,Vesicle-Mediated Transport (GO:0016192),0.5881477434983092,0.9688770229935054,0.5142577347696186,"['SNAP25', 'RAB3A', 'LRRK2', 'CCZ1', 'TNFAIP2', 'RAB27A', 'DENND3', 'TBC1D2B', 'NSG1', 'ATG14', 'CPLX1', 'RHOB', 'GOLGA4', 'NECAP1', 'NSG2', 'TBC1D4', 'AP1S1', 'VAMP1', 'STX1A', 'WASHC3', 'CHMP5']",0.7543920435366814,0,0,21
2254,Regulation Of Protein Ubiquitination (GO:0031396),0.5881700678421584,0.9717314487632509,0.5157359152531152,"['PINK1', 'NXN', 'LRRK2', 'STUB1', 'HSPA1B', 'HSPA1A']",0.7543920435366814,0,0,6
2255,Regulation Of Peptidyl-Tyrosine Phosphorylation (GO:0050730),0.5957571475206652,0.9862503876770392,0.5108009365685058,"['IL15', 'HCLS1', 'IGF1']",0.7615617303207921,0,0,3
2256,Negative Regulation Of Extrinsic Apoptotic Signaling Pathway (GO:2001237),0.5957571475206652,0.9862503876770392,0.5108009365685058,"['IGF1', 'HSPA1B', 'HSPA1A']",0.7615617303207921,0,0,3
2257,Positive Regulation Of ERK1 And ERK2 Cascade (GO:0070374),0.596661123999407,0.971830985915493,0.5018593115339329,"['NDRG4', 'NOTCH1', 'IGF1', 'OPRM1']",0.7615617303207921,0,0,4
2258,Regulation Of Trans-Synaptic Signaling (GO:0099177),0.5978714702704309,1.016267942583732,0.5227473766507393,"['CX3CR1', 'CACNA1A']",0.7615617303207921,0,0,2
2259,Intracellular Protein Transmembrane Transport (GO:0065002),0.5978714702704309,1.016267942583732,0.5227473766507393,"['HSPA5', 'TIMM17A']",0.7615617303207921,0,0,2
2260,Intracellular Steroid Hormone Receptor Signaling Pathway (GO:0030518),0.5978714702704309,1.016267942583732,0.5227473766507393,"['PMEPA1', 'PPARGC1B']",0.7615617303207921,0,0,2
2261,Positive Regulation Of Endothelial Cell Proliferation (GO:0001938),0.5978714702704309,1.016267942583732,0.5227473766507393,"['EMC10', 'HIF1A']",0.7615617303207921,0,0,2
2262,Positive Regulation Of Transport (GO:0051050),0.5978714702704309,1.016267942583732,0.5227473766507393,"['CEBPB', 'KCTD7']",0.7615617303207921,0,0,2
2263,Regulation Of JUN Kinase Activity (GO:0043506),0.5978714702704309,1.016267942583732,0.5227473766507393,"['PTPN1', 'DUSP10']",0.7615617303207921,0,0,2
2264,Regulation Of Amyloid-Beta Formation (GO:1902003),0.5978714702704309,1.016267942583732,0.5227473766507393,"['IGF1', 'ABCG1']",0.7615617303207921,0,0,2
2265,Cellular Response To Metal Ion (GO:0071248),0.5987530175501017,0.963327859879584,0.4940967264998971,"['LRRK2', 'CACNA1A', 'IQGAP1', 'KCNH1', 'LGMN']",0.7615617303207921,0,0,5
2266,Plasma Membrane Bounded Cell Projection Organization (GO:0120036),0.6013834620060503,0.9576981322564362,0.4870110560878295,"['TMEM108', 'DTNBP1', 'STMN3', 'STMN4', 'CNTN4', 'PHPT1']",0.7615617303207921,0,0,6
2267,Regulation Of GTPase Activity (GO:0043087),0.6103288672026074,0.9482891517812259,0.468224729636607,"['ARHGAP9', 'PREX1', 'ADAP2', 'LRRK2', 'RASGEF1C', 'TBC1D30', 'STMN3', 'PLXNC1', 'RALGPS2']",0.7615617303207921,0,0,9
2268,Regulation Of Dendrite Extension (GO:1903859),0.6106191943561384,1.1180385288966725,0.5515080176845046,['RIMS2'],0.7615617303207921,0,0,1
2269,Regulation Of Dopamine Secretion (GO:0014059),0.6106191943561384,1.1180385288966725,0.5515080176845046,['DTNBP1'],0.7615617303207921,0,0,1
2270,Fc Receptor Mediated Stimulatory Signaling Pathway (GO:0002431),0.6106191943561384,1.1180385288966725,0.5515080176845046,['FCER1G'],0.7615617303207921,0,0,1
2271,Regulation Of Establishment Of Protein Localization (GO:0070201),0.6106191943561384,1.1180385288966725,0.5515080176845046,['KIAA0586'],0.7615617303207921,0,0,1
2272,N-glycan Processing (GO:0006491),0.6106191943561384,1.1180385288966725,0.5515080176845046,['MAN2A1'],0.7615617303207921,0,0,1
2273,Regulation Of Insulin Secretion Involved In Cellular Response To Glucose Stimulus (GO:0061178),0.6106191943561384,1.1180385288966725,0.5515080176845046,['NR1D1'],0.7615617303207921,0,0,1
2274,U2-type Prespliceosome Assembly (GO:1903241),0.6106191943561384,1.1180385288966725,0.5515080176845046,['SNRPG'],0.7615617303207921,0,0,1
2275,Regulation Of miRNA-mediated Gene Silencing (GO:0060964),0.6106191943561384,1.1180385288966725,0.5515080176845046,['ZFP36'],0.7615617303207921,0,0,1
2276,Androgen Receptor Signaling Pathway (GO:0030521),0.6106191943561384,1.1180385288966725,0.5515080176845046,['PMEPA1'],0.7615617303207921,0,0,1
2277,Antigen Processing And Presentation Of Peptide Antigen Via MHC Class I (GO:0002474),0.6106191943561384,1.1180385288966725,0.5515080176845046,['FCER1G'],0.7615617303207921,0,0,1
2278,Antimicrobial Humoral Response (GO:0019730),0.6106191943561384,1.1180385288966725,0.5515080176845046,['SLC11A1'],0.7615617303207921,0,0,1
2279,Artery Development (GO:0060840),0.6106191943561384,1.1180385288966725,0.5515080176845046,['ROBO2'],0.7615617303207921,0,0,1
2280,Regulation Of Neurotransmitter Transport (GO:0051588),0.6106191943561384,1.1180385288966725,0.5515080176845046,['CPLX1'],0.7615617303207921,0,0,1
2281,Regulation Of Peptidase Activity (GO:0052547),0.6106191943561384,1.1180385288966725,0.5515080176845046,['PINK1'],0.7615617303207921,0,0,1
2282,cAMP-mediated Signaling (GO:0019933),0.6106191943561384,1.1180385288966725,0.5515080176845046,['PDE4D'],0.7615617303207921,0,0,1
2283,Calcium-Mediated Signaling Using Intracellular Calcium Source (GO:0035584),0.6106191943561384,1.1180385288966725,0.5515080176845046,['RYR2'],0.7615617303207921,0,0,1
2284,Cardiac Muscle Cell Contraction (GO:0086003),0.6106191943561384,1.1180385288966725,0.5515080176845046,['CACNA1C'],0.7615617303207921,0,0,1
2285,Regulation Of rRNA Processing (GO:2000232),0.6106191943561384,1.1180385288966725,0.5515080176845046,['TRMT112'],0.7615617303207921,0,0,1
2286,Cellular Response To Cadmium Ion (GO:0071276),0.6106191943561384,1.1180385288966725,0.5515080176845046,['SLC11A1'],0.7615617303207921,0,0,1
2287,Cellular Response To Chemokine (GO:1990869),0.6106191943561384,1.1180385288966725,0.5515080176845046,['CXCL12'],0.7615617303207921,0,0,1
2288,Regulation Of Transcription Regulatory Region DNA Binding (GO:2000677),0.6106191943561384,1.1180385288966725,0.5515080176845046,['IGF1'],0.7615617303207921,0,0,1
2289,Chaperone-Mediated Protein Complex Assembly (GO:0051131),0.6106191943561384,1.1180385288966725,0.5515080176845046,['HSPA1A'],0.7615617303207921,0,0,1
2290,Defense Response To Gram-negative Bacterium (GO:0050829),0.6106191943561384,1.1180385288966725,0.5515080176845046,['SLC11A1'],0.7615617303207921,0,0,1
2291,Signal Peptide Processing (GO:0006465),0.6106191943561384,1.1180385288966725,0.5515080176845046,['PCSK5'],0.7615617303207921,0,0,1
2292,Endosomal Lumen Acidification (GO:0048388),0.6106191943561384,1.1180385288966725,0.5515080176845046,['ATP6V1F'],0.7615617303207921,0,0,1
2293,Spermatid Development (GO:0007286),0.6106191943561384,1.1180385288966725,0.5515080176845046,['NECTIN2'],0.7615617303207921,0,0,1
2294,Translesion Synthesis (GO:0019985),0.6106191943561384,1.1180385288966725,0.5515080176845046,['TNFSF13B'],0.7615617303207921,0,0,1
2295,Glycolipid Metabolic Process (GO:0006664),0.6106191943561384,1.1180385288966725,0.5515080176845046,['UGCG'],0.7615617303207921,0,0,1
2296,Water-Soluble Vitamin Metabolic Process (GO:0006767),0.6106191943561384,1.1180385288966725,0.5515080176845046,['SLC25A19'],0.7615617303207921,0,0,1
2297,"Wound Healing, Spreading Of Cells (GO:0044319)",0.6106191943561384,1.1180385288966725,0.5515080176845046,['LCP1'],0.7615617303207921,0,0,1
2298,Immunoglobulin Mediated Immune Response (GO:0016064),0.6106191943561384,1.1180385288966725,0.5515080176845046,['FCER1G'],0.7615617303207921,0,0,1
2299,Intracellular Estrogen Receptor Signaling Pathway (GO:0030520),0.6106191943561384,1.1180385288966725,0.5515080176845046,['PPARGC1B'],0.7615617303207921,0,0,1
2300,Keratinocyte Differentiation (GO:0030216),0.6106191943561384,1.1180385288966725,0.5515080176845046,['UGCG'],0.7615617303207921,0,0,1
2301,Mitotic Cytokinetic Process (GO:1902410),0.6106191943561384,1.1180385288966725,0.5515080176845046,['CHMP5'],0.7615617303207921,0,0,1
2302,Negative Regulation Of Interleukin-6 Production (GO:0032715),0.6106191943561384,1.1180385288966725,0.5515080176845046,['LILRB4'],0.7615617303207921,0,0,1
2303,Negative Regulation Of Receptor Signaling Pathway Via JAK-STAT (GO:0046426),0.6106191943561384,1.1180385288966725,0.5515080176845046,['PTPN2'],0.7615617303207921,0,0,1
2304,Negative Regulation Of Signaling Receptor Activity (GO:2000272),0.6106191943561384,1.1180385288966725,0.5515080176845046,['LILRB4'],0.7615617303207921,0,0,1
2305,Negative Regulation Of Stem Cell Population Maintenance (GO:1902455),0.6106191943561384,1.1180385288966725,0.5515080176845046,['SAP30'],0.7615617303207921,0,0,1
2306,Neuron Apoptotic Process (GO:0051402),0.6106191943561384,1.1180385288966725,0.5515080176845046,['NLRP1'],0.7615617303207921,0,0,1
2307,Phospholipid Dephosphorylation (GO:0046839),0.6106191943561384,1.1180385288966725,0.5515080176845046,['PLPP3'],0.7615617303207921,0,0,1
