Rank,Term name,P-value,Z-score,Combined score,Overlapping genes,Adjusted p-value,Old p-value,Old adjusted p-value,gene count
565,Negative Regulation Of Cytoskeleton Organization (GO:0051494),0.08481060600882764,3.3659050966608084,8.304814351510627,"['SSH2', 'PFN1', 'PFN2']",0.43166806685126885,0,0,3
566,Polyol Metabolic Process (GO:0019751),0.08481060600882764,3.3659050966608084,8.304814351510627,"['INPP4B', 'IMPA2', 'SLC5A3']",0.43166806685126885,0,0,3
567,Positive Regulation Of Protein Autophosphorylation (GO:0031954),0.08481060600882764,3.3659050966608084,8.304814351510627,"['RASSF2', 'NEK10', 'CALM3']",0.43166806685126885,0,0,3
568,Regulation Of Cardiac Muscle Contraction By Calcium Ion Signaling (GO:0010882),0.08481060600882764,3.3659050966608084,8.304814351510627,"['RYR2', 'CALM3', 'CACNA1C']",0.43166806685126885,0,0,3
569,Neuron Projection Morphogenesis (GO:0048812),0.08666303644450211,1.674615792262851,4.095654438803939,"['RAB3A', 'NRN1', 'LRRK2', 'EPB41L3', 'DTNBP1', 'CCK', 'IQGAP1', 'CNTN4', 'NBL1', 'PACSIN1', 'ZNF365']",0.4403213327962313,0,0,11
570,Positive Regulation Of Tumor Necrosis Factor Superfamily Cytokine Production (GO:1903557),0.08709200300919162,2.107553003533569,5.144094744909709,"['FCGR3A', 'OAS1', 'STAT3', 'LY96', 'LCP1', 'TLR2']",0.4417245275431104,0,0,6
571,Adenylate Cyclase-Activating G Protein-Coupled Receptor Signaling Pathway (GO:0007189),0.08803011320217664,2.6416735708367853,6.419468409631817,"['ADGRE2', 'GPR65', 'RAMP1', 'ADGRL2']",0.44492142878932284,0,0,4
572,Regulation Of Reactive Oxygen Species Metabolic Process (GO:2000377),0.08803011320217664,2.6416735708367853,6.419468409631817,"['CDKN1A', 'PINK1', 'PID1', 'GRB2']",0.44492142878932284,0,0,4
573,Modulation Of Chemical Synaptic Transmission (GO:0050804),0.09115950399930081,1.7060282540709586,4.086184216213782,"['RIMS2', 'CX3CR1', 'SLC38A1', 'GRM7', 'LRRK2', 'TMEM108', 'CACNA1A', 'SYN3', 'CPLX1', 'DLGAP2']",0.4591326238013565,0,0,10
574,Receptor-Mediated Endocytosis (GO:0006898),0.09115950399930081,1.7060282540709586,4.086184216213782,"['FCER1G', 'STAB1', 'TMEM108', 'AP1S1', 'GRB2', 'CLEC9A', 'STON2', 'LILRB4', 'RAMP1', 'IGF2R']",0.4591326238013565,0,0,10
575,Monoatomic Cation Homeostasis (GO:0055080),0.09477184016872388,2.2465608465608464,5.2935330379428045,"['SLC12A5', 'SLC11A1', 'TMTC2', 'FAM20A', 'HAMP']",0.4754469500107917,0,0,5
576,Positive Regulation Of Lymphocyte Proliferation (GO:0050671),0.09477184016872388,2.2465608465608464,5.2935330379428045,"['FCGR3A', 'IL15', 'IL18', 'TNFSF13B', 'CD276']",0.4754469500107917,0,0,5
577,Cellular Response To Hormone Stimulus (GO:0032870),0.0961723683635593,2.0433665274654675,4.7847740203133915,"['ROBO2', 'XBP1', 'STAT3', 'RAMP1', 'HSPA1B', 'HSPA1A']",0.4754469500107917,0,0,6
578,Negative Regulation Of Neuron Death (GO:1901215),0.0961723683635593,2.0433665274654675,4.7847740203133915,"['PINK1', 'PTPRZ1', 'VSTM2L', 'TNFRSF1B', 'CPEB4', 'LGMN']",0.4754469500107917,0,0,6
579,Positive Regulation Of Synaptic Transmission (GO:0050806),0.0961723683635593,2.0433665274654675,4.7847740203133915,"['RIMS2', 'TSHZ3', 'DTNBP1', 'CACNG3', 'GRIN2B', 'LGMN']",0.4754469500107917,0,0,6
580,Regulation Of Epithelial Cell Proliferation (GO:0050678),0.10094693394095129,2.4945226917057903,5.720340420883153,"['ZFP36', 'DUSP10', 'IGF1', 'NR1D1']",0.4754469500107917,0,0,4
581,Actin Filament Polymerization (GO:0030041),0.10094693394095129,2.4945226917057903,5.720340420883153,"['PREX1', 'INF2', 'PSTPIP2', 'WASHC3']",0.4754469500107917,0,0,4
582,Regulation Of Mitotic Spindle Organization (GO:0060236),0.10094693394095129,2.4945226917057903,5.720340420883153,"['MAP9', 'HSPA1B', 'CHMP5', 'HSPA1A']",0.4754469500107917,0,0,4
583,Positive Regulation Of Biosynthetic Process (GO:0009891),0.10094693394095129,2.4945226917057903,5.720340420883153,"['RGCC', 'RAB27A', 'SLC5A3', 'RUNX1']",0.4754469500107917,0,0,4
584,Positive Regulation Of Cell Death (GO:0010942),0.10094693394095129,2.4945226917057903,5.720340420883153,"['C1QA', 'SLC6A6', 'LRRK2', 'GRIN2B']",0.4754469500107917,0,0,4
585,Positive Regulation Of Exocytosis (GO:0045921),0.10094693394095129,2.4945226917057903,5.720340420883153,"['RAB3A', 'RAB15', 'RAB27A', 'UNC13D']",0.4754469500107917,0,0,4
586,Aortic Valve Morphogenesis (GO:0003180),0.1016245722314522,3.059434414443202,6.995304762084296,"['ROBO2', 'NOTCH1', 'SMAD6']",0.4754469500107917,0,0,3
587,Regulation Of Phosphatidylinositol 3-Kinase Activity (GO:0043551),0.1016245722314522,3.059434414443202,6.995304762084296,"['P2RY12', 'PIK3IP1', 'ATG14']",0.4754469500107917,0,0,3
588,Cardiac Muscle Cell Action Potential Involved In Contraction (GO:0086002),0.1016245722314522,3.059434414443202,6.995304762084296,"['RYR2', 'GJA1', 'CACNA1C']",0.4754469500107917,0,0,3
589,Cellular Defense Response (GO:0006968),0.1016245722314522,3.059434414443202,6.995304762084296,"['CX3CR1', 'LY96', 'TCIRG1']",0.4754469500107917,0,0,3
590,Regulation Of Ruffle Assembly (GO:1900027),0.1016245722314522,3.059434414443202,6.995304762084296,"['P2RY12', 'PFN1', 'PFN2']",0.4754469500107917,0,0,3
591,Cellular Response To Epidermal Growth Factor Stimulus (GO:0071364),0.1016245722314522,3.059434414443202,6.995304762084296,"['ZFP36', 'DUSP3', 'IQGAP1']",0.4754469500107917,0,0,3
592,Cellular Response To Radiation (GO:0071478),0.1016245722314522,3.059434414443202,6.995304762084296,"['CDKN1A', 'GRB2', 'RHOB']",0.4754469500107917,0,0,3
593,Triglyceride Metabolic Process (GO:0006641),0.1016245722314522,3.059434414443202,6.995304762084296,"['LIPC', 'APOC1', 'LCP1']",0.4754469500107917,0,0,3
594,Intrinsic Apoptotic Signaling Pathway In Response To Endoplasmic Reticulum Stress (GO:0070059),0.1016245722314522,3.059434414443202,6.995304762084296,"['CEBPB', 'CASP4', 'BAX']",0.4754469500107917,0,0,3
595,Negative Regulation Of Macroautophagy (GO:0016242),0.1016245722314522,3.059434414443202,6.995304762084296,"['PINK1', 'LRRK2', 'TMEM39A']",0.4754469500107917,0,0,3
596,Negative Regulation Of Mitotic Cell Cycle (GO:0045930),0.1016245722314522,3.059434414443202,6.995304762084296,"['BTG1', 'RGCC', 'BCL6']",0.4754469500107917,0,0,3
597,Organophosphate Ester Transport (GO:0015748),0.1016245722314522,3.059434414443202,6.995304762084296,"['PRELID1', 'SLC25A19', 'PLTP']",0.4754469500107917,0,0,3
598,Positive Regulation Of Neuron Differentiation (GO:0045666),0.1016245722314522,3.059434414443202,6.995304762084296,"['PCP4', 'TCF4', 'NBL1']",0.4754469500107917,0,0,3
599,Regulation Of Calcium Ion Transmembrane Transporter Activity (GO:1901019),0.1016245722314522,3.059434414443202,6.995304762084296,"['CACNB4', 'PDE4D', 'CACNA1A']",0.4754469500107917,0,0,3
600,Regulation Of Cellular Metabolic Process (GO:0031323),0.10578027612328336,2.1598154931488267,4.851790523898286,"['PINK1', 'PID1', 'PGAM1', 'STUB1', 'HIF1A']",0.4754469500107917,0,0,5
601,Regulation Of Immune Response (GO:0050776),0.10578027612328336,2.1598154931488267,4.851790523898286,"['FCGR3A', 'PLSCR1', 'BCL6', 'IL15', 'CD276']",0.4754469500107917,0,0,5
602,Regulation Of Interleukin-8 Production (GO:0032677),0.10578027612328336,2.1598154931488267,4.851790523898286,"['STAT3', 'TLR5', 'HSPA1B', 'TLR2', 'HSPA1A']",0.4754469500107917,0,0,5
603,Calcium Ion Transmembrane Import Into Cytosol (GO:0097553),0.10578027612328336,2.1598154931488267,4.851790523898286,"['RYR2', 'ATP2B4', 'CACNA1A', 'CACNA1C', 'GRIN2B']",0.4754469500107917,0,0,5
604,Second-Messenger-Mediated Signaling (GO:0019932),0.10578027612328336,2.1598154931488267,4.851790523898286,"['P2RY12', 'CHRM3', 'RYR2', 'FCGR3A', 'LRRK2']",0.4754469500107917,0,0,5
605,Inorganic Cation Import Across Plasma Membrane (GO:0098659),0.10578027612328336,2.1598154931488267,4.851790523898286,"['SLC12A5', 'ATP2B4', 'CACNA1A', 'CACNA1C', 'SLC6A1']",0.4754469500107917,0,0,5
606,Phospholipid Transport (GO:0015914),0.10578027612328336,2.1598154931488267,4.851790523898286,"['PRELID1', 'APOC1', 'ATP11A', 'PLTP', 'ABCG1']",0.4754469500107917,0,0,5
607,Regulation Of Collagen Biosynthetic Process (GO:0032965),0.1072263616074148,4.4835087719298246,10.010837344372218,"['RGCC', 'RUNX1']",0.4754469500107917,0,0,2
608,Regulation Of High Voltage-Gated Calcium Channel Activity (GO:1901841),0.1072263616074148,4.4835087719298246,10.010837344372218,"['PDE4B', 'CALM3']",0.4754469500107917,0,0,2
609,SNARE Complex Assembly (GO:0035493),0.1072263616074148,4.4835087719298246,10.010837344372218,"['VAMP1', 'STXBP6']",0.4754469500107917,0,0,2
610,Regulation Of Inclusion Body Assembly (GO:0090083),0.1072263616074148,4.4835087719298246,10.010837344372218,"['HSPA1B', 'HSPA1A']",0.4754469500107917,0,0,2
611,Acute Inflammatory Response (GO:0002526),0.1072263616074148,4.4835087719298246,10.010837344372218,"['CEBPB', 'PLSCR1']",0.4754469500107917,0,0,2
612,Regulation Of Lipopolysaccharide-Mediated Signaling Pathway (GO:0031664),0.1072263616074148,4.4835087719298246,10.010837344372218,"['LY96', 'CD55']",0.4754469500107917,0,0,2
613,Adipose Tissue Development (GO:0060612),0.1072263616074148,4.4835087719298246,10.010837344372218,"['XBP1', 'SH3PXD2B']",0.4754469500107917,0,0,2
614,Regulation Of Macrophage Differentiation (GO:0045649),0.1072263616074148,4.4835087719298246,10.010837344372218,"['ID2', 'PTPN2']",0.4754469500107917,0,0,2
615,Calcium Import Into The Mitochondrion (GO:0036444),0.1072263616074148,4.4835087719298246,10.010837344372218,"['SMDT1', 'SLC25A23']",0.4754469500107917,0,0,2
616,Regulation Of Protein Lipidation (GO:1903059),0.1072263616074148,4.4835087719298246,10.010837344372218,"['TSPO', 'SVIP']",0.4754469500107917,0,0,2
617,Cardiac Ventricle Development (GO:0003231),0.1072263616074148,4.4835087719298246,10.010837344372218,"['NOTCH1', 'SALL1']",0.4754469500107917,0,0,2
618,Regulation Of Protein Processing (GO:0070613),0.1072263616074148,4.4835087719298246,10.010837344372218,"['LRRK2', 'RUNX1']",0.4754469500107917,0,0,2
619,Regulation Of Receptor Signaling Pathway Via STAT (GO:1904892),0.1072263616074148,4.4835087719298246,10.010837344372218,"['PTPRT', 'JAK3']",0.4754469500107917,0,0,2
620,Cellular Response To ATP (GO:0071318),0.1072263616074148,4.4835087719298246,10.010837344372218,"['P2RY12', 'PDXP']",0.4754469500107917,0,0,2
621,Regulation Of Transmembrane Transporter Activity (GO:0022898),0.1072263616074148,4.4835087719298246,10.010837344372218,"['CHRM3', 'PIM1']",0.4754469500107917,0,0,2
622,Regulation Of Vasoconstriction (GO:0019229),0.1072263616074148,4.4835087719298246,10.010837344372218,"['CHRM3', 'KCNMB2']",0.4754469500107917,0,0,2
623,Chondroitin Sulfate Metabolic Process (GO:0030204),0.1072263616074148,4.4835087719298246,10.010837344372218,"['DSE', 'CHST15']",0.4754469500107917,0,0,2
624,Response To Ethanol (GO:0045471),0.1072263616074148,4.4835087719298246,10.010837344372218,"['OPRM1', 'GRIN2B']",0.4754469500107917,0,0,2
625,Response To Iron Ion (GO:0010039),0.1072263616074148,4.4835087719298246,10.010837344372218,"['HAMP', 'HIF1A']",0.4754469500107917,0,0,2
626,Response To Muramyl Dipeptide (GO:0032495),0.1072263616074148,4.4835087719298246,10.010837344372218,"['NLRP1', 'CHMP5']",0.4754469500107917,0,0,2
627,Response To Organophosphorus (GO:0046683),0.1072263616074148,4.4835087719298246,10.010837344372218,"['STAT1', 'ENPP1']",0.4754469500107917,0,0,2
628,Reverse Cholesterol Transport (GO:0043691),0.1072263616074148,4.4835087719298246,10.010837344372218,"['LIPC', 'ABCG1']",0.4754469500107917,0,0,2
629,Self Proteolysis (GO:0097264),0.1072263616074148,4.4835087719298246,10.010837344372218,"['NLRP1', 'LGMN']",0.4754469500107917,0,0,2
630,Extracellular Matrix Disassembly (GO:0022617),0.1072263616074148,4.4835087719298246,10.010837344372218,"['SH3PXD2B', 'LCP1']",0.4754469500107917,0,0,2
631,Heart Trabecula Morphogenesis (GO:0061384),0.1072263616074148,4.4835087719298246,10.010837344372218,"['NOTCH1', 'RBPJ']",0.4754469500107917,0,0,2
632,Ionotropic Glutamate Receptor Signaling Pathway (GO:0035235),0.1072263616074148,4.4835087719298246,10.010837344372218,"['GRIN2B', 'CPEB4']",0.4754469500107917,0,0,2
633,Leukocyte Adhesion To Vascular Endothelial Cell (GO:0061756),0.1072263616074148,4.4835087719298246,10.010837344372218,"['CX3CR1', 'GOLPH3']",0.4754469500107917,0,0,2
634,Leukocyte Tethering Or Rolling (GO:0050901),0.1072263616074148,4.4835087719298246,10.010837344372218,"['CX3CR1', 'GOLPH3']",0.4754469500107917,0,0,2
635,Lipid Catabolic Process (GO:0016042),0.1072263616074148,4.4835087719298246,10.010837344372218,"['LIPC', 'LCP1']",0.4754469500107917,0,0,2
636,Membrane Depolarization During Action Potential (GO:0086010),0.1072263616074148,4.4835087719298246,10.010837344372218,"['CACNA1C', 'YWHAH']",0.4754469500107917,0,0,2
637,Negative Regulation Of Endoplasmic Reticulum Unfolded Protein Response (GO:1900102),0.1072263616074148,4.4835087719298246,10.010837344372218,"['PTPN1', 'HSPA5']",0.4754469500107917,0,0,2
638,Negative Regulation Of Glucose Transmembrane Transport (GO:0010829),0.1072263616074148,4.4835087719298246,10.010837344372218,"['PID1', 'ENPP1']",0.4754469500107917,0,0,2
639,Negative Regulation Of Inclusion Body Assembly (GO:0090084),0.1072263616074148,4.4835087719298246,10.010837344372218,"['HSPA1B', 'HSPA1A']",0.4754469500107917,0,0,2
640,Negative Regulation Of Leukocyte Activation (GO:0002695),0.1072263616074148,4.4835087719298246,10.010837344372218,"['LRFN5', 'LILRB4']",0.4754469500107917,0,0,2
641,Negative Regulation Of Oxidative Stress-Induced Neuron Death (GO:1903204),0.1072263616074148,4.4835087719298246,10.010837344372218,"['PINK1', 'HIF1A']",0.4754469500107917,0,0,2
642,Negative Regulation Of Pathway-Restricted SMAD Protein Phosphorylation (GO:0060394),0.1072263616074148,4.4835087719298246,10.010837344372218,"['PMEPA1', 'SMAD6']",0.4754469500107917,0,0,2
643,Platelet-Derived Growth Factor Receptor Signaling Pathway (GO:0048008),0.1072263616074148,4.4835087719298246,10.010837344372218,"['PTPN1', 'PLAT']",0.4754469500107917,0,0,2
644,Positive Regulation Of ATP Metabolic Process (GO:1903580),0.1072263616074148,4.4835087719298246,10.010837344372218,"['PINK1', 'PID1']",0.4754469500107917,0,0,2
645,Positive Regulation Of Collagen Metabolic Process (GO:0010714),0.1072263616074148,4.4835087719298246,10.010837344372218,"['RGCC', 'RUNX1']",0.4754469500107917,0,0,2
646,Positive Regulation Of Interleukin-17 Production (GO:0032740),0.1072263616074148,4.4835087719298246,10.010837344372218,"['IL15', 'IL18']",0.4754469500107917,0,0,2
647,Positive Regulation Of Lyase Activity (GO:0051349),0.1072263616074148,4.4835087719298246,10.010837344372218,"['CACNA1C', 'ISCU']",0.4754469500107917,0,0,2
648,Positive Regulation Of Microtubule Nucleation (GO:0090063),0.1072263616074148,4.4835087719298246,10.010837344372218,"['HSPA1B', 'HSPA1A']",0.4754469500107917,0,0,2
649,Positive Regulation Of Reactive Oxygen Species Biosynthetic Process (GO:1903428),0.1072263616074148,4.4835087719298246,10.010837344372218,"['RAB27A', 'SLC5A3']",0.4754469500107917,0,0,2
650,Regulation Of Cartilage Development (GO:0061035),0.1072263616074148,4.4835087719298246,10.010837344372218,"['ZBTB16', 'TRPS1']",0.4754469500107917,0,0,2
651,Regulation Of Cell Communication By Electrical Coupling (GO:0010649),0.1072263616074148,4.4835087719298246,10.010837344372218,"['PDE4D', 'CALM3']",0.4754469500107917,0,0,2
652,Regulation Of Cell-Cell Adhesion Mediated By Cadherin (GO:2000047),0.1072263616074148,4.4835087719298246,10.010837344372218,"['NOTCH1', 'RGCC']",0.4754469500107917,0,0,2
653,Neuron Projection Guidance (GO:0097485),0.10759935344603545,1.7641496314837992,3.932890468751923,"['ROBO2', 'RPS6KA5', 'NOTCH1', 'CXCL12', 'DSCAM', 'CNTN5', 'ARHGEF25', 'CNTN4']",0.4763701850114678,0,0,8
654,Regulation Of Cytokine Production Involved In Inflammatory Response (GO:1900015),0.11467986973503251,2.3628613787991104,5.11703805908212,"['STAT3', 'PLD4', 'HIF1A', 'LILRB4']",0.4985556442165097,0,0,4
655,Regulation Of Primary Metabolic Process (GO:0080090),0.11467986973503251,2.3628613787991104,5.11703805908212,"['ID2', 'NR1D2', 'NR1D1', 'PPARD']",0.4985556442165097,0,0,4
656,Regulation Of Protein Modification By Small Protein Conjugation Or Removal (GO:1903320),0.11467986973503251,2.3628613787991104,5.11703805908212,"['PINK1', 'HIF1A', 'HSPA1B', 'HSPA1A']",0.4985556442165097,0,0,4
657,Synaptic Vesicle Cycle (GO:0099504),0.11467986973503251,2.3628613787991104,5.11703805908212,"['SNAP25', 'RAB3A', 'CPLX1', 'STX1A']",0.4985556442165097,0,0,4
658,Intrinsic Apoptotic Signaling Pathway In Response To DNA Damage (GO:0008630),0.11467986973503251,2.3628613787991104,5.11703805908212,"['MOAP1', 'BAX', 'TNFRSF1B', 'IKBKE']",0.4985556442165097,0,0,4
659,Learning (GO:0007612),0.11467986973503251,2.3628613787991104,5.11703805908212,"['SLC6A1', 'FGF13', 'LGMN', 'TLR2']",0.4985556442165097,0,0,4
660,Monoatomic Anion Transmembrane Transport (GO:0098656),0.11467986973503251,2.3628613787991104,5.11703805908212,"['SLC12A5', 'GLRB', 'SLC6A1', 'GABRG2']",0.4985556442165097,0,0,4
661,Monocarboxylic Acid Biosynthetic Process (GO:0072330),0.11467986973503251,2.3628613787991104,5.11703805908212,"['XBP1', 'LIPC', 'DSE', 'LCP1']",0.4985556442165097,0,0,4
662,Negative Regulation Of Epithelial Cell Proliferation (GO:0050680),0.11467986973503251,2.3628613787991104,5.11703805908212,"['DUSP10', 'RGCC', 'STAT1', 'NFIB']",0.4985556442165097,0,0,4
663,Neurotransmitter Transport (GO:0006836),0.11467986973503251,2.3628613787991104,5.11703805908212,"['SNAP25', 'SLC38A1', 'SYN3', 'SLC38A2']",0.4985556442165097,0,0,4
664,Positive Regulation Of Phosphatidylinositol 3-Kinase Signaling (GO:0014068),0.11467986973503251,2.3628613787991104,5.11703805908212,"['IL18', 'HCLS1', 'IGF1', 'PIK3AP1']",0.4985556442165097,0,0,4
665,Positive Regulation Of Stress Fiber Assembly (GO:0051496),0.11467986973503251,2.3628613787991104,5.11703805908212,"['RGCC', 'GPR65', 'PXN', 'PFN2']",0.4985556442165097,0,0,4
666,Fatty Acid Metabolic Process (GO:0006631),0.1157747626058962,1.9259969712266531,4.152658781721514,"['XBP1', 'LIPC', 'ACSL1', 'TSPO', 'LCP1', 'PPARD']",0.501055147744979,0,0,6
667,Positive Regulation Of Endothelial Cell Migration (GO:0010595),0.1157747626058962,1.9259969712266531,4.152658781721514,"['EMC10', 'PLPP3', 'HIF1A', 'FOXP1', 'RHOB', 'LGMN']",0.501055147744979,0,0,6
668,Positive Regulation Of Protein Kinase B Signaling (GO:0051897),0.1157747626058962,1.9259969712266531,4.152658781721514,"['CX3CR1', 'P2RY12', 'PINK1', 'IL18', 'HCLS1', 'IGF1']",0.501055147744979,0,0,6
669,Regulation Of Mitochondrion Organization (GO:0010821),0.11738621310520178,2.07949572147103,4.454874183765433,"['GOLPH3', 'PINK1', 'PID1', 'INF2', 'LRRK2']",0.5041774887186509,0,0,5
670,Regulation Of Secretion By Cell (GO:1903530),0.11738621310520178,2.07949572147103,4.454874183765433,"['RIMS2', 'RAB3C', 'RAB3A', 'CPLX1', 'STXBP5L']",0.5041774887186509,0,0,5
671,Response To Metal Ion (GO:0010038),0.11738621310520178,2.07949572147103,4.454874183765433,"['PLSCR1', 'IMPA2', 'CALM3', 'HIF1A', 'HAMP']",0.5041774887186509,0,0,5
672,Pattern Recognition Receptor Signaling Pathway (GO:0002221),0.11738621310520178,2.07949572147103,4.454874183765433,"['CASP1', 'LY96', 'NLRP1', 'TLR5', 'TLR2']",0.5041774887186509,0,0,5
673,Positive Regulation Of Interleukin-6 Production (GO:0032755),0.11738621310520178,2.07949572147103,4.454874183765433,"['XBP1', 'STAT3', 'LCP1', 'AIF1', 'TLR2']",0.5041774887186509,0,0,5
674,Regulation Of MAPK Cascade (GO:0043408),0.11807404275942876,1.6075241484494154,3.434384309533034,"['DUSP3', 'DOK3', 'NEK10', 'SLA', 'GRB2', 'IQGAP1', 'IGF1', 'PRDM11', 'LILRB4', 'GSDME']",0.5041774887186509,0,0,10
675,T Cell Differentiation (GO:0030217),0.11963533630612055,2.804042179261863,5.953842463340492,"['FCER1G', 'RHOH', 'PTPN2']",0.5041774887186509,0,0,3
676,Regulation Of Lysosomal Lumen pH (GO:0035751),0.11963533630612055,2.804042179261863,5.953842463340492,"['LRRK2', 'TCIRG1', 'ATP6V1F']",0.5041774887186509,0,0,3
677,Carbohydrate Derivative Biosynthetic Process (GO:1901137),0.11963533630612055,2.804042179261863,5.953842463340492,"['GOLPH3', 'TPI1', 'B4GAT1']",0.5041774887186509,0,0,3
678,Hexose Biosynthetic Process (GO:0019319),0.11963533630612055,2.804042179261863,5.953842463340492,"['TPI1', 'PGAM1', 'CHST15']",0.5041774887186509,0,0,3
679,Icosanoid Metabolic Process (GO:0006690),0.11963533630612055,2.804042179261863,5.953842463340492,"['CASP1', 'LTC4S', 'MGLL']",0.5041774887186509,0,0,3
680,Microglial Cell Activation (GO:0001774),0.11963533630612055,2.804042179261863,5.953842463340492,"['CX3CR1', 'C1QA', 'AIF1']",0.5041774887186509,0,0,3
681,Monoatomic Cation Transport (GO:0006812),0.11963533630612055,2.804042179261863,5.953842463340492,"['SLC11A1', 'GRIN2B', 'TRPM3']",0.5041774887186509,0,0,3
682,Monocarboxylic Acid Transport (GO:0015718),0.11963533630612055,2.804042179261863,5.953842463340492,"['ACSL1', 'SLC16A3', 'PPARD']",0.5041774887186509,0,0,3
683,Negative Regulation Of Developmental Growth (GO:0048640),0.11963533630612055,2.804042179261863,5.953842463340492,"['CDKN1A', 'DUSP10', 'FGF13']",0.5041774887186509,0,0,3
684,Negative Regulation Of Lymphocyte Proliferation (GO:0050672),0.11963533630612055,2.804042179261863,5.953842463340492,"['CEBPB', 'VSIG4', 'LILRB4']",0.5041774887186509,0,0,3
685,Positive Regulation Of Mononuclear Cell Migration (GO:0071677),0.11963533630612055,2.804042179261863,5.953842463340492,"['CXCL12', 'AIF1', 'LGMN']",0.5041774887186509,0,0,3
686,Regulation Of G2/M Transition Of Mitotic Cell Cycle (GO:0010389),0.11963533630612055,2.804042179261863,5.953842463340492,"['CDKN1A', 'FHL1', 'TNFSF13B']",0.5041774887186509,0,0,3
687,Cellular Response To Organonitrogen Compound (GO:0071417),0.1213665125915997,1.7880128720836685,3.770812370618754,"['P2RY12', 'XBP1', 'GOLPH3', 'ATP2B4', 'PDXP', 'GABRG2', 'CPEB4']",0.5099863196254575,0,0,7
688,Exocytosis (GO:0006887),0.1213665125915997,1.7880128720836685,3.770812370618754,"['SNAP25', 'RAB3A', 'TNFAIP2', 'RAB27A', 'CPLX1', 'STX1A', 'WASHC3']",0.5099863196254575,0,0,7
689,B Cell Differentiation (GO:0030183),0.12918074860555812,2.2443661971830986,4.593191264460984,"['TPD52', 'HDAC4', 'JAK3', 'PTPN2']",0.5186980593004663,0,0,4
690,Regulation Of Glycolytic Process (GO:0006110),0.12918074860555812,2.2443661971830986,4.593191264460984,"['HDAC4', 'PGAM1', 'IGF1', 'HIF1A']",0.5186980593004663,0,0,4
691,Cellular Response To Heat (GO:0034605),0.12918074860555812,2.2443661971830986,4.593191264460984,"['HSBP1', 'STUB1', 'HSPA1B', 'HSPA1A']",0.5186980593004663,0,0,4
692,Glucose Metabolic Process (GO:0006006),0.12918074860555812,2.2443661971830986,4.593191264460984,"['TPI1', 'OAS1', 'PGAM1', 'PPARD']",0.5186980593004663,0,0,4
693,Negative Regulation Of I-kappaB kinase/NF-kappaB Signaling (GO:0043124),0.12918074860555812,2.2443661971830986,4.593191264460984,"['STAT1', 'RHOH', 'NR1D1', 'LILRB4']",0.5186980593004663,0,0,4
694,Regulation Of Cation Channel Activity (GO:2001257),0.12918074860555812,2.2443661971830986,4.593191264460984,"['CACNB4', 'PDE4D', 'CACNA1A', 'FGF13']",0.5186980593004663,0,0,4
695,Regulation Of Heart Contraction (GO:0008016),0.12956553836991638,2.004913076341648,4.09717708387199,"['RYR2', 'PDE4D', 'ATP2B4', 'CALM3', 'CACNA1C']",0.5186980593004663,0,0,5
696,Regulation Of Phosphatidylinositol 3-Kinase Signaling (GO:0014066),0.12956553836991638,2.004913076341648,4.09717708387199,"['PIK3IP1', 'IL18', 'HCLS1', 'IGF1', 'PIK3AP1']",0.5186980593004663,0,0,5
697,Lymphocyte Differentiation (GO:0030098),0.12956553836991638,2.004913076341648,4.09717708387199,"['TPD52', 'HDAC4', 'RHOH', 'JAK3', 'PTPN2']",0.5186980593004663,0,0,5
698,Activation Of GTPase Activity (GO:0090630),0.13094658380697186,1.7480039331366766,3.5536322075767446,"['TBC1D4', 'GPR65', 'TBC1D30', 'TBC1D8', 'TBC1D14', 'TBC1D2B', 'TBC1D16']",0.5186980593004663,0,0,7
699,Negative Regulation Of Cell Migration (GO:0030336),0.13302406790922944,1.5623764333728747,3.151665121735921,"['BST2', 'PTPRT', 'GJA1', 'NDRG4', 'DUSP10', 'DUSP3', 'SRGAP1', 'SAP30', 'PFN2', 'RHOB']",0.5186980593004663,0,0,10
700,G Protein-Coupled Acetylcholine Receptor Signaling Pathway (GO:0007213),0.13545075439985887,3.7356725146198833,7.468159026883946,"['CHRM3', 'OPRM1']",0.5186980593004663,0,0,2
701,Adaptive Immune Response Based On Somatic Recombination Of Immune Receptors Built From Immunoglobulin Superfamily Domains (GO:0002460),0.13545075439985887,3.7356725146198833,7.468159026883946,"['STAT3', 'IL18']",0.5186980593004663,0,0,2
702,Regulation Of Mitochondrial Outer Membrane Permeabilization Involved In Apoptotic Signaling Pathway (GO:1901028),0.13545075439985887,3.7356725146198833,7.468159026883946,"['TMEM14A', 'HSPA1A']",0.5186980593004663,0,0,2
703,Astral Microtubule Organization (GO:0030953),0.13545075439985887,3.7356725146198833,7.468159026883946,"['LIMK2', 'TPPP']",0.5186980593004663,0,0,2
704,Regulation Of Plasminogen Activation (GO:0010755),0.13545075439985887,3.7356725146198833,7.468159026883946,"['PLAT', 'RUNX1']",0.5186980593004663,0,0,2
705,Calcium-Dependent Cell-Cell Adhesion Via Plasma Membrane Cell Adhesion Molecules (GO:0016339),0.13545075439985887,3.7356725146198833,7.468159026883946,"['CDH12', 'CDH18']",0.5186980593004663,0,0,2
706,Cellular Component Disassembly (GO:0022411),0.13545075439985887,3.7356725146198833,7.468159026883946,"['SH3PXD2B', 'LCP1']",0.5186980593004663,0,0,2
707,Regulation Of Steroid Metabolic Process (GO:0019218),0.13545075439985887,3.7356725146198833,7.468159026883946,"['STUB1', 'ABCG1']",0.5186980593004663,0,0,2
708,Regulation Of Vascular Endothelial Growth Factor Receptor Signaling Pathway (GO:0030947),0.13545075439985887,3.7356725146198833,7.468159026883946,"['PTPN1', 'HIF1A']",0.5186980593004663,0,0,2
709,Respiratory Tube Development (GO:0030323),0.13545075439985887,3.7356725146198833,7.468159026883946,"['CEBPA', 'PCSK5']",0.5186980593004663,0,0,2
710,Digestive Tract Development (GO:0048565),0.13545075439985887,3.7356725146198833,7.468159026883946,"['SALL1', 'PCSK5']",0.5186980593004663,0,0,2
711,Endolysosomal Toll-Like Receptor Signaling Pathway (GO:0140894),0.13545075439985887,3.7356725146198833,7.468159026883946,"['OAS1', 'PIK3AP1']",0.5186980593004663,0,0,2
