Rank,Term name,P-value,Z-score,Combined score,Overlapping genes,Adjusted p-value,Old p-value,Old adjusted p-value,gene count
653,Cellular Response To Type II Interferon (GO:0071346),0.34673548111504404,2.419991134751773,2.5632378926242976,['SP100'],0.47794693217529627,0,0,1
654,Epigenetic Regulation Of Gene Expression (GO:0040029),0.34673548111504404,2.419991134751773,2.5632378926242976,['TDG'],0.47794693217529627,0,0,1
655,Positive Regulation Of Leukocyte Chemotaxis (GO:0002690),0.34673548111504404,2.419991134751773,2.5632378926242976,['MAPK1'],0.47794693217529627,0,0,1
656,Telomere Maintenance (GO:0000723),0.34673548111504404,2.419991134751773,2.5632378926242976,['SP100'],0.47794693217529627,0,0,1
657,Positive Regulation Of Type I Interferon Production (GO:0032481),0.34673548111504404,2.419991134751773,2.5632378926242976,['CD14'],0.47794693217529627,0,0,1
658,Receptor Internalization (GO:0031623),0.34673548111504404,2.419991134751773,2.5632378926242976,['ITGB2'],0.47794693217529627,0,0,1
659,Positive Regulation Of NF-kappaB Transcription Factor Activity (GO:0051092),0.34865189496603743,1.65,1.7385741287921295,"['IL18', 'CARD16']",0.47985928487738383,0,0,2
660,Cellular Response To Cytokine Stimulus (GO:0071345),0.3505310064934932,1.446445328209482,1.516317479415184,"['CD4', 'CSF3R', 'GBP3']",0.4817145801357551,0,0,3
661,Negative Regulation Of Cell Migration (GO:0030336),0.3533009347536978,1.6324812030075189,1.6984907091585617,"['ARHGDIB', 'SINHCAF']",0.48362815558966593,0,0,2
662,Negative Regulation Of Protein-Containing Complex Assembly (GO:0031333),0.35512276915404356,2.346443154953793,2.4292531713903576,['TMC8'],0.48362815558966593,0,0,1
663,Antimicrobial Humoral Response (GO:0019730),0.35512276915404356,2.346443154953793,2.4292531713903576,['COLEC11'],0.48362815558966593,0,0,1
664,Regulation Of Substrate Adhesion-Dependent Cell Spreading (GO:1900024),0.35512276915404356,2.346443154953793,2.4292531713903576,['CRKL'],0.48362815558966593,0,0,1
665,Positive Regulation Of Actin Filament Bundle Assembly (GO:0032233),0.35512276915404356,2.346443154953793,2.4292531713903576,['GPR65'],0.48362815558966593,0,0,1
666,Regulation Of DNA Binding (GO:0051101),0.35512276915404356,2.346443154953793,2.4292531713903576,['SP100'],0.48362815558966593,0,0,1
667,Regulation Of Cytokine Production Involved In Inflammatory Response (GO:1900015),0.3634031209878701,2.2772215269086358,2.3051004906032717,['ALOX5'],0.48903060940059073,0,0,1
668,ERBB Signaling Pathway (GO:0038127),0.3634031209878701,2.2772215269086358,2.3051004906032717,['MAPK1'],0.48903060940059073,0,0,1
669,Regulation Of Reactive Oxygen Species Metabolic Process (GO:2000377),0.3634031209878701,2.2772215269086358,2.3051004906032717,['ALOX5'],0.48903060940059073,0,0,1
670,Cellular Response To Mechanical Stimulus (GO:0071260),0.3634031209878701,2.2772215269086358,2.3051004906032717,['LTBR'],0.48903060940059073,0,0,1
671,Positive Regulation Of Ras Protein Signal Transduction (GO:0046579),0.3634031209878701,2.2772215269086358,2.3051004906032717,['GPR65'],0.48903060940059073,0,0,1
672,Response To Light Stimulus (GO:0009416),0.3634031209878701,2.2772215269086358,2.3051004906032717,['CPT1B'],0.48903060940059073,0,0,1
673,Positive Regulation Of Chemokine Production (GO:0032722),0.3634031209878701,2.2772215269086358,2.3051004906032717,['IL18'],0.48903060940059073,0,0,1
674,Protein-Containing Complex Disassembly (GO:0032984),0.3634031209878701,2.2772215269086358,2.3051004906032717,['VAMP8'],0.48903060940059073,0,0,1
675,Rho Protein Signal Transduction (GO:0007266),0.3715778904158528,2.211955420466059,2.1898287264127068,['ARHGDIB'],0.4956193332458507,0,0,1
676,Positive Regulation Of B Cell Activation (GO:0050871),0.3715778904158528,2.211955420466059,2.1898287264127068,['SASH3'],0.4956193332458507,0,0,1
677,Positive Regulation Of T Cell Proliferation (GO:0042102),0.3715778904158528,2.211955420466059,2.1898287264127068,['IL18'],0.4956193332458507,0,0,1
678,Establishment Of Protein Localization To Membrane (GO:0090150),0.3715778904158528,2.211955420466059,2.1898287264127068,['GOLGA7B'],0.4956193332458507,0,0,1
679,Membrane Lipid Biosynthetic Process (GO:0046467),0.3715778904158528,2.211955420466059,2.1898287264127068,['ALDH3B1'],0.4956193332458507,0,0,1
680,Myeloid Cell Differentiation (GO:0030099),0.3715778904158528,2.211955420466059,2.1898287264127068,['SLC1A5'],0.4956193332458507,0,0,1
681,Positive Regulation Of DNA-templated Transcription (GO:0045893),0.3756120422176693,1.1587977994227994,1.134693033253429,"['SP100', 'CD4', 'CSRNP2', 'FOXF2', 'TFEC', 'IL18', 'CYTL1', 'ZNF304', 'FGF1', 'HLA-DRB1']",0.5002644967568665,0,0,10
682,Regulation Of Lipid Metabolic Process (GO:0019216),0.37964841427274926,2.1503152088258473,2.082601095111133,['APOC1'],0.501954973389772,0,0,1
683,Cellular Response To Fibroblast Growth Factor Stimulus (GO:0044344),0.37964841427274926,2.1503152088258473,2.082601095111133,['FGF1'],0.501954973389772,0,0,1
684,Inorganic Anion Transmembrane Transport (GO:0098661),0.37964841427274926,2.1503152088258473,2.082601095111133,['GABRA4'],0.501954973389772,0,0,1
685,Mesenchymal Cell Differentiation (GO:0048762),0.37964841427274926,2.1503152088258473,2.082601095111133,['FOXF2'],0.501954973389772,0,0,1
686,Protein Targeting To Membrane (GO:0006612),0.37964841427274926,2.1503152088258473,2.082601095111133,['GOLGA7B'],0.501954973389772,0,0,1
687,Regulation Of Phagocytosis (GO:0050764),0.3876160126500854,2.092006900517539,1.9826788029724802,['CYBA'],0.5102579440836392,0,0,1
688,Regulation Of Stress-Activated MAPK Cascade (GO:0032872),0.3876160126500854,2.092006900517539,1.9826788029724802,['MAPK1'],0.5102579440836392,0,0,1
689,Negative Regulation Of Cellular Catabolic Process (GO:0031330),0.3876160126500854,2.092006900517539,1.9826788029724802,['APOC1'],0.5102579440836392,0,0,1
690,Cellular Response To Growth Factor Stimulus (GO:0071363),0.39004584091885364,1.5045769764216366,1.4165456910577863,"['ACVR1B', 'CRKL']",0.512712431468696,0,0,2
691,Negative Regulation Of Immune Response (GO:0050777),0.3954819889941279,2.0367674505412467,1.8894073919935264,['HLA-DRB1'],0.5138999484493897,0,0,1
692,Regulation Of Heart Contraction (GO:0008016),0.3954819889941279,2.0367674505412467,1.8894073919935264,['S100A1'],0.5138999484493897,0,0,1
693,Regulation Of Secretion By Cell (GO:1903530),0.3954819889941279,2.0367674505412467,1.8894073919935264,['VAMP8'],0.5138999484493897,0,0,1
694,"Regulation Of Synaptic Transmission, Glutamatergic (GO:0051966)",0.3954819889941279,2.0367674505412467,1.8894073919935264,['DRD1'],0.5138999484493897,0,0,1
695,Positive Regulation Of NIK/NF-kappaB Signaling (GO:1901224),0.3954819889941279,2.0367674505412467,1.8894073919935264,['LAPTM5'],0.5138999484493897,0,0,1
696,Positive Regulation Of Protein Modification By Small Protein Conjugation Or Removal (GO:1903322),0.3954819889941279,2.0367674505412467,1.8894073919935264,['LAPTM5'],0.5138999484493897,0,0,1
697,Negative Regulation Of Blood Vessel Morphogenesis (GO:2000181),0.3954819889941279,2.0367674505412467,1.8894073919935264,['ALOX5'],0.5138999484493897,0,0,1
698,Negative Regulation Of Catabolic Process (GO:0009895),0.3954819889941279,2.0367674505412467,1.8894073919935264,['APOC1'],0.5138999484493897,0,0,1
699,Regulation Of Double-Strand Break Repair Via Homologous Recombination (GO:0010569),0.4032476303122612,1.984360792871431,1.802205279605906,['KLHL15'],0.5202640123658904,0,0,1
700,Regulation Of Hydrolase Activity (GO:0051336),0.4032476303122612,1.984360792871431,1.802205279605906,['TDG'],0.5202640123658904,0,0,1
701,Regulation Of Smooth Muscle Cell Proliferation (GO:0048660),0.4032476303122612,1.984360792871431,1.802205279605906,['IL18'],0.5202640123658904,0,0,1
702,Response To Organic Cyclic Compound (GO:0014070),0.4032476303122612,1.984360792871431,1.802205279605906,['IL18'],0.5202640123658904,0,0,1
703,Positive Regulation Of Smooth Muscle Cell Proliferation (GO:0048661),0.4032476303122612,1.984360792871431,1.802205279605906,['IL18'],0.5202640123658904,0,0,1
704,Cellular Response To Interleukin-1 (GO:0071347),0.41091420750199587,1.9345744680851065,1.7205540948570934,['GBP3'],0.5271558503597034,0,0,1
705,Synapse Assembly (GO:0007416),0.41091420750199587,1.9345744680851065,1.7205540948570934,['DRD1'],0.5271558503597034,0,0,1
706,Fatty Acid Biosynthetic Process (GO:0006633),0.41091420750199587,1.9345744680851065,1.7205540948570934,['ALOX5'],0.5271558503597034,0,0,1
707,Protein Tetramerization (GO:0051262),0.41091420750199587,1.9345744680851065,1.7205540948570934,['HLA-DRB1'],0.5271558503597034,0,0,1
708,Negative Regulation Of Cellular Process (GO:0048523),0.4132427524040441,1.1970577633594666,1.05786398297169,"['VAMP8', 'ALOX5', 'SINHCAF', 'ACVR1B', 'PLAAT4']",0.5293780456717764,0,0,5
709,Activation Of Cysteine-Type Endopeptidase Activity Involved In Apoptotic Process (GO:0006919),0.4184829754648993,1.8872167445078707,1.6439904949352917,['LAPTM5'],0.5293780456717764,0,0,1
710,Regulation Of Neuron Death (GO:1901214),0.4184829754648993,1.8872167445078707,1.6439904949352917,['ITGB2'],0.5293780456717764,0,0,1
711,Peptidyl-Tyrosine Modification (GO:0018212),0.4184829754648993,1.8872167445078707,1.6439904949352917,['ABI3'],0.5293780456717764,0,0,1
712,Positive Regulation Of Apoptotic Signaling Pathway (GO:2001235),0.4184829754648993,1.8872167445078707,1.6439904949352917,['LTBR'],0.5293780456717764,0,0,1
713,Cytoskeleton-Dependent Cytokinesis (GO:0061640),0.4184829754648993,1.8872167445078707,1.6439904949352917,['TRIM36'],0.5293780456717764,0,0,1
714,Response To Interleukin-1 (GO:0070555),0.4184829754648993,1.8872167445078707,1.6439904949352917,['GBP3'],0.5293780456717764,0,0,1
715,Response To Type II Interferon (GO:0034341),0.4184829754648993,1.8872167445078707,1.6439904949352917,['SP100'],0.5293780456717764,0,0,1
716,Vesicle Fusion (GO:0006906),0.4184829754648993,1.8872167445078707,1.6439904949352917,['VAMP8'],0.5293780456717764,0,0,1
717,Positive Regulation Of Protein Ubiquitination (GO:0031398),0.4184829754648993,1.8872167445078707,1.6439904949352917,['LAPTM5'],0.5293780456717764,0,0,1
718,Regulation Of Cell Differentiation (GO:0045595),0.421431912837969,1.407922077922078,1.2165813141158135,"['ALOX5', 'SINHCAF']",0.5323659400334789,0,0,2
719,Cell-Cell Adhesion Via Plasma-Membrane Adhesion Molecules (GO:0098742),0.42584975838191935,1.3951093951093951,1.1909611884872113,"['ITGB2', 'DSG1']",0.5358409738468664,0,0,2
720,Response To Molecule Of Bacterial Origin (GO:0002237),0.42595517325643945,1.842114150624789,1.572099205128565,['CD14'],0.5358409738468664,0,0,1
721,Sphingolipid Biosynthetic Process (GO:0030148),0.42595517325643945,1.842114150624789,1.572099205128565,['ALDH3B1'],0.5358409738468664,0,0,1
722,Positive Regulation Of DNA Biosynthetic Process (GO:2000573),0.43333202437718443,1.7991093518060366,1.5045070752889738,['MAPK1'],0.5428620802625778,0,0,1
723,Response To Reactive Oxygen Species (GO:0000302),0.43333202437718443,1.7991093518060366,1.5045070752889738,['MAPK1'],0.5428620802625778,0,0,1
724,Negative Regulation Of Angiogenesis (GO:0016525),0.43333202437718443,1.7991093518060366,1.5045070752889738,['ALOX5'],0.5428620802625778,0,0,1
725,Cellular Response To Calcium Ion (GO:0071277),0.44061473695905096,1.758059316569955,1.440877986082533,['ALOX5AP'],0.5497077942529013,0,0,1
726,Phospholipid Metabolic Process (GO:0006644),0.44061473695905096,1.758059316569955,1.440877986082533,['PLAAT4'],0.5497077942529013,0,0,1
727,Chloride Transport (GO:0006821),0.44061473695905096,1.758059316569955,1.440877986082533,['GABRA4'],0.5497077942529013,0,0,1
728,Second-Messenger-Mediated Signaling (GO:0019932),0.4478045039719271,1.7188337273443657,1.3809084672930847,['FCGR3A'],0.5563817604144354,0,0,1
729,Epidermis Development (GO:0008544),0.4478045039719271,1.7188337273443657,1.3809084672930847,['HLA-DRB1'],0.5563817604144354,0,0,1
730,Long-Chain Fatty Acid Metabolic Process (GO:0001676),0.4478045039719271,1.7188337273443657,1.3809084672930847,['ALOX5'],0.5563817604144354,0,0,1
731,Cellular Response To Nutrient Levels (GO:0031669),0.45490250329678045,1.681313598519889,1.3243239162394491,['CD68'],0.5621206682427519,0,0,1
732,Protein Deubiquitination (GO:0016579),0.45490250329678045,1.681313598519889,1.3243239162394491,['OTUD4'],0.5621206682427519,0,0,1
733,Monocarboxylic Acid Transport (GO:0015718),0.45490250329678045,1.681313598519889,1.3243239162394491,['SLCO2B1'],0.5621206682427519,0,0,1
734,Negative Regulation Of Cellular Component Organization (GO:0051129),0.45490250329678045,1.681313598519889,1.3243239162394491,['TMC8'],0.5621206682427519,0,0,1
735,Negative Regulation Of Epithelial Cell Proliferation (GO:0050680),0.46190989797550086,1.6453900709219857,1.2708753222965976,['ALOX5'],0.5669178314800802,0,0,1
736,Negative Regulation Of Protein Modification Process (GO:0031400),0.46190989797550086,1.6453900709219857,1.2708753222965976,['CRKL'],0.5669178314800802,0,0,1
737,Regulation Of Protein Localization To Plasma Membrane (GO:1903076),0.46190989797550086,1.6453900709219857,1.2708753222965976,['VAMP8'],0.5669178314800802,0,0,1
738,Cellular Response To Reactive Oxygen Species (GO:0034614),0.46190989797550086,1.6453900709219857,1.2708753222965976,['MAPK1'],0.5669178314800802,0,0,1
739,Cholesterol Homeostasis (GO:0042632),0.46190989797550086,1.6453900709219857,1.2708753222965976,['IL18'],0.5669178314800802,0,0,1
740,Transmembrane Receptor Protein Tyrosine Kinase Signaling Pathway (GO:0007169),0.46710370801784606,1.190481460985058,0.9061992180327786,"['CD4', 'MAPK1', 'FGF1']",0.5677260984112223,0,0,3
741,Positive Regulation Of Cellular Process (GO:0048522),0.46866176314576385,1.1186236867642716,0.8477757610442171,"['TNFSF13', 'SINHCAF', 'FGF1', 'S100B', 'CRKL']",0.5677260984112223,0,0,5
742,Cell-Cell Junction Assembly (GO:0007043),0.4688278365049675,1.6109633569739952,1.2203364213292665,['DSG1'],0.5677260984112223,0,0,1
743,Cell-Cell Junction Organization (GO:0045216),0.4688278365049675,1.6109633569739952,1.2203364213292665,['DSG1'],0.5677260984112223,0,0,1
744,Positive Regulation Of Cell-Substrate Adhesion (GO:0010811),0.4688278365049675,1.6109633569739952,1.2203364213292665,['CRKL'],0.5677260984112223,0,0,1
745,Sterol Homeostasis (GO:0055092),0.4688278365049675,1.6109633569739952,1.2203364213292665,['IL18'],0.5677260984112223,0,0,1
746,Glucose Homeostasis (GO:0042593),0.4688278365049675,1.6109633569739952,1.2203364213292665,['ALOX5'],0.5677260984112223,0,0,1
747,Positive Regulation Of Ubiquitin-Dependent Protein Catabolic Process (GO:2000060),0.4688278365049675,1.6109633569739952,1.2203364213292665,['LAPTM5'],0.5677260984112223,0,0,1
748,Macroautophagy (GO:0016236),0.4688278365049675,1.6109633569739952,1.2203364213292665,['VAMP8'],0.5677260984112223,0,0,1
749,Protein Modification By Small Protein Removal (GO:0070646),0.4688278365049675,1.6109633569739952,1.2203364213292665,['OTUD4'],0.5677260984112223,0,0,1
750,Negative Regulation Of Phosphorylation (GO:0042326),0.4756574528752707,1.577941815023882,1.17250121718207,['CRKL'],0.5706631081453314,0,0,1
751,Regulation Of Insulin Secretion (GO:0050796),0.4756574528752707,1.577941815023882,1.17250121718207,['ALOX5'],0.5706631081453314,0,0,1
752,Regulation Of Stress Fiber Assembly (GO:0051492),0.4756574528752707,1.577941815023882,1.17250121718207,['GPR65'],0.5706631081453314,0,0,1
753,Positive Regulation Of JNK Cascade (GO:0046330),0.4756574528752707,1.577941815023882,1.17250121718207,['LTBR'],0.5706631081453314,0,0,1
754,Response To Tumor Necrosis Factor (GO:0034612),0.4756574528752707,1.577941815023882,1.17250121718207,['GBP3'],0.5706631081453314,0,0,1
755,Wound Healing (GO:0042060),0.4756574528752707,1.577941815023882,1.17250121718207,['FGF1'],0.5706631081453314,0,0,1
756,Positive Regulation Of Synaptic Transmission (GO:0050806),0.4756574528752707,1.577941815023882,1.17250121718207,['DRD1'],0.5706631081453314,0,0,1
757,Cell Morphogenesis Involved In Neuron Differentiation (GO:0048667),0.4823998668043628,1.546241134751773,1.127181815236435,['S100B'],0.5749496441413364,0,0,1
758,Peptidyl-Tyrosine Phosphorylation (GO:0018108),0.4823998668043628,1.546241134751773,1.127181815236435,['ABI3'],0.5749496441413364,0,0,1
759,Sodium Ion Transport (GO:0006814),0.4823998668043628,1.546241134751773,1.127181815236435,['SLC6A9'],0.5749496441413364,0,0,1
760,Sphingolipid Metabolic Process (GO:0006665),0.4823998668043628,1.546241134751773,1.127181815236435,['ALDH3B1'],0.5749496441413364,0,0,1
761,Protein Complex Oligomerization (GO:0051259),0.4823998668043628,1.546241134751773,1.127181815236435,['HLA-DRB1'],0.5749496441413364,0,0,1
762,Positive Regulation Of Transcription By RNA Polymerase II (GO:0045944),0.4845414059065071,1.0725632563256327,0.7771282710066775,"['CSRNP2', 'FOXF2', 'TFEC', 'IL18', 'CYTL1', 'ZNF304', 'FGF1']",0.5767441668729685,0,0,7
763,Regulation Of Fat Cell Differentiation (GO:0045598),0.4890561839160775,1.5157836184119038,1.0842065243011432,['ALOX5'],0.5790782752113347,0,0,1
764,Positive Regulation Of Endocytosis (GO:0045807),0.4890561839160775,1.5157836184119038,1.0842065243011432,['CYBA'],0.5790782752113347,0,0,1
765,Positive Regulation Of Protein Localization (GO:1903829),0.4890561839160775,1.5157836184119038,1.0842065243011432,['SLC5A3'],0.5790782752113347,0,0,1
766,Regulation Of Cell Division (GO:0051302),0.4890561839160775,1.5157836184119038,1.0842065243011432,['FGF1'],0.5790782752113347,0,0,1
767,Positive Regulation Of Protein Metabolic Process (GO:0051247),0.4898913032840298,1.2273242630385488,0.8757839130110103,"['SLC6A9', 'IL18']",0.5793108371298762,0,0,2
768,Nervous System Development (GO:0007399),0.4921124954977166,1.108721624850657,0.7861367832917515,"['DRD1', 'NPTX1', 'ACVR1B', 'S100B']",0.5811797310109751,0,0,4
769,Sodium Ion Transmembrane Transport (GO:0035725),0.4956274959331592,1.4864975450081832,1.0434181889943732,['SLC6A9'],0.5845697513802021,0,0,1
770,Negative Regulation Of Transforming Growth Factor Beta Receptor Signaling Pathway (GO:0030512),0.5021148808050765,1.4583166064498863,1.0046727211438393,['SINHCAF'],0.5906850802726387,0,0,1
771,Regulation Of Ras Protein Signal Transduction (GO:0046578),0.5021148808050765,1.4583166064498863,1.0046727211438393,['ARHGDIB'],0.5906850802726387,0,0,1
772,Activation Of GTPase Activity (GO:0090630),0.5085194029009728,1.4311794063567114,0.9678378029377536,['GPR65'],0.592836887443679,0,0,1
773,Regulation Of Organelle Organization (GO:0033043),0.5085194029009728,1.4311794063567114,0.9678378029377536,['MAPK1'],0.592836887443679,0,0,1
774,Plasma Membrane Organization (GO:0007009),0.5085194029009728,1.4311794063567114,0.9678378029377536,['PLSCR5'],0.592836887443679,0,0,1
775,Cellular Response To Organic Substance (GO:0071310),0.5085194029009728,1.4311794063567114,0.9678378029377536,['IL18'],0.592836887443679,0,0,1
776,Positive Regulation Of Endothelial Cell Migration (GO:0010595),0.5085194029009728,1.4311794063567114,0.9678378029377536,['FGF1'],0.592836887443679,0,0,1
777,Lysosomal Transport (GO:0007041),0.5085194029009728,1.4311794063567114,0.9678378029377536,['LAPTM5'],0.592836887443679,0,0,1
778,Monocarboxylic Acid Metabolic Process (GO:0032787),0.5085194029009728,1.4311794063567114,0.9678378029377536,['CPT1B'],0.592836887443679,0,0,1
779,Regulation Of Protein Secretion (GO:0050708),0.5148421132518199,1.405029013539652,0.9327917390971882,['ALOX5'],0.5986689701530779,0,0,1
780,Vesicle Organization (GO:0016050),0.5148421132518199,1.405029013539652,0.9327917390971882,['VAMP8'],0.5986689701530779,0,0,1
781,Regulation Of Cell Population Proliferation (GO:0042127),0.5163280463410602,1.0464745717700172,0.6917332613457364,"['TNFSF13', 'SINHCAF', 'FGF1', 'S100B', 'PLAAT4', 'CRKL']",0.5996280896688113,0,0,6
782,Regulation Of Interleukin-1 Beta Production (GO:0032651),0.5210840495358516,1.3798125633232017,0.8994224394620424,['CARD16'],0.6005377800876969,0,0,1
783,Calcium-Mediated Signaling (GO:0019722),0.5210840495358516,1.3798125633232017,0.8994224394620424,['FCGR3A'],0.6005377800876969,0,0,1
784,Regulation Of Vesicle-Mediated Transport (GO:0060627),0.5210840495358516,1.3798125633232017,0.8994224394620424,['MAPK1'],0.6005377800876969,0,0,1
785,Positive Regulation Of Catabolic Process (GO:0009896),0.5210840495358516,1.3798125633232017,0.8994224394620424,['LAPTM5'],0.6005377800876969,0,0,1
786,Lipid Transport (GO:0006869),0.5210840495358516,1.3798125633232017,0.8994224394620424,['SLCO2B1'],0.6005377800876969,0,0,1
787,Regulation Of NIK/NF-kappaB Signaling (GO:1901222),0.5210840495358516,1.3798125633232017,0.8994224394620424,['LAPTM5'],0.6005377800876969,0,0,1
788,Negative Regulation Of Multicellular Organismal Process (GO:0051241),0.5221915209514634,1.1531982942430703,0.7492569875043581,"['ARHGDIB', 'SINHCAF']",0.6010503927702757,0,0,2
789,Axon Development (GO:0061564),0.5272462365172863,1.3554809008336444,0.8676265134019072,['S100B'],0.6045667971190628,0,0,1
790,Regulation Of Osteoblast Differentiation (GO:0045667),0.5272462365172863,1.3554809008336444,0.8676265134019072,['TMEM119'],0.6045667971190628,0,0,1
791,Positive Regulation Of DNA Metabolic Process (GO:0051054),0.5272462365172863,1.3554809008336444,0.8676265134019072,['OTUD4'],0.6045667971190628,0,0,1
792,Apoptotic Process (GO:0006915),0.5300523182176912,1.1360294117647058,0.7211282543384994,"['ITGB2', 'CD14']",0.6069385509879314,0,0,2
793,Positive Regulation Of Macromolecule Metabolic Process (GO:0010604),0.5313745327831128,1.0777313033294296,0.6814367552192,"['LAPTM5', 'TMEM119', 'FGF1']",0.6069385509879314,0,0,3
794,T Cell Receptor Signaling Pathway (GO:0050852),0.5333296859287556,1.3319882611885547,0.8373084645758779,['HLA-DRB1'],0.6069385509879314,0,0,1
795,Regulation Of Peptidyl-Tyrosine Phosphorylation (GO:0050730),0.5333296859287556,1.3319882611885547,0.8373084645758779,['ITGB2'],0.6069385509879314,0,0,1
796,Organic Anion Transport (GO:0015711),0.5333296859287556,1.3319882611885547,0.8373084645758779,['SLCO2B1'],0.6069385509879314,0,0,1
797,Cellular Response To Chemical Stress (GO:0062197),0.5333296859287556,1.3319882611885547,0.8373084645758779,['ALDH3B1'],0.6069385509879314,0,0,1
798,Regulation Of Endothelial Cell Proliferation (GO:0001936),0.5393353967733734,1.3092919822094002,0.8083799711347135,['ALOX5'],0.6099466394930794,0,0,1
799,Positive Regulation Of Cold-Induced Thermogenesis (GO:0120162),0.5393353967733734,1.3092919822094002,0.8083799711347135,['IL18'],0.6099466394930794,0,0,1
800,Positive Regulation Of Epithelial Cell Migration (GO:0010634),0.5393353967733734,1.3092919822094002,0.8083799711347135,['FGF1'],0.6099466394930794,0,0,1
801,Positive Regulation Of Transmembrane Receptor Protein Serine/Threonine Kinase Signaling Pathway (GO:0090100),0.5393353967733734,1.3092919822094002,0.8083799711347135,['ACVR1B'],0.6099466394930794,0,0,1
802,Muscle Contraction (GO:0006936),0.5393353967733734,1.3092919822094002,0.8083799711347135,['P2RX6'],0.6099466394930794,0,0,1
803,Regulation Of Cysteine-Type Endopeptidase Activity Involved In Apoptotic Process (GO:0043281),0.5452643554975947,1.287352245862884,0.7807592423248204,['CARD16'],0.6151178736770129,0,0,1
804,Positive Regulation Of MAP Kinase Activity (GO:0043406),0.5452643554975947,1.287352245862884,0.7807592423248204,['FGF1'],0.6151178736770129,0,0,1
805,Negative Regulation Of Developmental Process (GO:0051093),0.5511175362071042,1.2661318451342867,0.7543704419128451,['SINHCAF'],0.6194096720444159,0,0,1
806,Cellular Response To Tumor Necrosis Factor (GO:0071356),0.5511175362071042,1.2661318451342867,0.7543704419128451,['GBP3'],0.6194096720444159,0,0,1
807,Regulation Of Actin Cytoskeleton Organization (GO:0032956),0.5511175362071042,1.2661318451342867,0.7543704419128451,['ARHGDIB'],0.6194096720444159,0,0,1
808,Regulation Of Cellular Response To Stress (GO:0080135),0.5568959005125095,1.2455959734614506,0.7291431714746109,['ALOX5'],0.6235859034133903,0,0,1
809,Positive Regulation Of Metabolic Process (GO:0009893),0.5568959005125095,1.2455959734614506,0.7291431714746109,['IL18'],0.6235859034133903,0,0,1
810,Negative Regulation Of Cellular Biosynthetic Process (GO:0031327),0.5568959005125095,1.2455959734614506,0.7291431714746109,['APOC1'],0.6235859034133903,0,0,1
811,Protein Phosphorylation (GO:0006468),0.5616469462834791,1.011736754573533,0.5836525564812189,"['ABI3', 'MAPK1', 'ACVR1B', 'HCST']",0.6268778391383664,0,0,4
812,Cellular Response To Transforming Growth Factor Beta Stimulus (GO:0071560),0.5626003980800773,1.2257120342226726,0.7050120041945136,['CRKL'],0.6268778391383664,0,0,1
813,Response To Calcium Ion (GO:0051592),0.5626003980800773,1.2257120342226726,0.7050120041945136,['ALOX5AP'],0.6268778391383664,0,0,1
814,Negative Regulation Of Defense Response (GO:0031348),0.5626003980800773,1.2257120342226726,0.7050120041945136,['ALOX5'],0.6268778391383664,0,0,1
815,DNA Metabolic Process (GO:0006259),0.5680336075400024,1.0572407045009784,0.5979485877285702,"['SP100', 'TDG']",0.6300567159217425,0,0,2
816,Cell-Matrix Adhesion (GO:0007160),0.5682319665093555,1.2064494680851063,0.6819160664238378,['ITGB2'],0.6300567159217425,0,0,1
817,Visual Perception (GO:0007601),0.5682319665093555,1.2064494680851063,0.6819160664238378,['ROM1'],0.6300567159217425,0,0,1
818,Mitotic Cell Cycle Phase Transition (GO:0044772),0.5682319665093555,1.2064494680851063,0.6819160664238378,['ACVR1B'],0.6300567159217425,0,0,1
819,Vesicle-Mediated Transport (GO:0016192),0.5737279262226092,1.0105243316264019,0.5614473097207204,"['VAMP8', 'ARL11', 'PLIN3']",0.6346694137591004,0,0,3
820,Regulation Of Proteasomal Ubiquitin-Dependent Protein Catabolic Process (GO:0032434),0.573791531733696,1.1877795962902347,0.659798659044863,['FOXF2'],0.6346694137591004,0,0,1
821,Cellular Response To Salt (GO:1902075),0.5792800078998608,1.1696754781861165,0.6386069163975652,['ALOX5AP'],0.6399597651220142,0,0,1
822,Regulation Of Epithelial Cell Proliferation (GO:0050678),0.5846982975489703,1.1521117815179422,0.6182914969728123,['ZNF304'],0.6428137646992922,0,0,1
