Rank,Term name,P-value,Z-score,Combined score,Overlapping genes,Adjusted p-value,Old p-value,Old adjusted p-value,gene count
459,Positive Regulation Of Interleukin-8 Production (GO:0032757),0.09847037277941995,2.5161793372319687,5.832502596619879,"['SYK', 'CD14', 'TLR5', 'TLR4']",0.3853001950148981,0,0,4
460,Protein Modification Process (GO:0036211),0.10113848314069597,1.5879540307021223,3.6384228269038985,"['LATS2', 'UBA7', 'SYK', 'BTK', 'DAPP1', 'ST8SIA6', 'IRAK3', 'CSF2RB', 'PIM2', 'RUNX3', 'HCST', 'TGFBR2']",0.3948798167841086,0,0,12
461,Regulation Of Organelle Organization (GO:0033043),0.10571444288636517,2.9833948339483394,6.703729228708853,"['SYDE1', 'EZR', 'STOX1']",0.39889010079256354,0,0,3
462,Visual System Development (GO:0150063),0.10571444288636517,2.9833948339483394,6.703729228708853,"['C3', 'C1QA', 'FOXC1']",0.39889010079256354,0,0,3
463,Positive Regulation Of Binding (GO:0051099),0.10571444288636517,2.9833948339483394,6.703729228708853,"['FOXC1', 'DTX3L', 'HFE']",0.39889010079256354,0,0,3
464,Positive Regulation Of Biosynthetic Process (GO:0009891),0.10571444288636517,2.9833948339483394,6.703729228708853,"['CYBA', 'VIM', 'TLR4']",0.39889010079256354,0,0,3
465,Positive Regulation Of Protein Phosphorylation (GO:0001934),0.1079069107791557,1.6464300539643006,3.665754059112415,"['C3', 'CSF1R', 'HFE', 'P2RY1', 'TMEM119', 'INHBB', 'CSPG4', 'SOX9', 'STOX1', 'TGFBR2']",0.39889010079256354,0,0,10
466,Regulation Of Cell Population Proliferation (GO:0042127),0.10887403841469992,1.4459363182988985,3.2064558570669783,"['CSF1R', 'CEBPA', 'TFAP2C', 'NOTCH1', 'TGFB1I1', 'TCIRG1', 'AIF1', 'TBX3', 'TGFBR2', 'ZFP36L1', 'SCIN', 'SAPCD2', 'ADORA3', 'SOX9', 'PIM2', 'S100A11', 'CD33']",0.39889010079256354,0,0,17
467,Response To Lipid (GO:0033993),0.10898135776605397,2.136218799787573,4.735096536973697,"['SYK', 'IRAK3', 'SOX9', 'ASCL1', 'TLR4']",0.39889010079256354,0,0,5
468,Positive Regulation Of T Cell Activation (GO:0050870),0.11130171238253424,2.3896296296296295,5.246457266832265,"['DOCK8', 'HLA-DRA', 'HLA-DOA', 'AIF1']",0.39889010079256354,0,0,4
469,Regulation Of Rho Protein Signal Transduction (GO:0035023),0.11130171238253424,2.3896296296296295,5.246457266832265,"['EPS8', 'P2RY8', 'GPR17', 'ARHGDIB']",0.39889010079256354,0,0,4
470,Positive Regulation Of Developmental Process (GO:0051094),0.113167314338331,1.9417103670835014,4.230769219291383,"['SYDE1', 'GJA1', 'CEBPB', 'FOXD1', 'TMEM119', 'SOX9']",0.39889010079256354,0,0,6
471,Regulation Of Intracellular Signal Transduction (GO:1902531),0.12089570387288825,1.7132116004296456,3.6197198229709113,"['FGD3', 'CSF1R', 'FGD4', 'DOCK8', 'CARD8', 'SLA', 'EZR', 'ARHGAP45']",0.39889010079256354,0,0,8
472,Cellular Response To Chemical Stress (GO:0062197),0.12296870816368854,2.753051376667613,5.769914895767442,"['AIF1', 'ZFP36L2', 'STOX1']",0.39889010079256354,0,0,3
473,Regulation Of Viral Genome Replication (GO:0045069),0.12296870816368854,2.753051376667613,5.769914895767442,"['BST2', 'FAM111A', 'ZC3HAV1']",0.39889010079256354,0,0,3
474,Glycerophospholipid Biosynthetic Process (GO:0046474),0.12296870816368854,2.753051376667613,5.769914895767442,"['INPP5D', 'LPCAT2', 'LCAT']",0.39889010079256354,0,0,3
475,Negative Regulation Of T Cell Proliferation (GO:0042130),0.12296870816368854,2.753051376667613,5.769914895767442,"['SPN', 'CEBPB', 'LILRB4']",0.39889010079256354,0,0,3
476,Positive Regulation Of T Cell Differentiation (GO:0045582),0.12296870816368854,2.753051376667613,5.769914895767442,"['HLA-DRA', 'LILRB4', 'VSIR']",0.39889010079256354,0,0,3
477,Positive Regulation Of Cell Adhesion (GO:0045785),0.12296870816368854,2.753051376667613,5.769914895767442,"['SYK', 'LAMB2', 'PLPP3']",0.39889010079256354,0,0,3
478,rRNA Metabolic Process (GO:0016072),0.12296870816368854,2.753051376667613,5.769914895767442,"['SLFN12', 'CAVIN1', 'ZFP36L1']",0.39889010079256354,0,0,3
479,Fc Receptor Signaling Pathway (GO:0038093),0.12375845124019944,3.9705882352941178,8.296240713148157,"['FCGR3A', 'SYK']",0.39889010079256354,0,0,2
480,Regulation Of Inflammatory Response To Antigenic Stimulus (GO:0002861),0.12375845124019944,3.9705882352941178,8.296240713148157,"['SYK', 'RHBDF2']",0.39889010079256354,0,0,2
481,Antigen Processing And Presentation Of Exogenous Peptide Antigen Via MHC Class II (GO:0019886),0.12375845124019944,3.9705882352941178,8.296240713148157,"['HLA-DRA', 'HLA-DOA']",0.39889010079256354,0,0,2
482,Antigen Processing And Presentation Of Peptide Antigen Via MHC Class II (GO:0002495),0.12375845124019944,3.9705882352941178,8.296240713148157,"['HLA-DRA', 'HLA-DOA']",0.39889010079256354,0,0,2
483,Artery Development (GO:0060840),0.12375845124019944,3.9705882352941178,8.296240713148157,"['SLC2A10', 'TGFBR2']",0.39889010079256354,0,0,2
484,Cardiac Conduction System Development (GO:0003161),0.12375845124019944,3.9705882352941178,8.296240713148157,"['NOTCH2', 'GJA1']",0.39889010079256354,0,0,2
485,Cellular Response To cAMP (GO:0071320),0.12375845124019944,3.9705882352941178,8.296240713148157,"['EZR', 'ZFP36L1']",0.39889010079256354,0,0,2
486,Regulation Of Stem Cell Proliferation (GO:0072091),0.12375845124019944,3.9705882352941178,8.296240713148157,"['GJA1', 'ZFP36L1']",0.39889010079256354,0,0,2
487,Response To BMP (GO:0071772),0.12375845124019944,3.9705882352941178,8.296240713148157,"['TMEM100', 'SOX9']",0.39889010079256354,0,0,2
488,Dicarboxylic Acid Transport (GO:0006835),0.12375845124019944,3.9705882352941178,8.296240713148157,"['GJA1', 'UCP2']",0.39889010079256354,0,0,2
489,Endocardial Cushion Development (GO:0003197),0.12375845124019944,3.9705882352941178,8.296240713148157,"['NOTCH1', 'SOX9']",0.39889010079256354,0,0,2
490,Epithelial Tube Morphogenesis (GO:0060562),0.12375845124019944,3.9705882352941178,8.296240713148157,"['CSF1R', 'MESP1']",0.39889010079256354,0,0,2
491,Ventricular Septum Development (GO:0003281),0.12375845124019944,3.9705882352941178,8.296240713148157,"['NOTCH1', 'TGFBR2']",0.39889010079256354,0,0,2
492,Ventricular Septum Morphogenesis (GO:0060412),0.12375845124019944,3.9705882352941178,8.296240713148157,"['NOTCH1', 'TGFBR2']",0.39889010079256354,0,0,2
493,mRNA Transport (GO:0051028),0.12375845124019944,3.9705882352941178,8.296240713148157,"['ALYREF', 'ZFP36L1']",0.39889010079256354,0,0,2
494,Membrane Lipid Biosynthetic Process (GO:0046467),0.12375845124019944,3.9705882352941178,8.296240713148157,"['ST8SIA6', 'PLPP3']",0.39889010079256354,0,0,2
495,Negative Regulation Of Biomineral Tissue Development (GO:0070168),0.12375845124019944,3.9705882352941178,8.296240713148157,"['NOTCH1', 'SOX9']",0.39889010079256354,0,0,2
496,Negative Regulation Of Endocytosis (GO:0045806),0.12375845124019944,3.9705882352941178,8.296240713148157,"['APOC2', 'APOC1']",0.39889010079256354,0,0,2
497,Negative Regulation Of Inflammatory Response To Antigenic Stimulus (GO:0002862),0.12375845124019944,3.9705882352941178,8.296240713148157,"['SYK', 'RHBDF2']",0.39889010079256354,0,0,2
498,Positive Regulation Of Leukocyte Activation (GO:0002696),0.12375845124019944,3.9705882352941178,8.296240713148157,"['CEBPA', 'TLR4']",0.39889010079256354,0,0,2
499,Positive Regulation Of Morphogenesis Of An Epithelium (GO:1905332),0.12375845124019944,3.9705882352941178,8.296240713148157,"['GJA1', 'SOX9']",0.39889010079256354,0,0,2
500,Positive Regulation Of Phospholipase Activity (GO:0010518),0.12375845124019944,3.9705882352941178,8.296240713148157,"['FLT1', 'APOC2']",0.39889010079256354,0,0,2
501,Positive Regulation Of Protein Transport (GO:0051222),0.12375845124019944,3.9705882352941178,8.296240713148157,"['EZR', 'CD33']",0.39889010079256354,0,0,2
502,Positive Regulation Of Receptor-Mediated Endocytosis (GO:0048260),0.12375845124019944,3.9705882352941178,8.296240713148157,"['C3', 'HFE']",0.39889010079256354,0,0,2
503,Protein N-linked Glycosylation (GO:0006487),0.12375845124019944,3.9705882352941178,8.296240713148157,"['OST4', 'MGAT2']",0.39889010079256354,0,0,2
504,Pulmonary Valve Development (GO:0003177),0.12375845124019944,3.9705882352941178,8.296240713148157,"['NOTCH2', 'NOTCH1']",0.39889010079256354,0,0,2
505,Regulation Of NLRP3 Inflammasome Complex Assembly (GO:1900225),0.12375845124019944,3.9705882352941178,8.296240713148157,"['CARD8', 'TLR4']",0.39889010079256354,0,0,2
506,Cellular Response To Hypoxia (GO:0071456),0.1248335555248494,2.2751322751322753,4.734036050049551,"['NOTCH1', 'EGLN2', 'STOX1', 'ZFP36L1']",0.39889010079256354,0,0,4
507,Receptor-Mediated Endocytosis (GO:0006898),0.13902272192794604,2.171043771043771,4.283725309185693,"['SYK', 'ITGB2', 'LILRB4', 'CXCL16']",0.39889010079256354,0,0,4
508,Regulation Of Epithelial To Mesenchymal Transition (GO:0010717),0.14116278803376509,2.555614127569847,5.003487472316142,"['FOXC1', 'TGFB1I1', 'TGFBR2']",0.39889010079256354,0,0,3
509,Regulation Of Fat Cell Differentiation (GO:0045598),0.14116278803376509,2.555614127569847,5.003487472316142,"['CEBPB', 'ZFP36L2', 'ZFP36L1']",0.39889010079256354,0,0,3
510,Chromatin Remodeling (GO:0006338),0.14116278803376509,2.555614127569847,5.003487472316142,"['TFAP2C', 'DTX3L', 'SOX9']",0.39889010079256354,0,0,3
511,Fat Cell Differentiation (GO:0045444),0.14116278803376509,2.555614127569847,5.003487472316142,"['CEBPA', 'UCP1', 'INHBB']",0.39889010079256354,0,0,3
512,Negative Regulation Of Developmental Process (GO:0051093),0.14116278803376509,2.555614127569847,5.003487472316142,"['FOXC1', 'NOTCH1', 'SOX9']",0.39889010079256354,0,0,3
513,Negative Regulation Of Immune System Process (GO:0002683),0.14116278803376509,2.555614127569847,5.003487472316142,"['IRAK3', 'SOX9', 'LILRB4']",0.39889010079256354,0,0,3
514,Negative Regulation Of Viral Genome Replication (GO:0045071),0.14116278803376509,2.555614127569847,5.003487472316142,"['BST2', 'FAM111A', 'ZC3HAV1']",0.39889010079256354,0,0,3
515,Regulation Of I-kappaB kinase/NF-kappaB Signaling (GO:0043122),0.14137289289546387,1.7105403959336543,3.346422971707653,"['BST2', 'GJA1', 'CARD8', 'S100A4', 'PIM2', 'LILRB4', 'INAVA']",0.39889010079256354,0,0,7
516,Cellular Component Assembly (GO:0022607),0.1438310429835137,1.7944029850746268,3.479555504516298,"['EPS8', 'SCIN', 'HFE', 'SOX9', 'EZR', 'AIF1']",0.39889010079256354,0,0,6
517,Enzyme-Linked Receptor Protein Signaling Pathway (GO:0007167),0.14386951489226477,1.9276891713634727,3.737497329277493,"['CSF1R', 'FLT1', 'SYK', 'AXL', 'BLNK']",0.39889010079256354,0,0,5
518,Negative Regulation Of Nucleic Acid-Templated Transcription (GO:1903507),0.14943986899606793,1.563740771123872,2.972454129186379,"['MESP1', 'CEBPA', 'FOXD1', 'NOTCH1', 'ZIC2', 'NR0B1', 'SOX9', 'ASCL1', 'TBX3']",0.39889010079256354,0,0,9
519,Cdc42 Protein Signal Transduction (GO:0032488),0.14964267629848083,11.886446886446887,22.57836511175367,['RHOJ'],0.39889010079256354,0,0,1
520,Regulation Of Complement Activation (GO:0030449),0.14964267629848083,11.886446886446887,22.57836511175367,['CFH'],0.39889010079256354,0,0,1
521,Regulation Of Complement-Dependent Cytotoxicity (GO:1903659),0.14964267629848083,11.886446886446887,22.57836511175367,['CFH'],0.39889010079256354,0,0,1
522,Regulation Of Epithelial To Mesenchymal Transition Involved In Endocardial Cushion Formation (GO:1905005),0.14964267629848083,11.886446886446887,22.57836511175367,['TGFBR2'],0.39889010079256354,0,0,1
523,Golgi To Lysosome Transport (GO:0090160),0.14964267629848083,11.886446886446887,22.57836511175367,['LAPTM5'],0.39889010079256354,0,0,1
524,Regulation Of Establishment Of T Cell Polarity (GO:1903903),0.14964267629848083,11.886446886446887,22.57836511175367,['DOCK8'],0.39889010079256354,0,0,1
525,Golgi To Vacuole Transport (GO:0006896),0.14964267629848083,11.886446886446887,22.57836511175367,['LAPTM5'],0.39889010079256354,0,0,1
526,Regulation Of Execution Phase Of Apoptosis (GO:1900117),0.14964267629848083,11.886446886446887,22.57836511175367,['TP53BP2'],0.39889010079256354,0,0,1
527,N-glycan Processing (GO:0006491),0.14964267629848083,11.886446886446887,22.57836511175367,['ST8SIA6'],0.39889010079256354,0,0,1
528,Regulation Of Humoral Immune Response (GO:0002920),0.14964267629848083,11.886446886446887,22.57836511175367,['CFH'],0.39889010079256354,0,0,1
529,T Cell Chemotaxis (GO:0010818),0.14964267629848083,11.886446886446887,22.57836511175367,['CXCL16'],0.39889010079256354,0,0,1
530,Regulation Of Inositol Phosphate Biosynthetic Process (GO:0010919),0.14964267629848083,11.886446886446887,22.57836511175367,['PTH1R'],0.39889010079256354,0,0,1
531,T-helper Cell Lineage Commitment (GO:0002295),0.14964267629848083,11.886446886446887,22.57836511175367,['SPN'],0.39889010079256354,0,0,1
532,Regulation Of Interleukin-1 Production (GO:0032652),0.14964267629848083,11.886446886446887,22.57836511175367,['TLR4'],0.39889010079256354,0,0,1
533,Regulation Of Intracellular Steroid Hormone Receptor Signaling Pathway (GO:0033143),0.14964267629848083,11.886446886446887,22.57836511175367,['NR0B1'],0.39889010079256354,0,0,1
534,Activin Receptor Signaling Pathway (GO:0032924),0.14964267629848083,11.886446886446887,22.57836511175367,['INHBB'],0.39889010079256354,0,0,1
535,Acute-Phase Response (GO:0006953),0.14964267629848083,11.886446886446887,22.57836511175367,['CEBPB'],0.39889010079256354,0,0,1
536,Regulation Of Lymphocyte Migration (GO:2000401),0.14964267629848083,11.886446886446887,22.57836511175367,['SPN'],0.39889010079256354,0,0,1
537,Adherens Junction Maintenance (GO:0034334),0.14964267629848083,11.886446886446887,22.57836511175367,['INAVA'],0.39889010079256354,0,0,1
538,Adrenal Gland Development (GO:0030325),0.14964267629848083,11.886446886446887,22.57836511175367,['NR0B1'],0.39889010079256354,0,0,1
539,Regulation Of Macrophage Differentiation (GO:0045649),0.14964267629848083,11.886446886446887,22.57836511175367,['C1QC'],0.39889010079256354,0,0,1
540,Regulation Of Meiotic Cell Cycle (GO:0051445),0.14964267629848083,11.886446886446887,22.57836511175367,['ANAPC15'],0.39889010079256354,0,0,1
541,Regulation Of Memory T Cell Differentiation (GO:0043380),0.14964267629848083,11.886446886446887,22.57836511175367,['HLA-DRA'],0.39889010079256354,0,0,1
542,Amino-Acid Betaine Transport (GO:0015838),0.14964267629848083,11.886446886446887,22.57836511175367,['SLC6A12'],0.39889010079256354,0,0,1
543,Anaphase-Promoting Complex-Dependent Catabolic Process (GO:0031145),0.14964267629848083,11.886446886446887,22.57836511175367,['ANAPC15'],0.39889010079256354,0,0,1
544,Regulation Of Myeloid Leukocyte Differentiation (GO:0002761),0.14964267629848083,11.886446886446887,22.57836511175367,['CEBPB'],0.39889010079256354,0,0,1
545,Regulation Of Natural Killer Cell Chemotaxis (GO:2000501),0.14964267629848083,11.886446886446887,22.57836511175367,['KLRK1'],0.39889010079256354,0,0,1
546,Atrial Septum Development (GO:0003283),0.14964267629848083,11.886446886446887,22.57836511175367,['NOTCH2'],0.39889010079256354,0,0,1
547,Atrial Septum Morphogenesis (GO:0060413),0.14964267629848083,11.886446886446887,22.57836511175367,['NOTCH2'],0.39889010079256354,0,0,1
548,Regulation Of Neutrophil Activation (GO:1902563),0.14964267629848083,11.886446886446887,22.57836511175367,['SYK'],0.39889010079256354,0,0,1
549,Regulation Of Pinocytosis (GO:0048548),0.14964267629848083,11.886446886446887,22.57836511175367,['AXL'],0.39889010079256354,0,0,1
550,Cardiac Atrium Development (GO:0003230),0.14964267629848083,11.886446886446887,22.57836511175367,['NOTCH1'],0.39889010079256354,0,0,1
551,Regulation Of Protein Localization To Early Endosome (GO:1902965),0.14964267629848083,11.886446886446887,22.57836511175367,['EZR'],0.39889010079256354,0,0,1
552,Cardiac Pacemaker Cell Development (GO:0060926),0.14964267629848083,11.886446886446887,22.57836511175367,['TBX3'],0.39889010079256354,0,0,1
553,Cardiocyte Differentiation (GO:0035051),0.14964267629848083,11.886446886446887,22.57836511175367,['MESP1'],0.39889010079256354,0,0,1
554,Regulation Of Pseudopodium Assembly (GO:0031272),0.14964267629848083,11.886446886446887,22.57836511175367,['CDC42EP4'],0.39889010079256354,0,0,1
555,Regulation Of Receptor Binding (GO:1900120),0.14964267629848083,11.886446886446887,22.57836511175367,['HFE'],0.39889010079256354,0,0,1
556,Cell Migration Involved In Heart Development (GO:0060973),0.14964267629848083,11.886446886446887,22.57836511175367,['NOTCH1'],0.39889010079256354,0,0,1
557,Regulation Of Response To Stress (GO:0080134),0.14964267629848083,11.886446886446887,22.57836511175367,['STOX1'],0.39889010079256354,0,0,1
558,Cellular Response To Granulocyte Macrophage Colony-Stimulating Factor Stimulus (GO:0097011),0.14964267629848083,11.886446886446887,22.57836511175367,['ZFP36L2'],0.39889010079256354,0,0,1
559,Regulation Of Transcription From RNA Polymerase II Promoter In Response To Hypoxia (GO:0061418),0.14964267629848083,11.886446886446887,22.57836511175367,['STOX1'],0.39889010079256354,0,0,1
560,Cellular Response To Muramyl Dipeptide (GO:0071225),0.14964267629848083,11.886446886446887,22.57836511175367,['VIM'],0.39889010079256354,0,0,1
561,Regulation Of Transforming Growth Factor Beta1 Production (GO:0032908),0.14964267629848083,11.886446886446887,22.57836511175367,['TYROBP'],0.39889010079256354,0,0,1
562,Regulation Of Triglyceride Catabolic Process (GO:0010896),0.14964267629848083,11.886446886446887,22.57836511175367,['APOC2'],0.39889010079256354,0,0,1
563,Contractile Actin Filament Bundle Assembly (GO:0030038),0.14964267629848083,11.886446886446887,22.57836511175367,['ITGB5'],0.39889010079256354,0,0,1
564,Cyclooxygenase Pathway (GO:0019371),0.14964267629848083,11.886446886446887,22.57836511175367,['TBXAS1'],0.39889010079256354,0,0,1
565,Response To Granulocyte Macrophage Colony-Stimulating Factor (GO:0097012),0.14964267629848083,11.886446886446887,22.57836511175367,['ZFP36L2'],0.39889010079256354,0,0,1
566,Cytochrome Complex Assembly (GO:0017004),0.14964267629848083,11.886446886446887,22.57836511175367,['CYBA'],0.39889010079256354,0,0,1
567,Response To Interleukin-6 (GO:0070741),0.14964267629848083,11.886446886446887,22.57836511175367,['SELPLG'],0.39889010079256354,0,0,1
568,Response To Iron Ion (GO:0010039),0.14964267629848083,11.886446886446887,22.57836511175367,['HFE'],0.39889010079256354,0,0,1
569,Dehydroascorbic Acid Transport (GO:0070837),0.14964267629848083,11.886446886446887,22.57836511175367,['SLC2A10'],0.39889010079256354,0,0,1
570,Detection Of Molecule Of Bacterial Origin (GO:0032490),0.14964267629848083,11.886446886446887,22.57836511175367,['TLR4'],0.39889010079256354,0,0,1
571,Embryonic Skeletal Joint Development (GO:0072498),0.14964267629848083,11.886446886446887,22.57836511175367,['SLC2A10'],0.39889010079256354,0,0,1
572,Sphingoid Metabolic Process (GO:0046519),0.14964267629848083,11.886446886446887,22.57836511175367,['PLPP3'],0.39889010079256354,0,0,1
573,Epithelial Tube Formation (GO:0072175),0.14964267629848083,11.886446886446887,22.57836511175367,['SOX9'],0.39889010079256354,0,0,1
574,Stress Fiber Assembly (GO:0043149),0.14964267629848083,11.886446886446887,22.57836511175367,['ITGB5'],0.39889010079256354,0,0,1
575,Exit From Mitosis (GO:0010458),0.14964267629848083,11.886446886446887,22.57836511175367,['EPS8'],0.39889010079256354,0,0,1
576,tRNA Metabolic Process (GO:0006399),0.14964267629848083,11.886446886446887,22.57836511175367,['ZFP36L1'],0.39889010079256354,0,0,1
577,Fluid Transport (GO:0042044),0.14964267629848083,11.886446886446887,22.57836511175367,['AQP4'],0.39889010079256354,0,0,1
578,Toll-Like Receptor 3 Signaling Pathway (GO:0034138),0.14964267629848083,11.886446886446887,22.57836511175367,['UNC93B1'],0.39889010079256354,0,0,1
579,Toll-Like Receptor 9 Signaling Pathway (GO:0034162),0.14964267629848083,11.886446886446887,22.57836511175367,['UNC93B1'],0.39889010079256354,0,0,1
580,Ventricular Trabecula Myocardium Morphogenesis (GO:0003222),0.14964267629848083,11.886446886446887,22.57836511175367,['NOTCH1'],0.39889010079256354,0,0,1
581,Hemostasis (GO:0007599),0.14964267629848083,11.886446886446887,22.57836511175367,['FLI1'],0.39889010079256354,0,0,1
582,"Wound Healing, Spreading Of Epidermal Cells (GO:0035313)",0.14964267629848083,11.886446886446887,22.57836511175367,['ARHGAP24'],0.39889010079256354,0,0,1
583,Hydrogen Peroxide Biosynthetic Process (GO:0050665),0.14964267629848083,11.886446886446887,22.57836511175367,['CYBA'],0.39889010079256354,0,0,1
584,Intracellular Lipid Transport (GO:0032365),0.14964267629848083,11.886446886446887,22.57836511175367,['GRAMD1C'],0.39889010079256354,0,0,1
585,Intracellular Monoatomic Ion Homeostasis (GO:0006873),0.14964267629848083,11.886446886446887,22.57836511175367,['SLC39A12'],0.39889010079256354,0,0,1
586,Intracellular Sterol Transport (GO:0032366),0.14964267629848083,11.886446886446887,22.57836511175367,['GRAMD1C'],0.39889010079256354,0,0,1
587,Keratinocyte Proliferation (GO:0043616),0.14964267629848083,11.886446886446887,22.57836511175367,['FERMT1'],0.39889010079256354,0,0,1
588,Mesonephric Tubule Development (GO:0072164),0.14964267629848083,11.886446886446887,22.57836511175367,['FOXC1'],0.39889010079256354,0,0,1
589,Microvillus Assembly (GO:0030033),0.14964267629848083,11.886446886446887,22.57836511175367,['EZR'],0.39889010079256354,0,0,1
590,Mitochondrial Fission (GO:0000266),0.14964267629848083,11.886446886446887,22.57836511175367,['UCP2'],0.39889010079256354,0,0,1
591,Mitral Valve Morphogenesis (GO:0003183),0.14964267629848083,11.886446886446887,22.57836511175367,['NOTCH1'],0.39889010079256354,0,0,1
592,Myeloid Dendritic Cell Activation (GO:0001773),0.14964267629848083,11.886446886446887,22.57836511175367,['TGFBR2'],0.39889010079256354,0,0,1
593,Myeloid Dendritic Cell Differentiation (GO:0043011),0.14964267629848083,11.886446886446887,22.57836511175367,['TGFBR2'],0.39889010079256354,0,0,1
594,"Negative Regulation Of CD4-positive, Alpha-Beta T Cell Proliferation (GO:2000562)",0.14964267629848083,11.886446886446887,22.57836511175367,['VSIR'],0.39889010079256354,0,0,1
595,Negative Regulation Of SMAD Protein Signal Transduction (GO:0060392),0.14964267629848083,11.886446886446887,22.57836511175367,['SLC2A10'],0.39889010079256354,0,0,1
596,Negative Regulation Of Actin Filament Depolymerization (GO:0030835),0.14964267629848083,11.886446886446887,22.57836511175367,['SCIN'],0.39889010079256354,0,0,1
597,Negative Regulation Of Alpha-Beta T Cell Proliferation (GO:0046642),0.14964267629848083,11.886446886446887,22.57836511175367,['VSIR'],0.39889010079256354,0,0,1
598,Negative Regulation Of Cell Communication (GO:0010648),0.14964267629848083,11.886446886446887,22.57836511175367,['INPP5D'],0.39889010079256354,0,0,1
599,Negative Regulation Of Fatty Acid Biosynthetic Process (GO:0045717),0.14964267629848083,11.886446886446887,22.57836511175367,['APOC1'],0.39889010079256354,0,0,1
600,Negative Regulation Of Glial Cell Proliferation (GO:0060253),0.14964267629848083,11.886446886446887,22.57836511175367,['NOTCH1'],0.39889010079256354,0,0,1
601,Negative Regulation Of Gluconeogenesis (GO:0045721),0.14964267629848083,11.886446886446887,22.57836511175367,['ERFE'],0.39889010079256354,0,0,1
602,Negative Regulation Of Homotypic Cell-Cell Adhesion (GO:0034111),0.14964267629848083,11.886446886446887,22.57836511175367,['C1QTNF1'],0.39889010079256354,0,0,1
603,Negative Regulation Of Hormone Secretion (GO:0046888),0.14964267629848083,11.886446886446887,22.57836511175367,['GJA1'],0.39889010079256354,0,0,1
604,Negative Regulation Of Lipid Catabolic Process (GO:0050995),0.14964267629848083,11.886446886446887,22.57836511175367,['APOC1'],0.39889010079256354,0,0,1
605,Negative Regulation Of Mast Cell Activation (GO:0033004),0.14964267629848083,11.886446886446887,22.57836511175367,['MILR1'],0.39889010079256354,0,0,1
606,Negative Regulation Of p38MAPK Cascade (GO:1903753),0.14964267629848083,11.886446886446887,22.57836511175367,['EZR'],0.39889010079256354,0,0,1
607,Negative Regulation Of Platelet Aggregation (GO:0090331),0.14964267629848083,11.886446886446887,22.57836511175367,['C1QTNF1'],0.39889010079256354,0,0,1
608,Negative Regulation Of Proteasomal Ubiquitin-Dependent Protein Catabolic Process (GO:0032435),0.14964267629848083,11.886446886446887,22.57836511175367,['HFE'],0.39889010079256354,0,0,1
609,Negative Regulation Of Protein-Containing Complex Disassembly (GO:0043242),0.14964267629848083,11.886446886446887,22.57836511175367,['IRAK3'],0.39889010079256354,0,0,1
610,Negative Regulation Of Receptor Binding (GO:1900121),0.14964267629848083,11.886446886446887,22.57836511175367,['HFE'],0.39889010079256354,0,0,1
611,Negative Regulation Of Signaling (GO:0023057),0.14964267629848083,11.886446886446887,22.57836511175367,['INPP5D'],0.39889010079256354,0,0,1
612,Negative Regulation Of Transforming Growth Factor Beta Production (GO:0071635),0.14964267629848083,11.886446886446887,22.57836511175367,['TYROBP'],0.39889010079256354,0,0,1
613,Neutrophil Mediated Immunity (GO:0002446),0.14964267629848083,11.886446886446887,22.57836511175367,['ANXA3'],0.39889010079256354,0,0,1
614,"Nuclear-Transcribed mRNA Catabolic Process, Deadenylation-Independent Decay (GO:0031086)",0.14964267629848083,11.886446886446887,22.57836511175367,['ZFP36L1'],0.39889010079256354,0,0,1
615,p38MAPK Cascade (GO:0038066),0.14964267629848083,11.886446886446887,22.57836511175367,['ZFP36L1'],0.39889010079256354,0,0,1
616,Pathway-Restricted SMAD Protein Phosphorylation (GO:0060389),0.14964267629848083,11.886446886446887,22.57836511175367,['TGFBR2'],0.39889010079256354,0,0,1
617,Pericardium Development (GO:0060039),0.14964267629848083,11.886446886446887,22.57836511175367,['NOTCH1'],0.39889010079256354,0,0,1
618,Pericardium Morphogenesis (GO:0003344),0.14964267629848083,11.886446886446887,22.57836511175367,['NOTCH1'],0.39889010079256354,0,0,1
619,Peripheral Nervous System Neuron Development (GO:0048935),0.14964267629848083,11.886446886446887,22.57836511175367,['RUNX3'],0.39889010079256354,0,0,1
620,Pituitary Gland Development (GO:0021983),0.14964267629848083,11.886446886446887,22.57836511175367,['NR0B1'],0.39889010079256354,0,0,1
621,Podocyte Differentiation (GO:0072112),0.14964267629848083,11.886446886446887,22.57836511175367,['KLF15'],0.39889010079256354,0,0,1
