Rank,Term name,P-value,Z-score,Combined score,Overlapping genes,Adjusted p-value,Old p-value,Old adjusted p-value,gene count
1282,Positive Regulation Of Cytoskeleton Organization (GO:0051495),0.38617667111388826,1.5838235294117646,1.5069452374334489,"['SCIN', 'CDC42EP4']",0.5393260507935795,0,0,2
1283,Positive Regulation Of Type I Interferon Production (GO:0032481),0.38617667111388826,1.5838235294117646,1.5069452374334489,"['CD14', 'TLR4']",0.5393260507935795,0,0,2
1284,Potassium Ion Import Across Plasma Membrane (GO:1990573),0.38617667111388826,1.5838235294117646,1.5069452374334489,"['SLC12A4', 'SLC12A7']",0.5393260507935795,0,0,2
1285,Regulation Of Notch Signaling Pathway (GO:0008593),0.38617667111388826,1.5838235294117646,1.5069452374334489,"['LFNG', 'MESP1']",0.5393260507935795,0,0,2
1286,Regulation Of Cell Cycle Process (GO:0010564),0.38617667111388826,1.5838235294117646,1.5069452374334489,"['CCDC8', 'SOX9']",0.5393260507935795,0,0,2
1287,Regulation Of Kinase Activity (GO:0043549),0.3955402666372346,1.3709906329832529,1.271597493173134,"['CSF1R', 'FLT1', 'AXL']",0.5502636087377796,0,0,3
1288,Negative Regulation Of Transmembrane Receptor Protein Serine/Threonine Kinase Signaling Pathway (GO:0090101),0.3955402666372346,1.3709906329832529,1.271597493173134,"['NOTCH1', 'SLC2A10', 'TGFB1I1']",0.5502636087377796,0,0,3
1289,Positive Regulation Of Inflammatory Response (GO:0050729),0.3955402666372346,1.3709906329832529,1.271597493173134,"['CEBPA', 'TLR4', 'GPSM3']",0.5502636087377796,0,0,3
1290,Protein Stabilization (GO:0050821),0.3955402666372346,1.3709906329832529,1.271597493173134,"['TYROBP', 'PIM2', 'PLPP3']",0.5502636087377796,0,0,3
1291,Regulation Of Cellular Component Organization (GO:0051128),0.3955402666372346,1.3709906329832529,1.271597493173134,"['EGLN2', 'SLC2A10', 'IRAK3']",0.5502636087377796,0,0,3
1292,Negative Regulation Of Multicellular Organismal Process (GO:0051241),0.39665741052138803,1.2383828996282529,1.1451107685118525,"['GJA1', 'NOTCH1', 'ARHGDIB', 'SOX9', 'TLR4']",0.5513906418702886,0,0,5
1293,Cellular Response To Organic Cyclic Compound (GO:0071407),0.3973825491702513,1.2848848848848848,1.1857635484406985,"['P2RY1', 'EZR', 'TFPI', 'ZFP36L1']",0.5519714294739144,0,0,4
1294,Regulation Of Cyclin-Dependent Protein Serine/Threonine Kinase Activity (GO:0000079),0.41442530379653314,1.484375,1.3075303159143123,"['CEBPA', 'LATS2']",0.5650287633818155,0,0,2
1295,Regulation Of Epithelial Cell Migration (GO:0010632),0.41442530379653314,1.484375,1.3075303159143123,"['RHOJ', 'SOX9']",0.5650287633818155,0,0,2
1296,Regulation Of Extrinsic Apoptotic Signaling Pathway (GO:2001236),0.41442530379653314,1.484375,1.3075303159143123,"['ITGA6', 'TLR4']",0.5650287633818155,0,0,2
1297,Regulation Of Nervous System Development (GO:0051960),0.41442530379653314,1.484375,1.3075303159143123,"['ASCL1', 'S100A10']",0.5650287633818155,0,0,2
1298,Cellular Response To Insulin Stimulus (GO:0032869),0.41442530379653314,1.484375,1.3075303159143123,"['INHBB', 'ZFP36L1']",0.5650287633818155,0,0,2
1299,Response To Insulin (GO:0032868),0.41442530379653314,1.484375,1.3075303159143123,"['INHBB', 'ZFP36L1']",0.5650287633818155,0,0,2
1300,Positive Regulation Of Endothelial Cell Migration (GO:0010595),0.41442530379653314,1.484375,1.3075303159143123,"['ANXA3', 'PLPP3']",0.5650287633818155,0,0,2
1301,Positive Regulation Of Immune Response (GO:0050778),0.41442530379653314,1.484375,1.3075303159143123,"['ITGB2', 'HLA-DRA']",0.5650287633818155,0,0,2
1302,Positive Regulation Of Protein Localization (GO:1903829),0.41442530379653314,1.484375,1.3075303159143123,"['TYROBP', 'DTX3L']",0.5650287633818155,0,0,2
1303,Regulation Of BMP Signaling Pathway (GO:0030510),0.41442530379653314,1.484375,1.3075303159143123,"['FOXD1', 'NOTCH1']",0.5650287633818155,0,0,2
1304,Intracellular Monoatomic Cation Homeostasis (GO:0030003),0.42840579084185737,1.1881040892193309,1.0071373294866428,"['HFE', 'ATP13A4', 'PTH1R', 'SLC39A12', 'ERFE']",0.5650287633818155,0,0,5
1305,DNA Damage Checkpoint Signaling (GO:0000077),0.4332096921919599,1.978021978021978,1.6546814320047143,['DTX3L'],0.5650287633818155,0,0,1
1306,Regulation Of Developmental Growth (GO:0048638),0.4332096921919599,1.978021978021978,1.6546814320047143,['LATS2'],0.5650287633818155,0,0,1
1307,Fc-epsilon Receptor Signaling Pathway (GO:0038095),0.4332096921919599,1.978021978021978,1.6546814320047143,['SYK'],0.5650287633818155,0,0,1
1308,Fc-gamma Receptor Signaling Pathway Involved In Phagocytosis (GO:0038096),0.4332096921919599,1.978021978021978,1.6546814320047143,['SYK'],0.5650287633818155,0,0,1
1309,RNA Metabolic Process (GO:0016070),0.4332096921919599,1.978021978021978,1.6546814320047143,['RBMS2'],0.5650287633818155,0,0,1
1310,Regulation Of Intracellular Protein Transport (GO:0033157),0.4332096921919599,1.978021978021978,1.6546814320047143,['IFI27'],0.5650287633818155,0,0,1
1311,Regulation Of Lipopolysaccharide-Mediated Signaling Pathway (GO:0031664),0.4332096921919599,1.978021978021978,1.6546814320047143,['CARD8'],0.5650287633818155,0,0,1
1312,Adaptive Immune Response Based On Somatic Recombination Of Immune Receptors Built From Immunoglobulin Superfamily Domains (GO:0002460),0.4332096921919599,1.978021978021978,1.6546814320047143,['TLR4'],0.5650287633818155,0,0,1
1313,Regulation Of Mast Cell Degranulation (GO:0043304),0.4332096921919599,1.978021978021978,1.6546814320047143,['SYK'],0.5650287633818155,0,0,1
1314,Regulation Of Mitochondrial Membrane Potential (GO:0051881),0.4332096921919599,1.978021978021978,1.6546814320047143,['STOX1'],0.5650287633818155,0,0,1
1315,Regulation Of Mitochondrion Organization (GO:0010821),0.4332096921919599,1.978021978021978,1.6546814320047143,['STOX1'],0.5650287633818155,0,0,1
1316,Regulation Of Monocyte Chemotactic Protein-1 Production (GO:0071637),0.4332096921919599,1.978021978021978,1.6546814320047143,['SYK'],0.5650287633818155,0,0,1
1317,Apoptotic Cell Clearance (GO:0043277),0.4332096921919599,1.978021978021978,1.6546814320047143,['TYROBP'],0.5650287633818155,0,0,1
1318,Regulation Of Postsynapse Organization (GO:0099175),0.4332096921919599,1.978021978021978,1.6546814320047143,['PDLIM5'],0.5650287633818155,0,0,1
1319,Carboxylic Acid Metabolic Process (GO:0019752),0.4332096921919599,1.978021978021978,1.6546814320047143,['TBXAS1'],0.5650287633818155,0,0,1
1320,Regulation Of Protein Export From Nucleus (GO:0046825),0.4332096921919599,1.978021978021978,1.6546814320047143,['IFI27'],0.5650287633818155,0,0,1
1321,Cardiac Muscle Cell Development (GO:0055013),0.4332096921919599,1.978021978021978,1.6546814320047143,['PDLIM5'],0.5650287633818155,0,0,1
1322,Regulation Of Protein Targeting To Membrane (GO:0090313),0.4332096921919599,1.978021978021978,1.6546814320047143,['ITGB2'],0.5650287633818155,0,0,1
1323,Cell Junction Maintenance (GO:0034331),0.4332096921919599,1.978021978021978,1.6546814320047143,['CSF1R'],0.5650287633818155,0,0,1
1324,Cell Projection Organization (GO:0030030),0.4332096921919599,1.978021978021978,1.6546814320047143,['SCIN'],0.5650287633818155,0,0,1
1325,Regulation Of Toll-Like Receptor 2 Signaling Pathway (GO:0034135),0.4332096921919599,1.978021978021978,1.6546814320047143,['CYBA'],0.5650287633818155,0,0,1
1326,Chondrocyte Differentiation (GO:0002062),0.4332096921919599,1.978021978021978,1.6546814320047143,['SOX9'],0.5650287633818155,0,0,1
1327,Respiratory Tube Development (GO:0030323),0.4332096921919599,1.978021978021978,1.6546814320047143,['CEBPA'],0.5650287633818155,0,0,1
1328,Cytoplasmic Microtubule Organization (GO:0031122),0.4332096921919599,1.978021978021978,1.6546814320047143,['EZR'],0.5650287633818155,0,0,1
1329,Determination Of Bilateral Symmetry (GO:0009855),0.4332096921919599,1.978021978021978,1.6546814320047143,['NOTCH1'],0.5650287633818155,0,0,1
1330,Embryonic Heart Tube Development (GO:0035050),0.4332096921919599,1.978021978021978,1.6546814320047143,['MESP1'],0.5650287633818155,0,0,1
1331,Endosome To Lysosome Transport (GO:0008333),0.4332096921919599,1.978021978021978,1.6546814320047143,['DTX3L'],0.5650287633818155,0,0,1
1332,Spindle Assembly (GO:0051225),0.4332096921919599,1.978021978021978,1.6546814320047143,['SAC3D1'],0.5650287633818155,0,0,1
1333,Establishment Of Protein Localization To Plasma Membrane (GO:0061951),0.4332096921919599,1.978021978021978,1.6546814320047143,['VAMP5'],0.5650287633818155,0,0,1
1334,Toll-Like Receptor 4 Signaling Pathway (GO:0034142),0.4332096921919599,1.978021978021978,1.6546814320047143,['TLR4'],0.5650287633818155,0,0,1
1335,Glycoprotein Metabolic Process (GO:0009100),0.4332096921919599,1.978021978021978,1.6546814320047143,['ST8SIA6'],0.5650287633818155,0,0,1
1336,Ventricular Cardiac Muscle Tissue Morphogenesis (GO:0055010),0.4332096921919599,1.978021978021978,1.6546814320047143,['NOTCH1'],0.5650287633818155,0,0,1
1337,Innate Immune Response-Activating Signaling Pathway (GO:0002758),0.4332096921919599,1.978021978021978,1.6546814320047143,['INAVA'],0.5650287633818155,0,0,1
1338,Left/Right Pattern Formation (GO:0060972),0.4332096921919599,1.978021978021978,1.6546814320047143,['NOTCH1'],0.5650287633818155,0,0,1
1339,Lipid Catabolic Process (GO:0016042),0.4332096921919599,1.978021978021978,1.6546814320047143,['AOAH'],0.5650287633818155,0,0,1
1340,Lipopolysaccharide-Mediated Signaling Pathway (GO:0031663),0.4332096921919599,1.978021978021978,1.6546814320047143,['TLR4'],0.5650287633818155,0,0,1
1341,Long-Chain Fatty Acid Biosynthetic Process (GO:0042759),0.4332096921919599,1.978021978021978,1.6546814320047143,['LTC4S'],0.5650287633818155,0,0,1
1342,Lymphocyte Migration (GO:0072676),0.4332096921919599,1.978021978021978,1.6546814320047143,['S1PR1'],0.5650287633818155,0,0,1
1343,mRNA Metabolic Process (GO:0016071),0.4332096921919599,1.978021978021978,1.6546814320047143,['ZFP36L2'],0.5650287633818155,0,0,1
1344,Membrane Raft Organization (GO:0031579),0.4332096921919599,1.978021978021978,1.6546814320047143,['S100A10'],0.5650287633818155,0,0,1
1345,Metaphase Plate Congression (GO:0051310),0.4332096921919599,1.978021978021978,1.6546814320047143,['EML3'],0.5650287633818155,0,0,1
1346,Mitotic Nuclear Division (GO:0140014),0.4332096921919599,1.978021978021978,1.6546814320047143,['EPS8'],0.5650287633818155,0,0,1
1347,Multicellular Organismal-Level Water Homeostasis (GO:0050891),0.4332096921919599,1.978021978021978,1.6546814320047143,['AQP4'],0.5650287633818155,0,0,1
1348,Negative Regulation Of BMP Signaling Pathway (GO:0030514),0.4332096921919599,1.978021978021978,1.6546814320047143,['NOTCH1'],0.5650287633818155,0,0,1
1349,Negative Regulation Of Fat Cell Differentiation (GO:0045599),0.4332096921919599,1.978021978021978,1.6546814320047143,['ZFP36L2'],0.5650287633818155,0,0,1
1350,Negative Regulation Of Hydrolase Activity (GO:0051346),0.4332096921919599,1.978021978021978,1.6546814320047143,['KLRK1'],0.5650287633818155,0,0,1
1351,Negative Regulation Of Interleukin-8 Production (GO:0032717),0.4332096921919599,1.978021978021978,1.6546814320047143,['CD33'],0.5650287633818155,0,0,1
1352,Negative Regulation Of Neurogenesis (GO:0050768),0.4332096921919599,1.978021978021978,1.6546814320047143,['NOTCH1'],0.5650287633818155,0,0,1
1353,Negative Regulation Of Proteolysis Involved In Protein Catabolic Process (GO:1903051),0.4332096921919599,1.978021978021978,1.6546814320047143,['HFE'],0.5650287633818155,0,0,1
1354,Negative Regulation Of Type I Interferon Production (GO:0032480),0.4332096921919599,1.978021978021978,1.6546814320047143,['TYROBP'],0.5650287633818155,0,0,1
1355,Negative Regulation Of Wound Healing (GO:0061045),0.4332096921919599,1.978021978021978,1.6546814320047143,['TFPI'],0.5650287633818155,0,0,1
1356,Nuclear-Transcribed mRNA Catabolic Process (GO:0000956),0.4332096921919599,1.978021978021978,1.6546814320047143,['ZFP36L1'],0.5650287633818155,0,0,1
1357,Oligodendrocyte Differentiation (GO:0048709),0.4332096921919599,1.978021978021978,1.6546814320047143,['SOX9'],0.5650287633818155,0,0,1
1358,Outflow Tract Septum Morphogenesis (GO:0003148),0.4332096921919599,1.978021978021978,1.6546814320047143,['TGFBR2'],0.5650287633818155,0,0,1
1359,Positive Regulation Of G Protein-Coupled Receptor Signaling Pathway (GO:0045745),0.4332096921919599,1.978021978021978,1.6546814320047143,['C3'],0.5650287633818155,0,0,1
1360,Positive Regulation Of Notch Signaling Pathway (GO:0045747),0.4332096921919599,1.978021978021978,1.6546814320047143,['MESP1'],0.5650287633818155,0,0,1
1361,Positive Regulation Of Cell Migration Involved In Sprouting Angiogenesis (GO:0090050),0.4332096921919599,1.978021978021978,1.6546814320047143,['RHOJ'],0.5650287633818155,0,0,1
1362,Positive Regulation Of Cytokine Production Involved In Inflammatory Response (GO:1900017),0.4332096921919599,1.978021978021978,1.6546814320047143,['TLR4'],0.5650287633818155,0,0,1
1363,Positive Regulation Of Defense Response To Virus By Host (GO:0002230),0.4332096921919599,1.978021978021978,1.6546814320047143,['DTX3L'],0.5650287633818155,0,0,1
1364,Positive Regulation Of Epidermal Cell Differentiation (GO:0045606),0.4332096921919599,1.978021978021978,1.6546814320047143,['FOXC1'],0.5650287633818155,0,0,1
1365,Positive Regulation Of Glial Cell Differentiation (GO:0045687),0.4332096921919599,1.978021978021978,1.6546814320047143,['NOTCH1'],0.5650287633818155,0,0,1
1366,Positive Regulation Of Lipid Kinase Activity (GO:0090218),0.4332096921919599,1.978021978021978,1.6546814320047143,['FLT1'],0.5650287633818155,0,0,1
1367,Positive Regulation Of Macrophage Chemotaxis (GO:0010759),0.4332096921919599,1.978021978021978,1.6546814320047143,['CSF1R'],0.5650287633818155,0,0,1
1368,Positive Regulation Of Myeloid Leukocyte Cytokine Production Involved In Immune Response (GO:0061081),0.4332096921919599,1.978021978021978,1.6546814320047143,['LAPTM5'],0.5650287633818155,0,0,1
1369,Positive Regulation Of Neuron Apoptotic Process (GO:0043525),0.4332096921919599,1.978021978021978,1.6546814320047143,['TYROBP'],0.5650287633818155,0,0,1
1370,Positive Regulation Of Peptidyl-Threonine Phosphorylation (GO:0010800),0.4332096921919599,1.978021978021978,1.6546814320047143,['STOX1'],0.5650287633818155,0,0,1
1371,"Positive Regulation Of Phagocytosis, Engulfment (GO:0060100)",0.4332096921919599,1.978021978021978,1.6546814320047143,['C3'],0.5650287633818155,0,0,1
1372,Post-Translational Protein Modification (GO:0043687),0.4332096921919599,1.978021978021978,1.6546814320047143,['ZC3HAV1'],0.5650287633818155,0,0,1
1373,Regulation Of SMAD Protein Signal Transduction (GO:0060390),0.4332096921919599,1.978021978021978,1.6546814320047143,['SLC2A10'],0.5650287633818155,0,0,1
1374,Regulation Of Activated T Cell Proliferation (GO:0046006),0.4332096921919599,1.978021978021978,1.6546814320047143,['LILRB4'],0.5650287633818155,0,0,1
1375,Regulation Of Cardiac Muscle Cell Proliferation (GO:0060043),0.4332096921919599,1.978021978021978,1.6546814320047143,['NOTCH1'],0.5650287633818155,0,0,1
1376,Regulation Of Cell Adhesion Mediated By Integrin (GO:0033628),0.4332096921919599,1.978021978021978,1.6546814320047143,['SYK'],0.5650287633818155,0,0,1
1377,Regulation Of Cell Size (GO:0008361),0.4332096921919599,1.978021978021978,1.6546814320047143,['EZR'],0.5650287633818155,0,0,1
1378,Regulation Of Nucleic Acid-Templated Transcription (GO:1903506),0.4377358869396975,1.149735194992778,0.9498417146980114,"['CEBPA', 'FOXC1', 'CEBPB', 'NOTCH1', 'RUNX3', 'SOX21']",0.5701788869107577,0,0,6
1379,Mitochondrion Organization (GO:0007005),0.43842819756333873,1.2722720084343702,1.0490636227362198,"['UCP2', 'COX7A1', 'HIGD1B']",0.5701788869107577,0,0,3
1380,Positive Regulation Of Kinase Activity (GO:0033674),0.43842819756333873,1.2722720084343702,1.0490636227362198,"['CSF1R', 'FLT1', 'AXL']",0.5701788869107577,0,0,3
1381,Regulation Of Cell Adhesion (GO:0030155),0.43842819756333873,1.2722720084343702,1.0490636227362198,"['SPN', 'LAMB2', 'SIPA1']",0.5701788869107577,0,0,3
1382,Calcium-Mediated Signaling (GO:0019722),0.44201248893267603,1.3966262975778547,1.1402296500309859,"['FCGR3A', 'BTK']",0.5719412320771514,0,0,2
1383,Dephosphorylation (GO:0016311),0.44201248893267603,1.3966262975778547,1.1402296500309859,"['DAPP1', 'PLPP3']",0.5719412320771514,0,0,2
1384,Membrane Organization (GO:0061024),0.44201248893267603,1.3966262975778547,1.1402296500309859,"['LPCAT2', 'S100A10']",0.5719412320771514,0,0,2
1385,Negative Regulation Of Protein Metabolic Process (GO:0051248),0.44201248893267603,1.3966262975778547,1.1402296500309859,"['INHBB', 'IRAK3']",0.5719412320771514,0,0,2
1386,Plasma Membrane Organization (GO:0007009),0.44201248893267603,1.3966262975778547,1.1402296500309859,"['BIN2', 'CAVIN2']",0.5719412320771514,0,0,2
1387,Positive Regulation Of Cytokine-Mediated Signaling Pathway (GO:0001961),0.44201248893267603,1.3966262975778547,1.1402296500309859,"['AXL', 'LAPTM5']",0.5719412320771514,0,0,2
1388,Positive Regulation Of Leukocyte Chemotaxis (GO:0002690),0.44201248893267603,1.3966262975778547,1.1402296500309859,"['CSF1R', 'AIF1']",0.5719412320771514,0,0,2
1389,Axon Guidance (GO:0007411),0.45944543530760673,1.228018831912457,0.9550733394704499,"['NOTCH2', 'NOTCH3', 'NOTCH1']",0.5921553314615134,0,0,3
1390,Negative Regulation Of Response To External Stimulus (GO:0032102),0.45944543530760673,1.228018831912457,0.9550733394704499,"['CARD8', 'IRAK3', 'AOAH']",0.5921553314615134,0,0,3
1391,Positive Regulation Of Peptidyl-Tyrosine Phosphorylation (GO:0050731),0.45944543530760673,1.228018831912457,0.9550733394704499,"['CSF1R', 'CSPG4', 'FCGR1A']",0.5921553314615134,0,0,3
1392,Regulation Of Phagocytosis (GO:0050764),0.4688699163026702,1.3186274509803921,0.9987678754340147,"['SYK', 'CYBA']",0.5921553314615134,0,0,2
1393,Cholesterol Homeostasis (GO:0042632),0.4688699163026702,1.3186274509803921,0.9987678754340147,"['APOC2', 'LCAT']",0.5921553314615134,0,0,2
1394,Sterol Homeostasis (GO:0055092),0.4688699163026702,1.3186274509803921,0.9987678754340147,"['APOC2', 'LCAT']",0.5921553314615134,0,0,2
1395,Transforming Growth Factor Beta Receptor Signaling Pathway (GO:0007179),0.4688699163026702,1.3186274509803921,0.9987678754340147,"['ITGB5', 'TGFBR2']",0.5921553314615134,0,0,2
1396,Negative Regulation Of Transforming Growth Factor Beta Receptor Signaling Pathway (GO:0030512),0.4688699163026702,1.3186274509803921,0.9987678754340147,"['SLC2A10', 'TGFB1I1']",0.5921553314615134,0,0,2
1397,Protein-Containing Complex Organization (GO:0043933),0.4688699163026702,1.3186274509803921,0.9987678754340147,"['HFE', 'SOX9']",0.5921553314615134,0,0,2
1398,Positive Regulation Of Intracellular Signal Transduction (GO:1902533),0.4737003751137758,1.0619493647407956,0.7934676206899549,"['BST2', 'GJA1', 'FLT1', 'AXL', 'LAPTM5', 'S100A4', 'SOX9', 'PIM2', 'TLR4', 'HCST', 'INAVA']",0.5921553314615134,0,0,11
1399,Regulation Of Chemotaxis (GO:0050920),0.4774169932941378,1.694924123495552,1.2531675240693907,['AIF1'],0.5921553314615134,0,0,1
1400,DNA Integrity Checkpoint Signaling (GO:0031570),0.4774169932941378,1.694924123495552,1.2531675240693907,['DTX3L'],0.5921553314615134,0,0,1
1401,Activation Of Adenylate Cyclase Activity (GO:0007190),0.4774169932941378,1.694924123495552,1.2531675240693907,['ADORA3'],0.5921553314615134,0,0,1
1402,Acylglycerol Homeostasis (GO:0055090),0.4774169932941378,1.694924123495552,1.2531675240693907,['APOC2'],0.5921553314615134,0,0,1
1403,Regulation Of Lymphocyte Proliferation (GO:0050670),0.4774169932941378,1.694924123495552,1.2531675240693907,['LST1'],0.5921553314615134,0,0,1
1404,Aorta Morphogenesis (GO:0035909),0.4774169932941378,1.694924123495552,1.2531675240693907,['TGFBR2'],0.5921553314615134,0,0,1
1405,"Regulation Of Phagocytosis, Engulfment (GO:0060099)",0.4774169932941378,1.694924123495552,1.2531675240693907,['C3'],0.5921553314615134,0,0,1
1406,Carbohydrate Derivative Biosynthetic Process (GO:1901137),0.4774169932941378,1.694924123495552,1.2531675240693907,['ST8SIA6'],0.5921553314615134,0,0,1
1407,Cell Morphogenesis Involved In Differentiation (GO:0000904),0.4774169932941378,1.694924123495552,1.2531675240693907,['SIPA1'],0.5921553314615134,0,0,1
1408,Cell Surface Receptor Signaling Pathway Involved In Cell-Cell Signaling (GO:1905114),0.4774169932941378,1.694924123495552,1.2531675240693907,['FZD2'],0.5921553314615134,0,0,1
1409,Cellular Response To Alcohol (GO:0097306),0.4774169932941378,1.694924123495552,1.2531675240693907,['GRAMD1C'],0.5921553314615134,0,0,1
1410,Regulation Of Toll-Like Receptor 4 Signaling Pathway (GO:0034143),0.4774169932941378,1.694924123495552,1.2531675240693907,['CD14'],0.5921553314615134,0,0,1
1411,Cellular Response To Retinoic Acid (GO:0071300),0.4774169932941378,1.694924123495552,1.2531675240693907,['SOX9'],0.5921553314615134,0,0,1
1412,Regulation Of Vasculogenesis (GO:2001212),0.4774169932941378,1.694924123495552,1.2531675240693907,['TMEM100'],0.5921553314615134,0,0,1
1413,Ceramide Biosynthetic Process (GO:0046513),0.4774169932941378,1.694924123495552,1.2531675240693907,['ST8SIA6'],0.5921553314615134,0,0,1
1414,Respiratory System Development (GO:0060541),0.4774169932941378,1.694924123495552,1.2531675240693907,['CEBPA'],0.5921553314615134,0,0,1
1415,Cortical Cytoskeleton Organization (GO:0030865),0.4774169932941378,1.694924123495552,1.2531675240693907,['EZR'],0.5921553314615134,0,0,1
1416,Cyclic-Nucleotide-Mediated Signaling (GO:0019935),0.4774169932941378,1.694924123495552,1.2531675240693907,['SOX9'],0.5921553314615134,0,0,1
1417,Determination Of Left/Right Symmetry (GO:0007368),0.4774169932941378,1.694924123495552,1.2531675240693907,['NOTCH1'],0.5921553314615134,0,0,1
1418,Signal Transduction By P53 Class Mediator (GO:0072331),0.4774169932941378,1.694924123495552,1.2531675240693907,['TP53BP2'],0.5921553314615134,0,0,1
1419,Epidermal Growth Factor Receptor Signaling Pathway (GO:0007173),0.4774169932941378,1.694924123495552,1.2531675240693907,['SOX9'],0.5921553314615134,0,0,1
1420,Stem Cell Differentiation (GO:0048863),0.4774169932941378,1.694924123495552,1.2531675240693907,['SOX21'],0.5921553314615134,0,0,1
1421,Glycolipid Metabolic Process (GO:0006664),0.4774169932941378,1.694924123495552,1.2531675240693907,['ST8SIA6'],0.5921553314615134,0,0,1
1422,"Wound Healing, Spreading Of Cells (GO:0044319)",0.4774169932941378,1.694924123495552,1.2531675240693907,['ARHGAP24'],0.5921553314615134,0,0,1
1423,Immune Response-Activating Cell Surface Receptor Signaling Pathway (GO:0002429),0.4774169932941378,1.694924123495552,1.2531675240693907,['C3AR1'],0.5921553314615134,0,0,1
1424,Inner Ear Morphogenesis (GO:0042472),0.4774169932941378,1.694924123495552,1.2531675240693907,['SOX9'],0.5921553314615134,0,0,1
1425,Intermediate Filament Organization (GO:0045109),0.4774169932941378,1.694924123495552,1.2531675240693907,['VIM'],0.5921553314615134,0,0,1
1426,Intracellular Steroid Hormone Receptor Signaling Pathway (GO:0030518),0.4774169932941378,1.694924123495552,1.2531675240693907,['EGLN2'],0.5921553314615134,0,0,1
1427,Lung Development (GO:0030324),0.4774169932941378,1.694924123495552,1.2531675240693907,['CEBPA'],0.5921553314615134,0,0,1
1428,Metanephros Development (GO:0001656),0.4774169932941378,1.694924123495552,1.2531675240693907,['FOXD1'],0.5921553314615134,0,0,1
1429,Mitotic Metaphase Plate Congression (GO:0007080),0.4774169932941378,1.694924123495552,1.2531675240693907,['EML3'],0.5921553314615134,0,0,1
1430,Negative Regulation Of Notch Signaling Pathway (GO:0045746),0.4774169932941378,1.694924123495552,1.2531675240693907,['LFNG'],0.5921553314615134,0,0,1
1431,Negative Regulation Of Endothelial Cell Proliferation (GO:0001937),0.4774169932941378,1.694924123495552,1.2531675240693907,['FLT1'],0.5921553314615134,0,0,1
1432,Negative Regulation Of Monoatomic Ion Transport (GO:0043271),0.4774169932941378,1.694924123495552,1.2531675240693907,['CD33'],0.5921553314615134,0,0,1
1433,Negative Regulation Of Peptide Hormone Secretion (GO:0090278),0.4774169932941378,1.694924123495552,1.2531675240693907,['INHBB'],0.5921553314615134,0,0,1
1434,Neuron Projection Extension (GO:1990138),0.4774169932941378,1.694924123495552,1.2531675240693907,['SLC39A12'],0.5921553314615134,0,0,1
1435,Peptide Metabolic Process (GO:0006518),0.4774169932941378,1.694924123495552,1.2531675240693907,['CPM'],0.5921553314615134,0,0,1
1436,Positive Regulation Of Actin Filament Polymerization (GO:0030838),0.4774169932941378,1.694924123495552,1.2531675240693907,['CDC42EP4'],0.5921553314615134,0,0,1
1437,Positive Regulation Of Exocytosis (GO:0045921),0.4774169932941378,1.694924123495552,1.2531675240693907,['S100A10'],0.5921553314615134,0,0,1
1438,Positive Regulation Of Lipid Biosynthetic Process (GO:0046889),0.4774169932941378,1.694924123495552,1.2531675240693907,['APOC2'],0.5921553314615134,0,0,1
1439,Positive Regulation Of Mononuclear Cell Migration (GO:0071677),0.4774169932941378,1.694924123495552,1.2531675240693907,['AIF1'],0.5921553314615134,0,0,1
1440,Positive Regulation Of Myeloid Cell Differentiation (GO:0045639),0.4774169932941378,1.694924123495552,1.2531675240693907,['SCIN'],0.5921553314615134,0,0,1
1441,Positive Regulation Of Phosphoprotein Phosphatase Activity (GO:0032516),0.4774169932941378,1.694924123495552,1.2531675240693907,['CD33'],0.5921553314615134,0,0,1
1442,Positive Regulation Of Receptor Signaling Pathway Via STAT (GO:1904894),0.4774169932941378,1.694924123495552,1.2531675240693907,['NOTCH1'],0.5921553314615134,0,0,1
1443,Protein Import Into Nucleus (GO:0006606),0.4774169932941378,1.694924123495552,1.2531675240693907,['SYK'],0.5921553314615134,0,0,1
1444,Protein Localization To Lysosome (GO:0061462),0.4774169932941378,1.694924123495552,1.2531675240693907,['LAPTM5'],0.5921553314615134,0,0,1
1445,Regulation Of G2/M Transition Of Mitotic Cell Cycle (GO:0010389),0.4774169932941378,1.694924123495552,1.2531675240693907,['STOX1'],0.5921553314615134,0,0,1
1446,Regulation Of Blood Circulation (GO:1903522),0.4774169932941378,1.694924123495552,1.2531675240693907,['ADORA3'],0.5921553314615134,0,0,1
1447,Regulation Of Cell-Cell Adhesion (GO:0022407),0.4774169932941378,1.694924123495552,1.2531675240693907,['PLPP3'],0.5921553314615134,0,0,1
