Rank,Term name,P-value,Z-score,Combined score,Overlapping genes,Adjusted p-value,Old p-value,Old adjusted p-value,gene count
1,Cellular Response To Cytokine Stimulus (GO:0071345),3.392179617513222e-05,3.7007986893303295,38.086595015656194,"['CSF1R', 'CEBPA', 'FOXC1', 'SELPLG', 'DOCK8', 'IRAK3', 'AQP4', 'CSF2RB', 'AIF1', 'LILRB4', 'ZFP36L2', 'ZFP36L1', 'AXL', 'MNDA', 'SOX9', 'TLR4', 'IL13RA1']",0.06092354593053747,0,0,17
2,Regulation Of Tumor Necrosis Factor Production (GO:0032680),0.00025097870022857603,4.337667116398872,35.95987843478139,"['SPN', 'FCGR3A', 'TYROBP', 'SYK', 'CYBA', 'IRAK3', 'CD14', 'TLR4', 'LILRB4', 'VSIR', 'CD33']",0.14284137854810983,0,0,11
3,Regulation Of Interleukin-10 Production (GO:0032653),0.0003705807170098506,9.061567164179104,71.59036113759493,"['TYROBP', 'SYK', 'LILRB4', 'TLR4', 'INAVA', 'VSIR']",0.14284137854810983,0,0,6
4,Regulation Of Biomineral Tissue Development (GO:0070167),0.0004754456719570415,24.02962962962963,183.85689442845288,"['CEBPB', 'NOTCH1', 'S1PR1', 'SOX9']",0.14284137854810983,0,0,4
5,Phagocytosis (GO:0006909),0.0005503486854051274,5.393483709273183,40.47787144708563,"['TYROBP', 'BIN2', 'ANXA3', 'AXL', 'ITGB2', 'CD14', 'TLR4', 'AIF1']",0.14284137854810983,0,0,8
6,Macrophage Activation (GO:0042116),0.0005776757614972077,8.052238805970148,60.041501046149236,"['C1QA', 'FCGR3A', 'SYK', 'ITGB2', 'AIF1', 'TLR4']",0.14284137854810983,0,0,6
7,Positive Regulation Of Reactive Oxygen Species Metabolic Process (GO:2000379),0.0005776757614972077,8.052238805970148,60.041501046149236,"['TYROBP', 'SYK', 'ITGB2', 'CYBA', 'TLR4', 'TGFBR2']",0.14284137854810983,0,0,6
8,Negative Regulation Of Tumor Necrosis Factor Production (GO:0032720),0.0008610410834437194,10.037174721189592,70.83603908744794,"['IRAK3', 'LILRB4', 'TLR4', 'VSIR', 'CD33']",0.14284137854810983,0,0,5
9,Negative Regulation Of Tumor Necrosis Factor Superfamily Cytokine Production (GO:1903556),0.0008610410834437194,10.037174721189592,70.83603908744794,"['IRAK3', 'TLR4', 'LILRB4', 'VSIR', 'CD33']",0.14284137854810983,0,0,5
10,Regulation Of Bone Resorption (GO:0045124),0.0008610410834437194,10.037174721189592,70.83603908744794,"['CSF1R', 'SYK', 'INPP5D', 'S1PR1', 'TMEM119']",0.14284137854810983,0,0,5
11,Inflammatory Response (GO:0006954),0.0008748636770763964,3.183754789272031,22.418226223449558,"['CSF1R', 'CEBPB', 'ITGB2', 'CYBB', 'CYBA', 'AIF1', 'ADORA3', 'C3AR1', 'BLNK', 'TLR10', 'CD14', 'TLR5', 'TLR4']",0.14284137854810983,0,0,13
12,Negative Regulation Of Lymphocyte Proliferation (GO:0050672),0.0017541342656534203,6.0335820895522385,38.28778358504804,"['SPN', 'CEBPB', 'TYROBP', 'LST1', 'MNDA', 'LILRB4']",0.2106871887734758,0,0,6
13,Negative Regulation Of Cytokine Production Involved In Immune Response (GO:0002719),0.0017596368772840407,35.92250922509225,227.84382450014326,"['HFE', 'IRAK3', 'LILRB4']",0.2106871887734758,0,0,3
14,Positive Regulation Of Lymphocyte Migration (GO:2000403),0.0017596368772840407,35.92250922509225,227.84382450014326,"['SPN', 'DOCK8', 'AIF1']",0.2106871887734758,0,0,3
15,Regulation Of T Cell Migration (GO:2000404),0.0017596368772840407,35.92250922509225,227.84382450014326,"['SPN', 'DOCK8', 'AIF1']",0.2106871887734758,0,0,3
16,Regulation Of mRNA Catabolic Process (GO:0061013),0.0019561434965913943,12.007407407407408,74.88756254648486,"['ZC3HAV1', 'VIM', 'ZFP36L2', 'ZFP36L1']",0.21265814891296758,0,0,4
17,Positive Regulation Of Leukocyte Mediated Cytotoxicity (GO:0001912),0.0021057677456947717,7.523234200743494,46.36625777692551,"['TYROBP', 'KLRK1', 'KLRC3', 'HFE', 'HLA-DRA']",0.21265814891296758,0,0,5
18,Positive Regulation Of Transmembrane Receptor Protein Serine/Threonine Kinase Signaling Pathway (GO:0090100),0.002269657991437791,4.701622971285893,28.62407363388537,"['FOXD1', 'NOTCH1', 'SLC2A10', 'HFE', 'TGFB1I1', 'INHBB', 'TGFBR2']",0.21265814891296758,0,0,7
19,Toll-Like Receptor Signaling Pathway (GO:0002224),0.0030697644241395963,6.685254027261462,38.68191237354976,"['BTK', 'IRAK3', 'TLR10', 'TLR5', 'TLR4']",0.21265814891296758,0,0,5
20,Regulation Of Receptor-Mediated Endocytosis (GO:0048259),0.0033069678777032582,9.602962962962962,54.84946978652386,"['C3', 'HFE', 'APOC2', 'APOC1']",0.21265814891296758,0,0,4
21,Cellular Response To Epidermal Growth Factor Stimulus (GO:0071364),0.0033069678777032582,9.602962962962962,54.84946978652386,"['FOXC1', 'SOX9', 'ZFP36L2', 'ZFP36L1']",0.21265814891296758,0,0,4
22,Microglial Cell Activation (GO:0001774),0.0033069678777032582,9.602962962962962,54.84946978652386,"['C1QA', 'TYROBP', 'ITGB2', 'AIF1']",0.21265814891296758,0,0,4
23,Regulation Of B Cell Differentiation (GO:0045577),0.0033069678777032582,9.602962962962962,54.84946978652386,"['SYK', 'INPP5D', 'ZFP36L2', 'ZFP36L1']",0.21265814891296758,0,0,4
24,Positive Regulation Of GTPase Activity (GO:0043547),0.0034958746129462068,3.411084905660377,19.29368186771697,"['SYDE1', 'ARHGAP42', 'DOCK8', 'RGS10', 'ITGA6', 'SIPA1', 'ARHGAP24', 'S100A10', 'ARHGAP45']",0.21265814891296758,0,0,9
25,Cardiac Atrium Morphogenesis (GO:0003209),0.004145866811899457,17.95571955719557,98.4986743010151,"['NOTCH2', 'MESP1', 'NOTCH1']",0.21265814891296758,0,0,3
26,Regulation Of Superoxide Anion Generation (GO:0032928),0.004145866811899457,17.95571955719557,98.4986743010151,"['TYROBP', 'SYK', 'ITGB2']",0.21265814891296758,0,0,3
27,Regulation Of Trophoblast Cell Migration (GO:1901163),0.004145866811899457,17.95571955719557,98.4986743010151,"['SYDE1', 'GJA1', 'ARHGDIB']",0.21265814891296758,0,0,3
28,Negative Regulation Of Interleukin-10 Production (GO:0032693),0.004145866811899457,17.95571955719557,98.4986743010151,"['TYROBP', 'LILRB4', 'VSIR']",0.21265814891296758,0,0,3
29,Negative Regulation Of Leukocyte Activation (GO:0002695),0.004145866811899457,17.95571955719557,98.4986743010151,"['MILR1', 'LILRB4', 'CD33']",0.21265814891296758,0,0,3
30,Negative Regulation Of Myoblast Differentiation (GO:0045662),0.004145866811899457,17.95571955719557,98.4986743010151,"['NOTCH1', 'SOX9', 'TBX3']",0.21265814891296758,0,0,3
31,Positive Regulation Of T Cell Migration (GO:2000406),0.004145866811899457,17.95571955719557,98.4986743010151,"['SPN', 'DOCK8', 'AIF1']",0.21265814891296758,0,0,3
32,Positive Regulation Of mRNA Catabolic Process (GO:0061014),0.004145866811899457,17.95571955719557,98.4986743010151,"['ZC3HAV1', 'ZFP36L2', 'ZFP36L1']",0.21265814891296758,0,0,3
33,Positive Regulation Of Natural Killer Cell Activation (GO:0032816),0.004145866811899457,17.95571955719557,98.4986743010151,"['FCGR3A', 'TYROBP', 'AXL']",0.21265814891296758,0,0,3
34,Positive Regulation Of Superoxide Anion Generation (GO:0032930),0.004145866811899457,17.95571955719557,98.4986743010151,"['TYROBP', 'SYK', 'ITGB2']",0.21265814891296758,0,0,3
35,Regulation Of Actin Cytoskeleton Organization (GO:0032956),0.004201550967641301,4.822388059701493,26.389561624145024,"['EPS8', 'NOTCH2', 'BST2', 'CSF1R', 'ARHGDIB', 'EZR']",0.21265814891296758,0,0,6
36,Negative Regulation Of Cytokine Production (GO:0001818),0.004348911554339988,2.846776150796861,15.480283852476093,"['TYROBP', 'SLC2A10', 'AXL', 'LAPTM5', 'INHBB', 'IRAK3', 'EZR', 'TLR4', 'LILRB4', 'VSIR', 'CD33']",0.21265814891296758,0,0,11
37,Positive Regulation Of Multicellular Organismal Process (GO:0051240),0.004816754332096247,2.352242352242352,12.550753556980105,"['MESP1', 'FOXC1', 'CEBPB', 'FOXD1', 'SYK', 'TGFB1I1', 'UCP1', 'INHBB', 'TGFBR2', 'SYDE1', 'GJA1', 'APOC2', 'UCP2', 'TMEM119', 'SOX9']",0.21265814891296758,0,0,15
38,Notch Signaling Pathway (GO:0007219),0.005177388325545552,8.0,42.10763627289585,"['NOTCH2', 'NOTCH3', 'NOTCH1', 'ASCL1']",0.21265814891296758,0,0,4
39,Regulation Of Myoblast Differentiation (GO:0045661),0.005177388325545552,8.0,42.10763627289585,"['NOTCH1', 'SOX9', 'TBX3', 'ZFP36L1']",0.21265814891296758,0,0,4
40,Response To Epidermal Growth Factor (GO:0070849),0.005177388325545552,8.0,42.10763627289585,"['FOXC1', 'SOX9', 'ZFP36L2', 'ZFP36L1']",0.21265814891296758,0,0,4
41,Positive Regulation Of Lymphocyte Differentiation (GO:0045621),0.005177388325545552,8.0,42.10763627289585,"['SYK', 'AXL', 'INPP5D', 'BTK']",0.21265814891296758,0,0,4
42,Positive Regulation Of Macromolecule Metabolic Process (GO:0010604),0.005339248201675211,2.32173403059479,12.148868989933222,"['FOXD1', 'NOTCH1', 'DTX3L', 'SLC2A10', 'HFE', 'LAPTM5', 'VSIR', 'GJA1', 'C1QTNF1', 'TYROBP', 'TMEM119', 'SOX9', 'EZR', 'TLR4', 'STOX1']",0.21265814891296758,0,0,15
43,Regulation Of Interleukin-1 Beta Production (GO:0032651),0.005628218751730091,3.842015662240381,19.901496178910275,"['TYROBP', 'CARD8', 'MNDA', 'TLR4', 'LILRB4', 'CD33', 'INAVA']",0.21265814891296758,0,0,7
44,Cellular Defense Response (GO:0006968),0.005884566657794511,5.4663737749239605,28.072137106160064,"['SPN', 'TYROBP', 'KLRC3', 'MNDA', 'TCIRG1']",0.21265814891296758,0,0,5
45,Response To Chemokine (GO:1990868),0.006038733627261328,inf,inf,"['FOXC1', 'DOCK8']",0.21265814891296758,0,0,2
46,Response To Peptidoglycan (GO:0032494),0.006038733627261328,inf,inf,"['IRAK3', 'INAVA']",0.21265814891296758,0,0,2
47,Sphingosine-1-Phosphate Receptor Signaling Pathway (GO:0003376),0.006038733627261328,inf,inf,"['S1PR1', 'EZR']",0.21265814891296758,0,0,2
48,Negative Regulation Of T Cell Cytokine Production (GO:0002725),0.006038733627261328,inf,inf,"['HFE', 'LILRB4']",0.21265814891296758,0,0,2
49,Negative Regulation Of Cholesterol Transport (GO:0032375),0.006038733627261328,inf,inf,"['APOC2', 'APOC1']",0.21265814891296758,0,0,2
50,Positive Regulation Of Kidney Development (GO:0090184),0.006038733627261328,inf,inf,"['FOXD1', 'SOX9']",0.21265814891296758,0,0,2
51,rRNA Transcription (GO:0009303),0.006038733627261328,inf,inf,"['CAVIN1', 'ZFP36L1']",0.21265814891296758,0,0,2
52,Regulation Of Interleukin-6 Production (GO:0032675),0.00641004773072697,3.3362717137671765,16.847800366363117,"['TYROBP', 'SYK', 'CYBA', 'IRAK3', 'TLR4', 'AIF1', 'LILRB4', 'INAVA']",0.22139318700741611,0,0,8
53,Regulation Of Ras Protein Signal Transduction (GO:0046578),0.006847914225682976,4.252414398595259,21.193230360801774,"['EPS8', 'NOTCH2', 'SYDE1', 'NOTCH1', 'ARHGDIB', 'RASAL3']",0.22282669735550698,0,0,6
54,Circulatory System Development (GO:0072359),0.006864272607458491,3.6738316235140855,18.300917437447712,"['GJA1', 'FOXC1', 'NOTCH1', 'SLC2A10', 'SOX9', 'PDLIM5', 'TGFBR2']",0.22282669735550698,0,0,7
55,Development Of Primary Male Sexual Characteristics (GO:0046546),0.007643880794623643,6.855026455026455,33.41036964147212,"['TFAP2C', 'NR0B1', 'SOX9', 'LHFPL2']",0.22282669735550698,0,0,4
56,Negative Regulation Of Metabolic Process (GO:0009892),0.007643880794623643,6.855026455026455,33.41036964147212,"['NOTCH1', 'APOC2', 'APOC1', 'TLR4']",0.22282669735550698,0,0,4
57,Negative Regulation Of Type II Interferon Production (GO:0032689),0.007643880794623643,6.855026455026455,33.41036964147212,"['LAPTM5', 'LILRB4', 'TLR4', 'VSIR']",0.22282669735550698,0,0,4
58,Activation Of GTPase Activity (GO:0090630),0.007815663765449668,5.0092936802973975,24.303216374826018,"['SYDE1', 'ARHGAP42', 'ARHGAP24', 'SIPA1', 'ARHGAP45']",0.22282669735550698,0,0,5
59,Regulation Of Cytokine Production Involved In Immune Response (GO:0002718),0.007816303971824576,11.966789667896679,58.05740031834383,"['LAPTM5', 'BTK', 'INAVA']",0.22282669735550698,0,0,3
60,Establishment Of Epithelial Cell Polarity (GO:0090162),0.007816303971824576,11.966789667896679,58.05740031834383,"['FERMT1', 'EZR', 'SIPA1']",0.22282669735550698,0,0,3
61,Superoxide Anion Generation (GO:0042554),0.007816303971824576,11.966789667896679,58.05740031834383,"['NCF4', 'CYBB', 'CYBA']",0.22282669735550698,0,0,3
62,Positive Regulation Of Alpha-Beta T Cell Differentiation (GO:0046638),0.007816303971824576,11.966789667896679,58.05740031834383,"['LILRB4', 'RUNX3', 'TGFBR2']",0.22282669735550698,0,0,3
63,Positive Regulation Of Alpha-Beta T Cell Proliferation (GO:0046641),0.007816303971824576,11.966789667896679,58.05740031834383,"['SYK', 'RASAL3', 'TGFBR2']",0.22282669735550698,0,0,3
64,Hemopoiesis (GO:0030097),0.008291136712797624,3.519662921348315,16.868224593975686,"['NOTCH2', 'CSF1R', 'CEBPA', 'CEBPB', 'RUNX3', 'ZFP36L2', 'TGFBR2']",0.22909048517206976,0,0,7
65,Positive Regulation Of Tumor Necrosis Factor Production (GO:0032760),0.008291136712797624,3.519662921348315,16.868224593975686,"['SPN', 'FCGR3A', 'TYROBP', 'SYK', 'CYBA', 'CD14', 'TLR4']",0.22909048517206976,0,0,7
66,Positive Regulation Of Cell Differentiation (GO:0045597),0.009351995725976227,2.5197646890020806,11.772757677881454,"['TMEM100', 'FOXC1', 'GJA1', 'CEBPB', 'LAMB2', 'TGFB1I1', 'TMEM119', 'SOX9', 'ASCL1', 'TGFBR2', 'ZFP36L1']",0.2544876412705046,0,0,11
67,Positive Regulation Of Tumor Necrosis Factor Superfamily Cytokine Production (GO:1903557),0.009925050597452438,3.377827715355805,15.580883455070992,"['SPN', 'FCGR3A', 'TYROBP', 'SYK', 'CYBA', 'CD14', 'TLR4']",0.26149659556797017,0,0,7
68,Regulation Of Mitotic Cell Cycle (GO:0007346),0.010147027239349689,4.622533600228768,21.220084866977377,"['FOXC1', 'ANAPC15', 'CCDC8', 'PIM2', 'SOX9']",0.26149659556797017,0,0,5
69,Heart Development (GO:0007507),0.010415687585319588,3.0206766917293235,13.787704127115271,"['MESP1', 'GJA1', 'FOXC1', 'NOTCH1', 'SOX9', 'PDLIM5', 'TBX3', 'TGFBR2']",0.26149659556797017,0,0,8
70,Negative Regulation Of Cell Cycle (GO:0045786),0.010530304616709459,3.8024351924587587,17.314381138261442,"['CEBPA', 'FOXC1', 'LATS2', 'TP53BP2', 'RUNX3', 'SIPA1']",0.26149659556797017,0,0,6
71,Protein Phosphorylation (GO:0006468),0.010666904217229174,2.18698224852071,9.93023214374802,"['CSF1R', 'FLT1', 'SYK', 'IRAK3', 'CSF2RB', 'RUNX3', 'TGFBR2', 'LATS2', 'BTK', 'PIM2', 'STK32A', 'STK32B', 'TLR4', 'HCST']",0.26149659556797017,0,0,14
72,B Cell Receptor Signaling Pathway (GO:0050853),0.01077435861471592,5.996296296296296,27.166737071704414,"['SYK', 'BLNK', 'BTK', 'MNDA']",0.26149659556797017,0,0,4
73,Response To Transforming Growth Factor Beta (GO:0071559),0.01077435861471592,5.996296296296296,27.166737071704414,"['SOX9', 'RUNX3', 'ZFP36L2', 'ZFP36L1']",0.26149659556797017,0,0,4
74,Positive Regulation Of Epithelial To Mesenchymal Transition (GO:0010718),0.01077435861471592,5.996296296296296,27.166737071704414,"['FOXC1', 'NOTCH1', 'TGFB1I1', 'TGFBR2']",0.26149659556797017,0,0,4
75,Cellular Response To Growth Factor Stimulus (GO:0071363),0.012093221053374308,2.9282296650717705,12.928456740962337,"['TMEM100', 'FOXC1', 'NOTCH1', 'FLT1', 'SOX9', 'ZFP36L2', 'ZFP36L1', 'TGFBR2']",0.2834260534857556,0,0,8
76,Actin Filament Bundle Organization (GO:0061572),0.012897372634999326,8.972324723247233,39.036177237805695,"['EPS8', 'EZR', 'AIF1']",0.2834260534857556,0,0,3
77,Filopodium Assembly (GO:0046847),0.012897372634999326,8.972324723247233,39.036177237805695,"['FGD3', 'FGD4', 'EZR']",0.2834260534857556,0,0,3
78,Leukocyte Cell-Cell Adhesion (GO:0007159),0.012897372634999326,8.972324723247233,39.036177237805695,"['SYK', 'ITGB2', 'EZR']",0.2834260534857556,0,0,3
79,Positive Regulation Of Regulatory T Cell Differentiation (GO:0045591),0.012897372634999326,8.972324723247233,39.036177237805695,"['HLA-DRA', 'LILRB4', 'VSIR']",0.2834260534857556,0,0,3
80,Positive Regulation Of Reproductive Process (GO:2000243),0.012897372634999326,8.972324723247233,39.036177237805695,"['SYDE1', 'INHBB', 'LHFPL2']",0.2834260534857556,0,0,3
81,Myeloid Leukocyte Differentiation (GO:0002573),0.012914251716034154,4.291024960169942,18.66348605919604,"['CEBPA', 'CSF1R', 'TYROBP', 'UCP2', 'TGFBR2']",0.2834260534857556,0,0,5
82,Regulation Of Gene Expression (GO:0010468),0.014592416704594467,1.7101740294511378,7.229338790759061,"['NOTCH2', 'CEBPA', 'FOXC1', 'CEBPB', 'NOTCH1', 'HFE', 'ASCL1', 'AIF1', 'SOX21', 'VSIR', 'ZFP36L1', 'GJA1', 'C1QTNF1', 'SOX9', 'STOX1', 'ZNF462', 'TFAP2C', 'FOXD1', 'SLC2A10', 'RUNX3', 'TYROBP', 'BCL6B', 'TMEM119', 'EZR', 'TLR4']",0.2834260534857556,0,0,25
83,Cardiac Muscle Tissue Development (GO:0048738),0.014627075374517596,5.328395061728395,22.511835003410226,"['NOTCH2', 'MESP1', 'GJA1', 'NOTCH1']",0.2834260534857556,0,0,4
84,Epithelial To Mesenchymal Transition (GO:0001837),0.014627075374517596,5.328395061728395,22.511835003410226,"['NOTCH1', 'S100A4', 'SOX9', 'TBX3']",0.2834260534857556,0,0,4
85,Mesenchymal Cell Differentiation (GO:0048762),0.014627075374517596,5.328395061728395,22.511835003410226,"['FOXC1', 'NOTCH1', 'S100A4', 'SOX9']",0.2834260534857556,0,0,4
86,Phosphatidylinositol-Mediated Signaling (GO:0048015),0.014627075374517596,5.328395061728395,22.511835003410226,"['CSF1R', 'FCGR3A', 'EZR', 'ZFP36L1']",0.2834260534857556,0,0,4
87,Positive Regulation Of Interleukin-6 Production (GO:0032755),0.01543414965352852,3.4381663113006398,14.341185506090577,"['TYROBP', 'SYK', 'CYBA', 'TLR4', 'AIF1', 'INAVA']",0.2834260534857556,0,0,6
88,3'-UTR-mediated mRNA Destabilization (GO:0061158),0.017182478872069636,23.860294117647058,96.9650161727154,"['ZFP36L2', 'ZFP36L1']",0.2834260534857556,0,0,2
89,MyD88-dependent Toll-Like Receptor Signaling Pathway (GO:0002755),0.017182478872069636,23.860294117647058,96.9650161727154,"['IRAK3', 'TLR4']",0.2834260534857556,0,0,2
90,Rac Protein Signal Transduction (GO:0016601),0.017182478872069636,23.860294117647058,96.9650161727154,"['EPS8', 'AIF1']",0.2834260534857556,0,0,2
91,Ammonium Transmembrane Transport (GO:0072488),0.017182478872069636,23.860294117647058,96.9650161727154,"['SLC12A4', 'SLC12A7']",0.2834260534857556,0,0,2
92,Atrioventricular Valve Development (GO:0003171),0.017182478872069636,23.860294117647058,96.9650161727154,"['NOTCH1', 'TGFBR2']",0.2834260534857556,0,0,2
93,Humoral Immune Response Mediated By Circulating Immunoglobulin (GO:0002455),0.017182478872069636,23.860294117647058,96.9650161727154,"['C1QB', 'C1QC']",0.2834260534857556,0,0,2
94,mRNA Destabilization (GO:0061157),0.017182478872069636,23.860294117647058,96.9650161727154,"['ZFP36L2', 'ZFP36L1']",0.2834260534857556,0,0,2
95,Mesoderm Morphogenesis (GO:0048332),0.017182478872069636,23.860294117647058,96.9650161727154,"['MESP1', 'TBX3']",0.2834260534857556,0,0,2
96,ncRNA Transcription (GO:0098781),0.017182478872069636,23.860294117647058,96.9650161727154,"['CAVIN1', 'ZFP36L1']",0.2834260534857556,0,0,2
97,"Negative Regulation Of CD8-positive, Alpha-Beta T Cell Activation (GO:2001186)",0.017182478872069636,23.860294117647058,96.9650161727154,"['HFE', 'VSIR']",0.2834260534857556,0,0,2
98,Negative Regulation Of Lipid Biosynthetic Process (GO:0051055),0.017182478872069636,23.860294117647058,96.9650161727154,"['APOC1', 'NR0B1']",0.2834260534857556,0,0,2
99,Negative Regulation Of miRNA Metabolic Process (GO:2000629),0.017182478872069636,23.860294117647058,96.9650161727154,"['SOX9', 'LILRB4']",0.2834260534857556,0,0,2
100,Negative Regulation Of miRNA Transcription (GO:1902894),0.017182478872069636,23.860294117647058,96.9650161727154,"['SOX9', 'LILRB4']",0.2834260534857556,0,0,2
101,Negative Regulation Of Trophoblast Cell Migration (GO:1901164),0.017182478872069636,23.860294117647058,96.9650161727154,"['GJA1', 'ARHGDIB']",0.2834260534857556,0,0,2
102,Positive Regulation Of Muscle Cell Differentiation (GO:0051149),0.017182478872069636,23.860294117647058,96.9650161727154,"['MESP1', 'LAMB2']",0.2834260534857556,0,0,2
103,"Positive Regulation Of Nuclear-Transcribed mRNA Catabolic Process, Deadenylation-Dependent Decay (GO:1900153)",0.017182478872069636,23.860294117647058,96.9650161727154,"['ZFP36L2', 'ZFP36L1']",0.2834260534857556,0,0,2
104,Positive Regulation Of Receptor Catabolic Process (GO:2000646),0.017182478872069636,23.860294117647058,96.9650161727154,"['DTX3L', 'LAPTM5']",0.2834260534857556,0,0,2
105,Protein N-linked Glycosylation Via Asparagine (GO:0018279),0.017182478872069636,23.860294117647058,96.9650161727154,"['OST4', 'MGAT2']",0.2834260534857556,0,0,2
106,"Regulation Of CD4-positive, Alpha-Beta T Cell Proliferation (GO:2000561)",0.017182478872069636,23.860294117647058,96.9650161727154,"['VSIR', 'TGFBR2']",0.2834260534857556,0,0,2
107,Regulation Of T Cell Cytokine Production (GO:0002724),0.017182478872069636,23.860294117647058,96.9650161727154,"['HFE', 'LILRB4']",0.2834260534857556,0,0,2
108,Regulation Of Immune Response (GO:0050776),0.018398000774070295,3.2808683853459972,13.108753183416434,"['SPN', 'FCGR3A', 'SYK', 'INPP5D', 'HLA-DRA', 'FCGR1A']",0.2834260534857556,0,0,6
109,Regulation Of Cold-Induced Thermogenesis (GO:0120161),0.018847167362395154,2.9083042748288777,11.550018217913351,"['GJA1', 'CEBPB', 'NOTCH1', 'SYK', 'UCP2', 'UCP1', 'TLR4']",0.2834260534857556,0,0,7
110,Regulation Of Interleukin-12 Production (GO:0032655),0.01925000990477926,4.794074074074074,18.93776092625198,"['SYK', 'LAPTM5', 'IRAK3', 'TLR4']",0.2834260534857556,0,0,4
111,Actin Filament Bundle Assembly (GO:0051017),0.019462127894139713,7.175645756457564,28.266912697202958,"['EPS8', 'EZR', 'AIF1']",0.2834260534857556,0,0,3
112,Cellular Response To Lectin (GO:1990858),0.019462127894139713,7.175645756457564,28.266912697202958,"['TYROBP', 'SYK', 'KLRC3']",0.2834260534857556,0,0,3
113,Endocardial Cushion Morphogenesis (GO:0003203),0.019462127894139713,7.175645756457564,28.266912697202958,"['NOTCH1', 'SOX9', 'TGFBR2']",0.2834260534857556,0,0,3
114,Endodermal Cell Differentiation (GO:0035987),0.019462127894139713,7.175645756457564,28.266912697202958,"['ITGB5', 'MMP2', 'ITGB2']",0.2834260534857556,0,0,3
115,Stimulatory C-type Lectin Receptor Signaling Pathway (GO:0002223),0.019462127894139713,7.175645756457564,28.266912697202958,"['TYROBP', 'SYK', 'KLRC3']",0.2834260534857556,0,0,3
116,Superoxide Metabolic Process (GO:0006801),0.019462127894139713,7.175645756457564,28.266912697202958,"['NCF4', 'CYBB', 'CYBA']",0.2834260534857556,0,0,3
117,Synapse Pruning (GO:0098883),0.019462127894139713,7.175645756457564,28.266912697202958,"['C1QB', 'C3', 'C1QC']",0.2834260534857556,0,0,3
118,Negative Regulation Of B Cell Activation (GO:0050869),0.019462127894139713,7.175645756457564,28.266912697202958,"['TYROBP', 'LAPTM5', 'MNDA']",0.2834260534857556,0,0,3
119,Positive Regulation Of Cell Death (GO:0010942),0.019462127894139713,7.175645756457564,28.266912697202958,"['C1QA', 'TYROBP', 'ITGB2']",0.2834260534857556,0,0,3
120,Positive Regulation Of Epithelial Cell Differentiation (GO:0030858),0.019462127894139713,7.175645756457564,28.266912697202958,"['TMEM100', 'MESP1', 'SOX9']",0.2834260534857556,0,0,3
121,Positive Regulation Of Interleukin-10 Production (GO:0032733),0.019462127894139713,7.175645756457564,28.266912697202958,"['SYK', 'TLR4', 'INAVA']",0.2834260534857556,0,0,3
122,Regulation Of Actin Cytoskeleton Reorganization (GO:2000249),0.019462127894139713,7.175645756457564,28.266912697202958,"['NOTCH2', 'CSF1R', 'ARHGDIB']",0.2834260534857556,0,0,3
123,Gland Development (GO:0048732),0.019884010433855903,3.7523234200743496,14.701000409182008,"['CEBPA', 'NR0B1', 'SOX9', 'EZR', 'TBX3']",0.2834260534857556,0,0,5
124,Negative Regulation Of T Cell Activation (GO:0050868),0.019884010433855903,3.7523234200743496,14.701000409182008,"['SPN', 'CEBPB', 'LAPTM5', 'LILRB4', 'VSIR']",0.2834260534857556,0,0,5
125,Positive Regulation Of Interleukin-1 Beta Production (GO:0032731),0.019884010433855903,3.7523234200743496,14.701000409182008,"['TYROBP', 'CARD8', 'MNDA', 'TLR4', 'INAVA']",0.2834260534857556,0,0,5
126,Positive Regulation Of Interleukin-1 Production (GO:0032732),0.019884010433855903,3.7523234200743496,14.701000409182008,"['TYROBP', 'CARD8', 'MNDA', 'TLR4', 'INAVA']",0.2834260534857556,0,0,5
127,Antigen Receptor-Mediated Signaling Pathway (GO:0050851),0.021729253641821912,3.13724853990915,12.012825308759098,"['FYB1', 'SYK', 'INPP5D', 'BTK', 'BLNK', 'MNDA']",0.3061444485673061,0,0,6
128,Negative Regulation Of Cellular Process (GO:0048523),0.021818758027068588,1.920951026214184,7.347609282101809,"['CDA', 'CEBPA', 'NOTCH1', 'TGFB1I1', 'RUNX3', 'SPN', 'BST2', 'GJA1', 'SCIN', 'ADORA3', 'TP53BP2', 'PIM2', 'S100A11', 'SIPA1', 'CD33']",0.3061444485673061,0,0,15
129,Regulation Of Type II Interferon Production (GO:0032649),0.024141903054099377,3.5305051388585174,13.146917039476271,"['LAPTM5', 'CD14', 'TLR4', 'LILRB4', 'VSIR']",0.31483460699610477,0,0,5
130,Pattern Recognition Receptor Signaling Pathway (GO:0002221),0.024141903054099377,3.5305051388585174,13.146917039476271,"['TLR10', 'CD14', 'TLR5', 'TLR4', 'INAVA']",0.31483460699610477,0,0,5
131,Regulation Of GTPase Activity (GO:0043087),0.02494732500034475,2.7189803068744713,10.035725525516982,"['FGD3', 'FGD4', 'KLRK1', 'DOCK8', 'RGS10', 'ITGA6', 'S100A10']",0.31483460699610477,0,0,7
132,Positive Regulation Of Cytokine Production (GO:0001819),0.025384704122636603,2.0481668637780883,7.524163172029242,"['C3', 'CSF1R', 'CEBPB', 'TYROBP', 'SYK', 'LAPTM5', 'CYBA', 'CD14', 'TLR5', 'AIF1', 'TLR4', 'INAVA']",0.31483460699610477,0,0,12
133,Aortic Valve Morphogenesis (GO:0003180),0.027539725741318258,5.977859778597786,21.473224006450923,"['NOTCH1', 'SOX9', 'TGFBR2']",0.31483460699610477,0,0,3
134,Cellular Response To Low-Density Lipoprotein Particle Stimulus (GO:0071404),0.027539725741318258,5.977859778597786,21.473224006450923,"['SYK', 'ITGB2', 'TLR4']",0.31483460699610477,0,0,3
135,Negative Regulation Of T Cell Receptor Signaling Pathway (GO:0050860),0.027539725741318258,5.977859778597786,21.473224006450923,"['LAPTM5', 'EZR', 'LILRB4']",0.31483460699610477,0,0,3
136,Negative Regulation Of Interleukin-1 Beta Production (GO:0032691),0.027539725741318258,5.977859778597786,21.473224006450923,"['CARD8', 'LILRB4', 'CD33']",0.31483460699610477,0,0,3
137,"Phagocytosis, Engulfment (GO:0006911)",0.027539725741318258,5.977859778597786,21.473224006450923,"['BIN2', 'ITGB2', 'AIF1']",0.31483460699610477,0,0,3
138,Positive Regulation Of Neuron Death (GO:1901216),0.027539725741318258,5.977859778597786,21.473224006450923,"['C1QA', 'TYROBP', 'ITGB2']",0.31483460699610477,0,0,3
139,Positive Regulation Of Cell Migration (GO:0030335),0.0287706717772868,2.07949144486692,7.378864847278457,"['FERMT1', 'SYDE1', 'CSF1R', 'NOTCH1', 'FLT1', 'ITGA6', 'SOX9', 'AIF1', 'S100A11', 'VSIR', 'CXCL16']",0.31483460699610477,0,0,11
