Rank,Term name,P-value,Z-score,Combined score,Overlapping genes,Adjusted p-value,Old p-value,Old adjusted p-value,gene count
949,Regulation Of Nuclear Division (GO:0051783),0.2769619644400748,3.95970695970696,5.083769147932374,['CCDC8'],0.4810673966483311,0,0,1
950,Regulation Of Oxidative Phosphorylation (GO:0002082),0.2769619644400748,3.95970695970696,5.083769147932374,['COX7A1'],0.4810673966483311,0,0,1
951,Branching Involved In Ureteric Bud Morphogenesis (GO:0001658),0.2769619644400748,3.95970695970696,5.083769147932374,['FOXD1'],0.4810673966483311,0,0,1
952,cAMP-mediated Signaling (GO:0019933),0.2769619644400748,3.95970695970696,5.083769147932374,['SOX9'],0.4810673966483311,0,0,1
953,Regulation Of Sensory Perception (GO:0051931),0.2769619644400748,3.95970695970696,5.083769147932374,['TMEM100'],0.4810673966483311,0,0,1
954,Cellular Response To ATP (GO:0071318),0.2769619644400748,3.95970695970696,5.083769147932374,['P2RY1'],0.4810673966483311,0,0,1
955,Cellular Response To Bacterial Lipopeptide (GO:0071221),0.2769619644400748,3.95970695970696,5.083769147932374,['TLR10'],0.4810673966483311,0,0,1
956,Regulation Of Spindle Assembly (GO:0090169),0.2769619644400748,3.95970695970696,5.083769147932374,['EML3'],0.4810673966483311,0,0,1
957,Regulation Of Steroid Biosynthetic Process (GO:0050810),0.2769619644400748,3.95970695970696,5.083769147932374,['NR0B1'],0.4810673966483311,0,0,1
958,Cellular Response To Oxidised Low-Density Lipoprotein Particle Stimulus (GO:0140052),0.2769619644400748,3.95970695970696,5.083769147932374,['TLR4'],0.4810673966483311,0,0,1
959,Cellular Response To Purine-Containing Compound (GO:0071415),0.2769619644400748,3.95970695970696,5.083769147932374,['P2RY1'],0.4810673966483311,0,0,1
960,Cellular Response To Sterol (GO:0036315),0.2769619644400748,3.95970695970696,5.083769147932374,['GRAMD1C'],0.4810673966483311,0,0,1
961,Renal Water Homeostasis (GO:0003091),0.2769619644400748,3.95970695970696,5.083769147932374,['AQP4'],0.4810673966483311,0,0,1
962,Replication Fork Processing (GO:0031297),0.2769619644400748,3.95970695970696,5.083769147932374,['FAM111A'],0.4810673966483311,0,0,1
963,Response To UV-A (GO:0070141),0.2769619644400748,3.95970695970696,5.083769147932374,['MMP2'],0.4810673966483311,0,0,1
964,Cochlea Morphogenesis (GO:0090103),0.2769619644400748,3.95970695970696,5.083769147932374,['SOX9'],0.4810673966483311,0,0,1
965,Response To Axon Injury (GO:0048678),0.2769619644400748,3.95970695970696,5.083769147932374,['TYROBP'],0.4810673966483311,0,0,1
966,Response To dsRNA (GO:0043331),0.2769619644400748,3.95970695970696,5.083769147932374,['IRAK3'],0.4810673966483311,0,0,1
967,Defense Response To Tumor Cell (GO:0002357),0.2769619644400748,3.95970695970696,5.083769147932374,['LAPTM5'],0.4810673966483311,0,0,1
968,Dendritic Cell Migration (GO:0036336),0.2769619644400748,3.95970695970696,5.083769147932374,['EPS8'],0.4810673966483311,0,0,1
969,Response To Nutrient Levels (GO:0031667),0.2769619644400748,3.95970695970696,5.083769147932374,['UCP1'],0.4810673966483311,0,0,1
970,Ruffle Organization (GO:0031529),0.2769619644400748,3.95970695970696,5.083769147932374,['CSF1R'],0.4810673966483311,0,0,1
971,Embryonic Digit Morphogenesis (GO:0042733),0.2769619644400748,3.95970695970696,5.083769147932374,['TBX3'],0.4810673966483311,0,0,1
972,Embryonic Hemopoiesis (GO:0035162),0.2769619644400748,3.95970695970696,5.083769147932374,['TGFBR2'],0.4810673966483311,0,0,1
973,Embryonic Skeletal System Morphogenesis (GO:0048704),0.2769619644400748,3.95970695970696,5.083769147932374,['TGFBR2'],0.4810673966483311,0,0,1
974,Endolysosomal Toll-Like Receptor Signaling Pathway (GO:0140894),0.2769619644400748,3.95970695970696,5.083769147932374,['UNC93B1'],0.4810673966483311,0,0,1
975,Establishment Of Apical/Basal Cell Polarity (GO:0035089),0.2769619644400748,3.95970695970696,5.083769147932374,['EZR'],0.4810673966483311,0,0,1
976,Establishment Of Centrosome Localization (GO:0051660),0.2769619644400748,3.95970695970696,5.083769147932374,['EZR'],0.4810673966483311,0,0,1
977,Ganglioside Biosynthetic Process (GO:0001574),0.2769619644400748,3.95970695970696,5.083769147932374,['ST8SIA6'],0.4810673966483311,0,0,1
978,Gastrulation (GO:0007369),0.2769619644400748,3.95970695970696,5.083769147932374,['MESP1'],0.4810673966483311,0,0,1
979,Glutamine Family Amino Acid Metabolic Process (GO:0009064),0.2769619644400748,3.95970695970696,5.083769147932374,['UCP2'],0.4810673966483311,0,0,1
980,Glycosphingolipid Biosynthetic Process (GO:0006688),0.2769619644400748,3.95970695970696,5.083769147932374,['ST8SIA6'],0.4810673966483311,0,0,1
981,Lamellipodium Assembly (GO:0030032),0.2769619644400748,3.95970695970696,5.083769147932374,['S1PR1'],0.4810673966483311,0,0,1
982,Lamellipodium Organization (GO:0097581),0.2769619644400748,3.95970695970696,5.083769147932374,['S1PR1'],0.4810673966483311,0,0,1
983,Leukotriene Biosynthetic Process (GO:0019370),0.2769619644400748,3.95970695970696,5.083769147932374,['LTC4S'],0.4810673966483311,0,0,1
984,mRNA Export From Nucleus (GO:0006406),0.2769619644400748,3.95970695970696,5.083769147932374,['ALYREF'],0.4810673966483311,0,0,1
985,mRNA Transcription (GO:0009299),0.2769619644400748,3.95970695970696,5.083769147932374,['S100A10'],0.4810673966483311,0,0,1
986,mRNA Transcription By RNA Polymerase II (GO:0042789),0.2769619644400748,3.95970695970696,5.083769147932374,['S100A10'],0.4810673966483311,0,0,1
987,Microtubule Nucleation (GO:0007020),0.2769619644400748,3.95970695970696,5.083769147932374,['NEDD1'],0.4810673966483311,0,0,1
988,Mitochondrial Respirasome Assembly (GO:0097250),0.2769619644400748,3.95970695970696,5.083769147932374,['HIGD1B'],0.4810673966483311,0,0,1
989,Muscle Tissue Morphogenesis (GO:0060415),0.2769619644400748,3.95970695970696,5.083769147932374,['NOTCH1'],0.4810673966483311,0,0,1
990,Negative Regulation Of Activated T Cell Proliferation (GO:0046007),0.2769619644400748,3.95970695970696,5.083769147932374,['LILRB4'],0.4810673966483311,0,0,1
991,Negative Regulation Of Cell Activation (GO:0050866),0.2769619644400748,3.95970695970696,5.083769147932374,['C1QTNF1'],0.4810673966483311,0,0,1
992,Negative Regulation Of Cell Development (GO:0010721),0.2769619644400748,3.95970695970696,5.083769147932374,['NOTCH1'],0.4810673966483311,0,0,1
993,Negative Regulation Of Cell-Cell Adhesion Mediated By Cadherin (GO:2000048),0.2769619644400748,3.95970695970696,5.083769147932374,['NOTCH1'],0.4810673966483311,0,0,1
994,Negative Regulation Of Interleukin-12 Production (GO:0032695),0.2769619644400748,3.95970695970696,5.083769147932374,['IRAK3'],0.4810673966483311,0,0,1
995,Negative Regulation Of Long-Term Synaptic Potentiation (GO:1900272),0.2769619644400748,3.95970695970696,5.083769147932374,['TYROBP'],0.4810673966483311,0,0,1
996,Negative Regulation Of Myeloid Cell Differentiation (GO:0045638),0.2769619644400748,3.95970695970696,5.083769147932374,['ZFP36L1'],0.4810673966483311,0,0,1
997,Negative Regulation Of Protein Localization To Cell Periphery (GO:1904376),0.2769619644400748,3.95970695970696,5.083769147932374,['SAPCD2'],0.4810673966483311,0,0,1
998,Negative Regulation Of Protein Tyrosine Kinase Activity (GO:0061099),0.2769619644400748,3.95970695970696,5.083769147932374,['LILRB4'],0.4810673966483311,0,0,1
999,Negative Regulation Of Smooth Muscle Cell Migration (GO:0014912),0.2769619644400748,3.95970695970696,5.083769147932374,['AIF1'],0.4810673966483311,0,0,1
1000,Negative Regulation Of Toll-Like Receptor Signaling Pathway (GO:0034122),0.2769619644400748,3.95970695970696,5.083769147932374,['IRAK3'],0.4810673966483311,0,0,1
1001,Negative Regulation Of Ubiquitin-Dependent Protein Catabolic Process (GO:2000059),0.2769619644400748,3.95970695970696,5.083769147932374,['HFE'],0.4810673966483311,0,0,1
1002,Non-Canonical Wnt Signaling Pathway (GO:0035567),0.2769619644400748,3.95970695970696,5.083769147932374,['FZD2'],0.4810673966483311,0,0,1
1003,Nucleosome Assembly (GO:0006334),0.2769619644400748,3.95970695970696,5.083769147932374,['SOX9'],0.4810673966483311,0,0,1
1004,Nucleotide-Binding Oligomerization Domain Containing Signaling Pathway (GO:0070423),0.2769619644400748,3.95970695970696,5.083769147932374,['INAVA'],0.4810673966483311,0,0,1
1005,Organelle Fission (GO:0048285),0.2769619644400748,3.95970695970696,5.083769147932374,['UCP2'],0.4810673966483311,0,0,1
1006,Organic Cation Transport (GO:0015695),0.2769619644400748,3.95970695970696,5.083769147932374,['SLC6A12'],0.4810673966483311,0,0,1
1007,Phosphatidylcholine Biosynthetic Process (GO:0006656),0.2769619644400748,3.95970695970696,5.083769147932374,['LCAT'],0.4810673966483311,0,0,1
1008,Phospholipid Dephosphorylation (GO:0046839),0.2769619644400748,3.95970695970696,5.083769147932374,['PLPP3'],0.4810673966483311,0,0,1
1009,Polarized Epithelial Cell Differentiation (GO:0030859),0.2769619644400748,3.95970695970696,5.083769147932374,['EZR'],0.4810673966483311,0,0,1
1010,Positive Regulation Of G2/M Transition Of Mitotic Cell Cycle (GO:0010971),0.2769619644400748,3.95970695970696,5.083769147932374,['STOX1'],0.4810673966483311,0,0,1
1011,Positive Regulation Of Actin Nucleation (GO:0051127),0.2769619644400748,3.95970695970696,5.083769147932374,['SCIN'],0.4810673966483311,0,0,1
1012,Positive Regulation Of Cell Activation (GO:0050867),0.2769619644400748,3.95970695970696,5.083769147932374,['TLR4'],0.4810673966483311,0,0,1
1013,Positive Regulation Of Cell Cycle G2/M Phase Transition (GO:1902751),0.2769619644400748,3.95970695970696,5.083769147932374,['STOX1'],0.4810673966483311,0,0,1
1014,Positive Regulation Of Cyclin-Dependent Protein Kinase Activity (GO:1904031),0.2769619644400748,3.95970695970696,5.083769147932374,['STOX1'],0.4810673966483311,0,0,1
1015,Positive Regulation Of Fatty Acid Metabolic Process (GO:0045923),0.2769619644400748,3.95970695970696,5.083769147932374,['APOC2'],0.4810673966483311,0,0,1
1016,Positive Regulation Of Focal Adhesion Assembly (GO:0051894),0.2769619644400748,3.95970695970696,5.083769147932374,['S100A10'],0.4810673966483311,0,0,1
1017,Positive Regulation Of Leukocyte Adhesion To Vascular Endothelial Cell (GO:1904996),0.2769619644400748,3.95970695970696,5.083769147932374,['ITGB2'],0.4810673966483311,0,0,1
1018,Positive Regulation Of Lipid Catabolic Process (GO:0050996),0.2769619644400748,3.95970695970696,5.083769147932374,['APOC2'],0.4810673966483311,0,0,1
1019,Positive Regulation Of Lipid Localization (GO:1905954),0.2769619644400748,3.95970695970696,5.083769147932374,['C3'],0.4810673966483311,0,0,1
1020,Positive Regulation Of Macrophage Cytokine Production (GO:0060907),0.2769619644400748,3.95970695970696,5.083769147932374,['LAPTM5'],0.4810673966483311,0,0,1
1021,Positive Regulation Of Monocyte Differentiation (GO:0045657),0.2769619644400748,3.95970695970696,5.083769147932374,['ZFP36L1'],0.4810673966483311,0,0,1
1022,Positive Regulation Of Response To Cytokine Stimulus (GO:0060760),0.2769619644400748,3.95970695970696,5.083769147932374,['AXL'],0.4810673966483311,0,0,1
1023,Positive Regulation Of Syncytium Formation By Plasma Membrane Fusion (GO:0060143),0.2769619644400748,3.95970695970696,5.083769147932374,['TYROBP'],0.4810673966483311,0,0,1
1024,Positive Regulation Of Transcription From RNA Polymerase II Promoter In Response To Endoplasmic Reticulum Stress (GO:1990440),0.2769619644400748,3.95970695970696,5.083769147932374,['CEBPB'],0.4810673966483311,0,0,1
1025,Positive Regulation Of Transcription Regulatory Region DNA Binding (GO:2000679),0.2769619644400748,3.95970695970696,5.083769147932374,['FOXC1'],0.4810673966483311,0,0,1
1026,Positive Regulation Of Viral Process (GO:0048524),0.2769619644400748,3.95970695970696,5.083769147932374,['AXL'],0.4810673966483311,0,0,1
1027,Prostaglandin Biosynthetic Process (GO:0001516),0.2769619644400748,3.95970695970696,5.083769147932374,['TBXAS1'],0.4810673966483311,0,0,1
1028,Protein Kinase A Signaling (GO:0010737),0.2769619644400748,3.95970695970696,5.083769147932374,['EZR'],0.4810673966483311,0,0,1
1029,Protein Targeting To Lysosome (GO:0006622),0.2769619644400748,3.95970695970696,5.083769147932374,['LAPTM5'],0.4810673966483311,0,0,1
1030,Regulation Of B Cell Apoptotic Process (GO:0002902),0.2769619644400748,3.95970695970696,5.083769147932374,['BTK'],0.4810673966483311,0,0,1
1031,Regulation Of Actin Filament Length (GO:0030832),0.2769619644400748,3.95970695970696,5.083769147932374,['EPS8'],0.4810673966483311,0,0,1
1032,Regulation Of Actin Nucleation (GO:0051125),0.2769619644400748,3.95970695970696,5.083769147932374,['SCIN'],0.4810673966483311,0,0,1
1033,Regulation Of Animal Organ Morphogenesis (GO:2000027),0.2769619644400748,3.95970695970696,5.083769147932374,['SAPCD2'],0.4810673966483311,0,0,1
1034,Regulation Of Cell Activation (GO:0050865),0.2769619644400748,3.95970695970696,5.083769147932374,['SYK'],0.4810673966483311,0,0,1
1035,Negative Regulation Of Cell Differentiation (GO:0045596),0.2857961702537999,1.4529875782029196,1.8198326710514912,"['NOTCH1', 'SOX9', 'ASCL1', 'ZFP36L2', 'TBX3']",0.4931972387307331,0,0,5
1036,Regulation Of Cytoskeleton Organization (GO:0051493),0.28586766454270224,1.7000527148128624,2.1288506981545177,"['BST2', 'SYDE1', 'EZR']",0.4931972387307331,0,0,3
1037,Regulation Of Osteoblast Differentiation (GO:0045667),0.28586766454270224,1.7000527148128624,2.1288506981545177,"['NOTCH1', 'TMEM119', 'SOX9']",0.4931972387307331,0,0,3
1038,Cellular Response To Decreased Oxygen Levels (GO:0036294),0.28586766454270224,1.7000527148128624,2.1288506981545177,"['NOTCH1', 'EGLN2', 'ZFP36L1']",0.4931972387307331,0,0,3
1039,Cellular Response To Oxidative Stress (GO:0034599),0.28586766454270224,1.7000527148128624,2.1288506981545177,"['UCP1', 'AIF1', 'ZFP36L2']",0.4931972387307331,0,0,3
1040,Positive Regulation Of Cellular Component Organization (GO:0051130),0.28586766454270224,1.7000527148128624,2.1288506981545177,"['SYK', 'APOC2', 'S100A10']",0.4931972387307331,0,0,3
1041,Regulation Of T Cell Proliferation (GO:0042129),0.28586766454270224,1.7000527148128624,2.1288506981545177,"['SPN', 'CEBPB', 'LILRB4']",0.4931972387307331,0,0,3
1042,Regulation Of ERK1 And ERK2 Cascade (GO:0070372),0.28857347342149003,1.346381539205026,1.6732904514327918,"['NOTCH2', 'CSF1R', 'NOTCH1', 'SYK', 'P2RY1', 'EZR', 'TLR4']",0.4973876758781153,0,0,7
1043,Regulation Of Hydrolase Activity (GO:0051336),0.29840844117594284,1.9816176470588236,2.3963546112463248,"['FGD3', 'FGD4']",0.5075204169999937,0,0,2
1044,Activation Of Cysteine-Type Endopeptidase Activity Involved In Apoptotic Process (GO:0006919),0.29840844117594284,1.9816176470588236,2.3963546112463248,"['CARD8', 'LAPTM5']",0.5075204169999937,0,0,2
1045,Cellular Response To Fibroblast Growth Factor Stimulus (GO:0044344),0.29840844117594284,1.9816176470588236,2.3963546112463248,"['ZFP36L2', 'ZFP36L1']",0.5075204169999937,0,0,2
1046,Chloride Transport (GO:0006821),0.29840844117594284,1.9816176470588236,2.3963546112463248,"['SLC12A4', 'SLC12A7']",0.5075204169999937,0,0,2
1047,Response To Retinoic Acid (GO:0032526),0.29840844117594284,1.9816176470588236,2.3963546112463248,"['SOX9', 'ASCL1']",0.5075204169999937,0,0,2
1048,Vasculogenesis (GO:0001570),0.29840844117594284,1.9816176470588236,2.3963546112463248,"['NOTCH1', 'TGFBR2']",0.5075204169999937,0,0,2
1049,Myeloid Cell Differentiation (GO:0030099),0.29840844117594284,1.9816176470588236,2.3963546112463248,"['CEBPA', 'CEBPB']",0.5075204169999937,0,0,2
1050,Negative Regulation Of Cellular Biosynthetic Process (GO:0031327),0.29840844117594284,1.9816176470588236,2.3963546112463248,"['APOC1', 'ERFE']",0.5075204169999937,0,0,2
1051,Negative Regulation Of Cytokine-Mediated Signaling Pathway (GO:0001960),0.29840844117594284,1.9816176470588236,2.3963546112463248,"['CARD8', 'IRAK3']",0.5075204169999937,0,0,2
1052,Phosphatidylinositol Metabolic Process (GO:0046488),0.29840844117594284,1.9816176470588236,2.3963546112463248,"['CSF1R', 'INPP5D']",0.5075204169999937,0,0,2
1053,Phospholipid Metabolic Process (GO:0006644),0.29840844117594284,1.9816176470588236,2.3963546112463248,"['LCAT', 'PLPP3']",0.5075204169999937,0,0,2
1054,Positive Regulation Of Fat Cell Differentiation (GO:0045600),0.29840844117594284,1.9816176470588236,2.3963546112463248,"['CEBPB', 'ZFP36L1']",0.5075204169999937,0,0,2
1055,Positive Regulation Of Neurogenesis (GO:0050769),0.29840844117594284,1.9816176470588236,2.3963546112463248,"['VCAN', 'DISC1']",0.5075204169999937,0,0,2
1056,Positive Regulation Of Type II Interferon Production (GO:0032729),0.29840844117594284,1.9816176470588236,2.3963546112463248,"['CD14', 'TLR4']",0.5075204169999937,0,0,2
1057,Defense Response To Symbiont (GO:0140546),0.30628728995168486,1.487962962962963,1.7606050376065654,"['BST2', 'IFI27', 'CARD8', 'DDX60L']",0.5098985535723262,0,0,4
1058,Negative Regulation Of DNA-binding Transcription Factor Activity (GO:0043433),0.30628728995168486,1.487962962962963,1.7606050376065654,"['ADORA3', 'CARD8', 'NR0B1', 'IRAK3']",0.5098985535723262,0,0,4
1059,Regulation Of Transforming Growth Factor Beta Receptor Signaling Pathway (GO:0017015),0.30782685934287335,1.6222744045622275,1.911392578417872,"['LATS2', 'SLC2A10', 'TGFB1I1']",0.5098985535723262,0,0,3
1060,Positive Regulation Of Phosphatidylinositol 3-Kinase Signaling (GO:0014068),0.30782685934287335,1.6222744045622275,1.911392578417872,"['FLT1', 'SOX9', 'HCST']",0.5098985535723262,0,0,3
1061,Positive Regulation Of Transcription By RNA Polymerase II (GO:0045944),0.3084940114305825,1.1805914441573355,1.3884379298945018,"['MESP1', 'CEBPA', 'FOXC1', 'CEBPB', 'TFAP2C', 'NOTCH1', 'PRRX1', 'ASCL1', 'KLF15', 'TBX3', 'TFEC', 'ITGA6', 'CYTL1', 'SOX9', 'TLR4', 'S100A10']",0.5098985535723262,0,0,16
1062,Defense Response To Virus (GO:0051607),0.3244486057019075,1.4424242424242424,1.6236333103760323,"['BST2', 'IFI27', 'CARD8', 'DDX60L']",0.5098985535723262,0,0,4
1063,Regulation Of Cell Differentiation (GO:0045595),0.3244486057019075,1.4424242424242424,1.6236333103760323,"['CEBPB', 'SCIN', 'RUNX3', 'ZFP36L1']",0.5098985535723262,0,0,4
1064,B Cell Activation (GO:0042113),0.3280536684019754,1.8286199095022624,2.038139632684368,"['BLNK', 'BTK']",0.5098985535723262,0,0,2
1065,Response To Interleukin-1 (GO:0070555),0.3280536684019754,1.8286199095022624,2.038139632684368,"['IRAK3', 'SOX9']",0.5098985535723262,0,0,2
1066,Icosanoid Metabolic Process (GO:0006690),0.3280536684019754,1.8286199095022624,2.038139632684368,"['TBXAS1', 'LTC4S']",0.5098985535723262,0,0,2
1067,Intracellular Iron Ion Homeostasis (GO:0006879),0.3280536684019754,1.8286199095022624,2.038139632684368,"['HFE', 'ERFE']",0.5098985535723262,0,0,2
1068,Negative Regulation Of ERK1 And ERK2 Cascade (GO:0070373),0.3280536684019754,1.8286199095022624,2.038139632684368,"['EZR', 'TLR4']",0.5098985535723262,0,0,2
1069,Non-Membrane-Bounded Organelle Assembly (GO:0140694),0.3280536684019754,1.8286199095022624,2.038139632684368,"['BIN2', 'SAC3D1']",0.5098985535723262,0,0,2
1070,Positive Regulation Of NIK/NF-kappaB Signaling (GO:1901224),0.3280536684019754,1.8286199095022624,2.038139632684368,"['LAPTM5', 'TLR4']",0.5098985535723262,0,0,2
1071,Positive Regulation Of Cysteine-Type Endopeptidase Activity (GO:2001056),0.3280536684019754,1.8286199095022624,2.038139632684368,"['SYK', 'CARD8']",0.5098985535723262,0,0,2
1072,Regulation Of Cell Development (GO:0060284),0.3280536684019754,1.8286199095022624,2.038139632684368,"['ASCL1', 'S100A10']",0.5098985535723262,0,0,2
1073,Monoatomic Ion Transport (GO:0006811),0.32984478731344596,1.5512594256377346,1.7205531394263405,"['SLC12A4', 'PIEZO1', 'SLC12A7']",0.5098985535723262,0,0,3
1074,Apoptotic Process (GO:0006915),0.33293329337423083,1.3526529232848936,1.4876654443687196,"['NOTCH2', 'IFI27', 'ITGB2', 'CD14', 'TGFBR2']",0.5098985535723262,0,0,5
1075,Defense Response To Bacterium (GO:0042742),0.33293329337423083,1.3526529232848936,1.4876654443687196,"['SPN', 'CEBPB', 'SYK', 'ANXA3', 'TLR4']",0.5098985535723262,0,0,5
1076,Regulation Of Chemokine (C-X-C Motif) Ligand 2 Production (GO:2000341),0.3333078518340261,2.968864468864469,3.2618579509134555,['TLR4'],0.5098985535723262,0,0,1
1077,C4-dicarboxylate Transport (GO:0015740),0.3333078518340261,2.968864468864469,3.2618579509134555,['UCP2'],0.5098985535723262,0,0,1
1078,Regulation Of Collagen Biosynthetic Process (GO:0032965),0.3333078518340261,2.968864468864469,3.2618579509134555,['VIM'],0.5098985535723262,0,0,1
1079,Regulation Of Dendritic Spine Morphogenesis (GO:0061001),0.3333078518340261,2.968864468864469,3.2618579509134555,['PDLIM5'],0.5098985535723262,0,0,1
1080,G Protein-Coupled Acetylcholine Receptor Signaling Pathway (GO:0007213),0.3333078518340261,2.968864468864469,3.2618579509134555,['RGS10'],0.5098985535723262,0,0,1
1081,Regulation Of Epidermal Cell Differentiation (GO:0045604),0.3333078518340261,2.968864468864469,3.2618579509134555,['ZFP36L1'],0.5098985535723262,0,0,1
1082,Golgi To Plasma Membrane Protein Transport (GO:0043001),0.3333078518340261,2.968864468864469,3.2618579509134555,['VAMP5'],0.5098985535723262,0,0,1
1083,I-kappaB Phosphorylation (GO:0007252),0.3333078518340261,2.968864468864469,3.2618579509134555,['TLR4'],0.5098985535723262,0,0,1
1084,Regulation Of Fatty Acid Oxidation (GO:0046320),0.3333078518340261,2.968864468864469,3.2618579509134555,['SOX9'],0.5098985535723262,0,0,1
1085,Regulation Of Granulocyte Differentiation (GO:0030852),0.3333078518340261,2.968864468864469,3.2618579509134555,['C1QC'],0.5098985535723262,0,0,1
1086,RNA Export From Nucleus (GO:0006405),0.3333078518340261,2.968864468864469,3.2618579509134555,['ALYREF'],0.5098985535723262,0,0,1
1087,Acetylcholine Receptor Signaling Pathway (GO:0095500),0.3333078518340261,2.968864468864469,3.2618579509134555,['RGS10'],0.5098985535723262,0,0,1
1088,Actin Nucleation (GO:0045010),0.3333078518340261,2.968864468864469,3.2618579509134555,['SCIN'],0.5098985535723262,0,0,1
1089,Regulation Of Lipid Storage (GO:0010883),0.3333078518340261,2.968864468864469,3.2618579509134555,['C3'],0.5098985535723262,0,0,1
1090,Acute Inflammatory Response (GO:0002526),0.3333078518340261,2.968864468864469,3.2618579509134555,['CEBPB'],0.5098985535723262,0,0,1
1091,Regulation Of Mitotic Spindle Organization (GO:0060236),0.3333078518340261,2.968864468864469,3.2618579509134555,['EML3'],0.5098985535723262,0,0,1
1092,Antiviral Innate Immune Response (GO:0140374),0.3333078518340261,2.968864468864469,3.2618579509134555,['CARD8'],0.5098985535723262,0,0,1
1093,Regulation Of Monocyte Differentiation (GO:0045655),0.3333078518340261,2.968864468864469,3.2618579509134555,['ZFP36L1'],0.5098985535723262,0,0,1
1094,Regulation Of Nucleocytoplasmic Transport (GO:0046822),0.3333078518340261,2.968864468864469,3.2618579509134555,['IFI27'],0.5098985535723262,0,0,1
1095,Regulation Of Phospholipase C Activity (GO:1900274),0.3333078518340261,2.968864468864469,3.2618579509134555,['FLT1'],0.5098985535723262,0,0,1
1096,Regulation Of Plasminogen Activation (GO:0010755),0.3333078518340261,2.968864468864469,3.2618579509134555,['S100A10'],0.5098985535723262,0,0,1
1097,Cell Projection Assembly (GO:0030031),0.3333078518340261,2.968864468864469,3.2618579509134555,['SCIN'],0.5098985535723262,0,0,1
1098,Cell-Cell Signaling By Wnt (GO:0198738),0.3333078518340261,2.968864468864469,3.2618579509134555,['FZD2'],0.5098985535723262,0,0,1
1099,Cell-Substrate Junction Assembly (GO:0007044),0.3333078518340261,2.968864468864469,3.2618579509134555,['ITGA6'],0.5098985535723262,0,0,1
1100,Regulation Of Secretion (GO:0051046),0.3333078518340261,2.968864468864469,3.2618579509134555,['SCIN'],0.5098985535723262,0,0,1
1101,Regulation Of Sensory Perception Of Pain (GO:0051930),0.3333078518340261,2.968864468864469,3.2618579509134555,['TMEM100'],0.5098985535723262,0,0,1
1102,Cellular Response To Glucose Stimulus (GO:0071333),0.3333078518340261,2.968864468864469,3.2618579509134555,['UCP2'],0.5098985535723262,0,0,1
1103,Regulation Of Transcription From RNA Polymerase II Promoter In Response To Stress (GO:0043618),0.3333078518340261,2.968864468864469,3.2618579509134555,['STOX1'],0.5098985535723262,0,0,1
1104,Regulation Of Transmembrane Receptor Protein Serine/Threonine Kinase Signaling Pathway (GO:0090092),0.3333078518340261,2.968864468864469,3.2618579509134555,['LATS2'],0.5098985535723262,0,0,1
1105,Cellular Response To Osmotic Stress (GO:0071470),0.3333078518340261,2.968864468864469,3.2618579509134555,['ZFP36L1'],0.5098985535723262,0,0,1
1106,Regulation Of Ubiquitin-Protein Transferase Activity (GO:0051438),0.3333078518340261,2.968864468864469,3.2618579509134555,['DTX3L'],0.5098985535723262,0,0,1
1107,Cellular Response To Type I Interferon (GO:0071357),0.3333078518340261,2.968864468864469,3.2618579509134555,['IFI27'],0.5098985535723262,0,0,1
1108,Regulation Of Vascular Endothelial Growth Factor Production (GO:0010574),0.3333078518340261,2.968864468864469,3.2618579509134555,['C3'],0.5098985535723262,0,0,1
1109,Response To ATP (GO:0033198),0.3333078518340261,2.968864468864469,3.2618579509134555,['P2RY1'],0.5098985535723262,0,0,1
1110,Coronary Vasculature Morphogenesis (GO:0060977),0.3333078518340261,2.968864468864469,3.2618579509134555,['NOTCH1'],0.5098985535723262,0,0,1
1111,Detection Of Mechanical Stimulus (GO:0050982),0.3333078518340261,2.968864468864469,3.2618579509134555,['PIEZO1'],0.5098985535723262,0,0,1
1112,Secondary Palate Development (GO:0062009),0.3333078518340261,2.968864468864469,3.2618579509134555,['TGFBR2'],0.5098985535723262,0,0,1
1113,Embryonic Limb Morphogenesis (GO:0030326),0.3333078518340261,2.968864468864469,3.2618579509134555,['TBX3'],0.5098985535723262,0,0,1
1114,Endothelium Development (GO:0003158),0.3333078518340261,2.968864468864469,3.2618579509134555,['MESP1'],0.5098985535723262,0,0,1
1115,Epithelial Cell-Cell Adhesion (GO:0090136),0.3333078518340261,2.968864468864469,3.2618579509134555,['ITGB5'],0.5098985535723262,0,0,1
1116,Epithelial To Mesenchymal Transition Involved In Endocardial Cushion Formation (GO:0003198),0.3333078518340261,2.968864468864469,3.2618579509134555,['NOTCH1'],0.5098985535723262,0,0,1
