Rank,Term name,P-value,Z-score,Combined score,Overlapping genes,Adjusted p-value,Old p-value,Old adjusted p-value,gene count
1,Cytoplasmic Ribosomal Proteins WP477,0.0016189923823754023,18.20689655172414,116.99663073738165,"['RPS26', 'RPS27', 'RPS15A', 'RPL26', 'RPS27A', 'RPL10A']",0.12466241344290598,0,0,6
2,MAPK Signaling Pathway WP382,0.0442951404143423,5.833333333333333,18.1818017799915,"['DUSP4', 'DDIT3', 'PRKCD', 'FGF1']",0.5680032122024355,0,0,4
3,IL-6 signaling pathway WP364,0.06970930776545906,inf,inf,"['PRKCD', 'VIP']",0.5680032122024355,0,0,2
4,Type II interferon signaling (IFNG) WP619,0.06970930776545906,inf,inf,"['PRKCD', 'HLA-B']",0.5680032122024355,0,0,2
5,Myometrial relaxation and contraction pathways WP289,0.11835312369376129,4.30327868852459,9.183551955572115,"['RGS16', 'PRKCD', 'CRH']",0.5680032122024355,0,0,3
6,Osteoblast differentiation WP4787,0.1729609403862169,5.67741935483871,9.962108061416618,"['PRKCD', 'FGF1']",0.5680032122024355,0,0,2
7,Calcium Regulation in the Cardiac Cell WP536,0.1729609403862169,5.67741935483871,9.962108061416618,"['RGS16', 'PRKCD']",0.5680032122024355,0,0,2
8,Corticotropin-releasing hormone signaling pathway WP2355,0.1729609403862169,5.67741935483871,9.962108061416618,"['PRKCD', 'CRH']",0.5680032122024355,0,0,2
9,VEGFA-VEGFR2 Signaling Pathway WP3888,0.2583045286896364,1.9,2.571870488084497,"['TRPC3', 'PRKCD', 'RPL26', 'RPL10A']",0.5680032122024355,0,0,4
10,Serotonin and anxiety WP3947,0.2655599433673725,inf,inf,['CRH'],0.5680032122024355,0,0,1
11,Serotonin and anxiety-related events WP3944,0.2655599433673725,inf,inf,['CRH'],0.5680032122024355,0,0,1
12,AGE/RAGE pathway WP2324,0.2655599433673725,inf,inf,['PRKCD'],0.5680032122024355,0,0,1
13,Alpha 6 Beta 4 signaling pathway WP244,0.2655599433673725,inf,inf,['PRKCD'],0.5680032122024355,0,0,1
14,ESC Pluripotency Pathways WP3931,0.2655599433673725,inf,inf,['FGF1'],0.5680032122024355,0,0,1
15,Sudden Infant Death Syndrome (SIDS) Susceptibility Pathways WP706,0.2655599433673725,inf,inf,['SST'],0.5680032122024355,0,0,1
16,EV release from cardiac cells and their functional effects WP3297,0.2655599433673725,inf,inf,['RGS16'],0.5680032122024355,0,0,1
17,Synaptic Vesicle Pathway WP2267,0.2655599433673725,inf,inf,['SLC32A1'],0.5680032122024355,0,0,1
18,B Cell Receptor Signaling Pathway WP23,0.2655599433673725,inf,inf,['PRKCD'],0.5680032122024355,0,0,1
19,BDNF-TrkB Signaling WP3676,0.2655599433673725,inf,inf,['TRPC3'],0.5680032122024355,0,0,1
20,p38 MAPK Signaling Pathway WP400,0.2655599433673725,inf,inf,['DDIT3'],0.5680032122024355,0,0,1
21,BMP2-WNT4-FOXO1 pathway in primary endometrial stromal cell differentiation WP3876,0.2655599433673725,inf,inf,['SST'],0.5680032122024355,0,0,1
22,GABA receptor Signaling WP4159,0.2655599433673725,inf,inf,['SLC32A1'],0.5680032122024355,0,0,1
23,Galanin receptor pathway WP4970,0.2655599433673725,inf,inf,['PRKCD'],0.5680032122024355,0,0,1
24,Gastric acid production WP2596,0.2655599433673725,inf,inf,['VIP'],0.5680032122024355,0,0,1
25,Metabolic reprogramming in colon cancer WP4290,0.2655599433673725,inf,inf,['PGAM1'],0.5680032122024355,0,0,1
26,Transcriptional cascade regulating adipogenesis WP4211,0.2655599433673725,inf,inf,['DDIT3'],0.5680032122024355,0,0,1
27,Translation inhibitors in chronically activated PDGFRA cells WP4566,0.2655599433673725,inf,inf,['PRKCD'],0.5680032122024355,0,0,1
28,PKC-gamma calcium signaling pathway in ataxia WP4760,0.2655599433673725,inf,inf,['TRPC3'],0.5680032122024355,0,0,1
29,Pre-implantation embryo WP3527,0.2655599433673725,inf,inf,['DDIT3'],0.5680032122024355,0,0,1
30,Type II diabetes mellitus WP1584,0.2655599433673725,inf,inf,['PRKCD'],0.5680032122024355,0,0,1
31,Glycogen Synthesis and Degradation WP500,0.2655599433673725,inf,inf,['PHKG1'],0.5680032122024355,0,0,1
32,Glycolysis and Gluconeogenesis WP534,0.2655599433673725,inf,inf,['PGAM1'],0.5680032122024355,0,0,1
33,Purinergic signaling WP4900,0.2655599433673725,inf,inf,['P2RY14'],0.5680032122024355,0,0,1
34,Mitochondrial complex I assembly model OXPHOS system WP4324,0.2655599433673725,inf,inf,['NDUFB11'],0.5680032122024355,0,0,1
35,Cori Cycle WP1946,0.2655599433673725,inf,inf,['PGAM1'],0.5680032122024355,0,0,1
36,Hair Follicle Development: Organogenesis - Part 2 of 3 WP2839,0.2655599433673725,inf,inf,['FGF1'],0.5680032122024355,0,0,1
37,Nonalcoholic fatty liver disease WP4396,0.40025157240604825,1.8709677419354838,1.7131740618093232,"['NDUFB11', 'DDIT3']",0.6021796595832088,0,0,2
38,Circadian rhythm related genes WP3594,0.40025157240604825,1.8709677419354838,1.7131740618093232,"['CRH', 'RPS27A']",0.6021796595832088,0,0,2
39,"GPCRs, Class A Rhodopsin-like WP455",0.40025157240604825,1.8709677419354838,1.7131740618093232,"['P2RY14', 'MCHR1']",0.6021796595832088,0,0,2
40,EGF/EGFR signaling pathway WP437,0.4614103885118094,2.7936507936507935,2.160797866994407,['PRKCD'],0.6021796595832088,0,0,1
41,"Non-genomic actions of 1,25 dihydroxyvitamin D3 WP4341",0.4614103885118094,2.7936507936507935,2.160797866994407,['PRKCD'],0.6021796595832088,0,0,1
42,Sleep regulation WP3591,0.4614103885118094,2.7936507936507935,2.160797866994407,['CRH'],0.6021796595832088,0,0,1
43,Endoplasmic reticulum stress response in coronavirus infection WP4861,0.4614103885118094,2.7936507936507935,2.160797866994407,['DDIT3'],0.6021796595832088,0,0,1
44,Kisspeptin/kisspeptin receptor system in the ovary WP4871,0.4614103885118094,2.7936507936507935,2.160797866994407,['PRKCD'],0.6021796595832088,0,0,1
45,T-cell receptor (TCR) signaling pathway WP69,0.4614103885118094,2.7936507936507935,2.160797866994407,['PRKCD'],0.6021796595832088,0,0,1
46,Lung fibrosis WP3624,0.4614103885118094,2.7936507936507935,2.160797866994407,['FGF1'],0.6021796595832088,0,0,1
47,Brain-derived neurotrophic factor (BDNF) signaling pathway WP2380,0.4614103885118094,2.7936507936507935,2.160797866994407,['PRKCD'],0.6021796595832088,0,0,1
48,MECP2 and Associated Rett Syndrome WP3584,0.4614103885118094,2.7936507936507935,2.160797866994407,['SST'],0.6021796595832088,0,0,1
49,Gastrin signaling pathway WP4659,0.4614103885118094,2.7936507936507935,2.160797866994407,['PRKCD'],0.6021796595832088,0,0,1
50,Genotoxicity pathway WP4286,0.4614103885118094,2.7936507936507935,2.160797866994407,['RPS27'],0.6021796595832088,0,0,1
51,Chemokine signaling pathway WP3929,0.4614103885118094,2.7936507936507935,2.160797866994407,['PRKCD'],0.6021796595832088,0,0,1
52,Glioblastoma signaling pathways WP2261,0.4614103885118094,2.7936507936507935,2.160797866994407,['PRKCD'],0.6021796595832088,0,0,1
53,Ciliary landscape WP4352,0.4614103885118094,2.7936507936507935,2.160797866994407,['COPS7A'],0.6021796595832088,0,0,1
54,Unfolded protein response WP4925,0.4614103885118094,2.7936507936507935,2.160797866994407,['DDIT3'],0.6021796595832088,0,0,1
55,Control of immune tolerance by vasoactive intestinal peptide WP4484,0.4614103885118094,2.7936507936507935,2.160797866994407,['VIP'],0.6021796595832088,0,0,1
56,White fat cell differentiation WP4149,0.4614103885118094,2.7936507936507935,2.160797866994407,['DDIT3'],0.6021796595832088,0,0,1
57,Regulation of Actin Cytoskeleton WP51,0.4614103885118094,2.7936507936507935,2.160797866994407,['FGF1'],0.6021796595832088,0,0,1
58,Differentiation Pathway WP2848,0.4614103885118094,2.7936507936507935,2.160797866994407,['FGF1'],0.6021796595832088,0,0,1
59,Host-pathogen interaction of human coronaviruses - MAPK signaling WP4877,0.4614103885118094,2.7936507936507935,2.160797866994407,['DDIT3'],0.6021796595832088,0,0,1
60,IL-18 signaling pathway WP4754,0.5959752457869946,1.1096774193548387,0.5743203692343912,"['RGS16', 'PRKCD']",0.6857925440824707,0,0,2
61,Ebola Virus Pathway on Host WP4217,0.6056349739949092,1.3888888888888888,0.6964969827001043,['HLA-B'],0.6857925440824707,0,0,1
62,Endoderm differentiation WP2853,0.6056349739949092,1.3888888888888888,0.6964969827001043,['DUSP4'],0.6857925440824707,0,0,1
63,Endometrial cancer WP4155,0.6056349739949092,1.3888888888888888,0.6964969827001043,['FGF1'],0.6857925440824707,0,0,1
64,Pancreatic adenocarcinoma pathway WP4263,0.6056349739949092,1.3888888888888888,0.6964969827001043,['PRKCD'],0.6857925440824707,0,0,1
65,G Protein Signaling Pathways WP35,0.6056349739949092,1.3888888888888888,0.6964969827001043,['PRKCD'],0.6857925440824707,0,0,1
66,Photodynamic therapy-induced unfolded protein response WP3613,0.6056349739949092,1.3888888888888888,0.6964969827001043,['DDIT3'],0.6857925440824707,0,0,1
67,Proteasome Degradation WP183,0.6056349739949092,1.3888888888888888,0.6964969827001043,['HLA-B'],0.6857925440824707,0,0,1
68,RAC1/PAK1/p38/MMP2 Pathway WP3303,0.6056349739949092,1.3888888888888888,0.6964969827001043,['ANGPTL1'],0.6857925440824707,0,0,1
69,Adipogenesis WP236,0.71168243832315,0.9206349206349206,0.31312955361878686,['DDIT3'],0.7405344290659804,0,0,1
70,Insulin Signaling WP481,0.71168243832315,0.9206349206349206,0.31312955361878686,['PRKCD'],0.7405344290659804,0,0,1
71,Oncostatin M Signaling Pathway WP2374,0.71168243832315,0.9206349206349206,0.31312955361878686,['PRKCD'],0.7405344290659804,0,0,1
72,Pathways Regulating Hippo Signaling WP4540,0.71168243832315,0.9206349206349206,0.31312955361878686,['PRKCD'],0.7405344290659804,0,0,1
73,Breast cancer pathway WP4262,0.71168243832315,0.9206349206349206,0.31312955361878686,['FGF1'],0.7405344290659804,0,0,1
74,Wnt signaling pathway and pluripotency WP399,0.71168243832315,0.9206349206349206,0.31312955361878686,['PRKCD'],0.7405344290659804,0,0,1
75,Allograft Rejection WP2328,0.7895400387499535,0.6865079365079365,0.16222507430447872,['HLA-B'],0.7999287234703476,0,0,1
76,Focal Adhesion-PI3K-Akt-mTOR-signaling pathway WP3932,0.7895400387499535,0.6865079365079365,0.16222507430447872,['FGF1'],0.7999287234703476,0,0,1
77,PI3K-Akt signaling pathway WP4172,0.8466135850578065,0.546031746031746,0.0909202398719654,['FGF1'],0.8466135850578065,0,0,1
